Artist_Album,Label,Country,Format,Notes,Genre,Release_Date,Style,Rate_Haves_Wants,Media_Condition,Sleeve_Condition,Seller_Rating,Recorded_at,Pressed_by,Price
The Horace Silver Quintet – Doin' The Thing - At The Village Gate,Blue Note – BLP 4076,US,"Vinyl, LP, Album, Repress, Mono","Recorded on May 19 & 20, 1961.

Blue Mitchell performs by courtesy of Riverside Records.

Early Mono repress has:
- blue/white Blue Note Records Inc - New York Usa labels
- no deep groove on either side
- RVG stamped in the dead wax, both sides
- ""P"" (otherwise wrongly called ""ear"") for Plastylite plant etched in the trail off, both sides,
- laminated jacket,
- back cover does not advertise The Horace Silver Quintet - The Tokyo Blues as other represses do (this one is earliest repress from 1962)
- 43 West 61st St., New York 23 address on back cover",Jazz,1962,Hard Bop,"Rated 4.50 of 8 votes (84 have, 37 want)",Very Good Plus (VG+),Sleeve: Very Good Plus (VG+),100.0%,Village Gate,Plastylite,$45.00
Horace Silver – You Gotta Take A Little Love / Down And Out,Blue Note – 45-1946,US,"Vinyl, 7"", 45 RPM, Promo","""You Gotta Take A Little Love"" (Plug Side)",Jazz,1969,Hard Bop,"Rated 4.00 of 1 votes (0 have, 4 want)",Near Mint (NM or M-),Sleeve: Generic,100.0%,nan,nan,$45.00
Art Blakey – Orgy In Rhythm - Volume One,Blue Note – BST 1554,US,"Vinyl, LP, Album, Repress, Stereo","With golden ""STEREO"" sticker on cover, top left. Deep groove labels.

Recorded live at Manhattan Towers on March 7, 1957
Label: Blue Note Records Inc · New York USA
Sleeve: 43 West 61st St., New York 23","Jazz, Latin",1962,"Afro-Cuban Jazz, Hard Bop","Rated 5.00 of 4 votes (48 have, 120 want)",Very Good (VG),Sleeve: Very Good Plus (VG+),100.0%,Manhattan Towers,nan,$45.00
Max Roach – Drums Unlimited,Atlantic – 1467,US,"Vinyl, LP, Album, Mono","Gatefold Sleeve. Red/Plum Atlantic label.
Recorded October 14, 1965 and April 25, 1966.",Jazz,1966,Hard Bop,"Rated 4.18 of 17 votes (121 have, 107 want)",Very Good Plus (VG+),Sleeve: Very Good Plus (VG+),99.1%,nan,nan,$45.99
Art Blakey And The Jazz Messengers* – Drum Suite,Columbia – CL 1002,US,"Vinyl, LP, Album, Mono","6-eye label.

Side A recorded Feb. 22, 1957
Side B recorded Dec. 13, 1956",Jazz,1957,"Afro-Cuban Jazz, Hard Bop","Rated 4.34 of 135 votes (1181 have, 447 want)",Very Good Plus (VG+),Sleeve: Very Good (VG),99.5%,nan,nan,$45.00
Horace Silver Quintet* / Sextet* – The Jody Grind,Blue Note – BLP 4250,US,"Vinyl, LP, Album, Mono, Gatefold","Recorded at the Van Gelder Studio, Englewood Cliffs, New Jersey on November 2, 1966 (quintet) and November 23, 1966 (sextet).

The 1st MONO original issue has:
- Blue & white labels with ""A division Of Liberty Records, Inc.""
- Van Gelder stamped in the trail off
- Non laminated gatefold jacket with ""43 West 61st St., New York 23"" address inside the gatefold and ""© LIBERTY RECORDS, INC."" on back.
- Cover on front has ""BLP 4250"" only, while STEREO copies have ""BST 84250"" as well.
- 114 etched in side 2 run-out, denotes a pressing by All Disc Records, Inc.",Jazz,1967,"Soul-Jazz, Hard Bop","Rated 4.42 of 52 votes (381 have, 231 want)",Very Good (VG),Sleeve: Very Good (VG),100.0%,"Van Gelder Studio, Englewood Cliffs, New Jersey","All Disc Records, Inc.",$45.00
Mose Allison – Local Color,"Prestige – 7121, Prestige – PRLP 7121",US,"Vinyl, LP, Album","First issue with '446 W. 50th St., N.Y.C.' yellow/black 'fireworks' labels.

Rudy Van Gelder Studio, Hackensack, NJ, November 8, 1957 [jazzdisco.org].",Jazz,1958,Hard Bop,"Rated 4.31 of 16 votes (121 have, 118 want)",Very Good (VG),Sleeve: Very Good Plus (VG+),100.0%,"Van Gelder Studio, Hackensack, New Jersey","Abbey Record Manufacturing Co., Inc.",$45.00
Red Garland – The Nearness Of You,JAZZLAND – JLP 962,US,"Vinyl, LP, Album, Stereo","Similar to the other first stereo pressing Red Garland - The Nearness Of You, with black & silver deep groove Jazzland labels and a completely different layout to the back cover that's closer to the Red Garland - The Nearness Of You mono pressing. ""Jazzland JLP 962 Stereophonic"" is in the top left corner as opposed to top right, and different sets of photos are used. A stereo band goes across the top front cover with ""Jazzland"" boxed above the title.",Jazz,1962,"Hard Bop, Easy Listening","Rated 4.50 of 2 votes (7 have, 25 want)",Near Mint (NM or M-),Sleeve: Very Good Plus (VG+),100.0%,Plaza Sound Studios,nan,$45.00
The Red Garland Trio – Manteca,"Prestige – 7139, Prestige – PRLP 7139",US,"Vinyl, LP, Album, Mono","PRESTIGE RECORDS INC., 203 SO. WASHINGTON AVE., BERGENFIELD, N.J. address on label and back cover",Jazz,1958,Hard Bop,"Rated 4.00 of 3 votes (23 have, 34 want)",Good Plus (G+),Sleeve: Good Plus (G+),100.0%,nan,nan,$45.00
"Coltrane* – ""Live"" At The Village Vanguard",Impulse! – A-10,US,"Vinyl, LP, Album, Mono","Recorded at The Village Vanguard, NYC, November 2 and 3, 1961.
Also available in Stereo as AS-10
Comes in a gatefold sleeve.

Erice Dolphy appears courtesy Prestige Records.",Jazz,1963,"Modal, Hard Bop","Rated 4.61 of 31 votes (231 have, 233 want)",Very Good Plus (VG+),Sleeve: Good (G),92.9%,Village Vanguard,nan,$45.00
Miles Davis – 'Round About Midnight,Columbia – CL 949,US,"Vinyl, LP, Album, Mono","Original mono pressing on the deep groove 6-eye label.

Label variation: album title and artist name each written on 2 lines (4 lines total) above the spindle hole and the small Columbia ""eye"" symbol is to the bottom-left of the circled ""LP"" at bottom of labels.

Liner notes: ""Dear Old Stockholm is a Swedish folk tune...""
The back seam reads: The Miles Davis Quintet",Jazz,04 Mar 1957,Hard Bop,"Rated 4.56 of 210 votes (1943 have, 1471 want)",Very Good (VG),Sleeve: Good (G),100.0%,nan,nan,$45.00
Gil Evans Orchestra* Featuring Cannonball Adderley – New Bottle Old Wine,World Pacific Records – WP-1298,US,"Vinyl, LP, Album, Mono","Alternate back cover with Gil Evans pictured and ""BEST JAZZ RECORD 1959 London News-Chronicle Award"" printed over the image.",Jazz,1960,"Hard Bop, Soul-Jazz","Rated 4.00 of 2 votes (14 have, 19 want)",Near Mint (NM or M-),Sleeve: Very Good Plus (VG+),99.5%,nan,nan,$45.00
Ron Jefferson – Love Lifted Me,Pacific Jazz – Stereo-36,US,"Vinyl, LP",Stereo release,Jazz,1962,Hard Bop,"Rated 4.00 of 3 votes (16 have, 38 want)",Very Good Plus (VG+),Sleeve: Very Good (VG),99.5%,nan,nan,$45.00
Gil Evans Orchestra* Featuring Cannonball Adderley – New Bottle Old Wine,World Pacific Records – WP-1246,US,"Vinyl, LP, Mono, Album","Virtually the same as other Mono WP-1246 but with slight label variation ""High Fidelity Recording"" left of the spindle hole instead of a bottom of label and with ""(ST-773)"" left of the spindle instead of ""773"" to the right of the spindle hole. This cover does not have ""Best Jazz Record"" award label printed on the front.

Back cover describes this album as Strobophonic, High Fidelity, Long Playing",Jazz,1958,"Hard Bop, Soul-Jazz","Rated 4.71 of 7 votes (75 have, 75 want)",Very Good Plus (VG+),Sleeve: Very Good Plus (VG+),100.0%,nan,nan,$45.00
Chet Baker – The Trumpet Artistry Of Chet Baker,Pacific Jazz – PJ-1206,US,"Vinyl, LP, Album, Mono",Original US pressing. Black label with silver print. Staggered upper- and lower-case lettering at top.,Jazz,1955,"Hard Bop, Modal","Rated 4.44 of 32 votes (250 have, 221 want)",Very Good (VG),Sleeve: Very Good Plus (VG+),99.5%,nan,nan,$45.00
Sonny Red With Grant Green And Barry Harris (2) – The Mode,Jazzland – JLP 959,US,"Vinyl, LP, Album, Stereo","Recorded at Plaza Sound Studios, New York City on May 29 (A2, A4, B2, B3) and December 14 (A1, A3, B1), 1961.
Stereophonic Version of JLP 59 with black labels on vinyl.",Jazz,1962,Hard Bop,"Rated 4.33 of 6 votes (53 have, 165 want)",Very Good Plus (VG+),Sleeve: Very Good Plus (VG+),99.6%,Plaza Sound Studios,nan,$45.00
The Incredible Jimmy Smith* – Midnight Special,Blue Note – BLP 4078,US,"Vinyl, LP, Album, Mono, No DG","Recorded on April 25, 1960.
For Complete Catalog Write to ""Blue Note Records Inc., 43 West 61st St., New York 23
White/Blue non-DG ""Blue Note Records Inc. New York USA"" label with ®
RVG stamped and Plastylite ""P"" on both sides","Jazz, Blues",1961,"Soul-Jazz, Hard Bop","Rated 4.38 of 84 votes (1011 have, 263 want)",Very Good (VG),Sleeve: Very Good Plus (VG+),99.5%,"Van Gelder Studio, Englewood Cliffs, New Jersey",Plastylite,$45.00
Chet Baker – The Trumpet Artistry Of Chet Baker,Pacific Jazz – PJ-1206,US,"Vinyl, LP, Album, Mono",Original US pressing. Black label with silver print. Staggered upper- and lower-case lettering at top.,Jazz,1955,"Hard Bop, Modal","Rated 4.44 of 32 votes (250 have, 221 want)",Very Good (VG),Sleeve: Good Plus (G+),99.7%,nan,nan,$45.00
John Coltrane – The Best Of John Coltrane,Atlantic – SD 1541,US,"Vinyl, LP, Compilation, Promo","#A1 recorded on October 21, 1960
#A2 recorded on December 2, 1959
#A3 recorded on May 5, 1959
#B1 recorded on October 26, 1960
#B2 recorded on May 4, 1959
#A3 recorded on October 24, 1960

""AT/GP"" in the deadwax identifies that both sides were vinyl mastered by George Piros.

Pressed at a variety of plants that can be easily identified by the last 2-3 digits on the labels. These correspond to:
PR = Presswell
RI = Richmond Indiana
MO = Monarch
SP = Specialty Records
CT or CTH = Columbia, Terra Haute",Jazz,1970,Hard Bop,"No Rating Yet (27 have, 24 want)",Very Good Plus (VG+),Sleeve: Very Good Plus (VG+),98.5%,nan,nan,$45.00
Duke Ellington & John Coltrane – Duke Ellington & John Coltrane,Impulse! – AS-30,US,"Vinyl, LP, Album, Stereo","Original stereo pressing with “A PRODUCT OF AM-PAR RECORD CORP.” on labels.

Recorded at Van Gelder Recording Studio, Englewood Cliffs, NJ on September 26, 1962.

Also available in Mono as Duke Ellington & John Coltrane.",Jazz,1963,"Hard Bop, Cool Jazz","Rated 5.00 of 7 votes (37 have, 215 want)",Good (G),Sleeve: Very Good (VG),99.9%,"Van Gelder Studio, Englewood Cliffs, New Jersey",nan,$45.29
Thad Jones / Pepper Adams Quintet – Mean What You Say,Milestone (4) – MSP 9001,US,"Vinyl, LP, Album, Stereo","Recorded on April 26, May 4 and 9, 1966",Jazz,1966,Hard Bop,"Rated 4.25 of 12 votes (97 have, 53 want)",Near Mint (NM or M-),Sleeve: Mint (M),100.0%,Plaza Sound Studios,nan,$45.00
McCoy Tyner – Tender Moments,Blue Note – BST 84275,US,"Vinyl, LP, Album, Stereo","Recorded on December 1, 1967.

""A Division of Liberty Records, Inc."" on labels.
""VAN GELDER"" stamped in run-out.",Jazz,1968,Hard Bop,"Rated 4.46 of 41 votes (378 have, 271 want)",Near Mint (NM or M-),Sleeve: Very Good (VG),99.7%,"Van Gelder Studio, Englewood Cliffs, New Jersey",nan,$45.95
The Dave Brubeck Quartet – Time Further Out (Miro Reflections),Columbia – CS 8490,US,"Vinyl, LP, Stereo","2-eye Columbia logo on record with ""360 Sound"" in black.",Jazz,1962,Hard Bop,"Rated 4.19 of 16 votes (159 have, 56 want)",Very Good Plus (VG+),Sleeve: Very Good (VG),82.3%,nan,nan,$45.87
Jimmy Smith – House Party,"Blue Note – BST 84002, BLP 4002",US,"Vinyl, LP, Album, Reissue, Stereo","Recorded at Manhattan Towers, NYC; August 25, 1957 (tracks B1 & B2) & February 25, 1958 (tracks A1 & A2). This blue/black Liberty/UA label pressing was released in 1970.",Jazz,1970,"Hard Bop, Bop","Rated 4.25 of 4 votes (46 have, 35 want)",Very Good Plus (VG+),Sleeve: Very Good Plus (VG+),100.0%,Manhattan Towers,nan,$45.00
Gene Ammons All Stars* – The Happy Blues,Prestige – PR 7039,US,"Vinyl, LP, Album, Mono, Reissue","Recorded on April 23, 1956.

Dark blue trident labels, Bergenfield address.",Jazz,1964,Hard Bop,"Rated 4.00 of 3 votes (68 have, 35 want)",Very Good Plus (VG+),Sleeve: Good (G),100.0%,"Van Gelder Studio, Hackensack, New Jersey",nan,$45.00
Donald Byrd – Mustang!,Blue Note – BNST 84238,US,"Vinyl, LP, Album, Reissue, Stereo","Recorded on June 24, 1966.
Title is listed as ""MUSTANG!"" on front cover, MUSTANG italicized on back cover, MUSTANG on spine, M U S T A N G on labels. ""A Division Of Liberty Records, Inc."" labels. No Van Gelder stamp.",Jazz,1968,"Hard Bop, Post Bop","Rated 5.00 of 3 votes (32 have, 87 want)",Very Good Plus (VG+),Sleeve: Very Good Plus (VG+),99.5%,"Van Gelder Studio, Englewood Cliffs, New Jersey",Research Craft,$45.00
Art Farmer – Arte Moderno = Modern Art,United Artists Records – UAL 4007,Argentina,"Vinyl, LP, Album, Mono","SURCO - Industrias Musicales S.R.L. Cap. $ 600.000 - Industria Argentina

(Text on back of cover and on labels in Spanish language)",Jazz,1958,Hard Bop,"Rated 4.00 of 1 votes (2 have, 27 want)",Very Good (VG),Sleeve: Very Good (VG),100.0%,nan,nan,$45.00
The Incredible Jimmy Smith* – Crazy! Baby,"Blue Note – 4030, Blue Note – BLP 4030",US,"Vinyl, LP, Album, Mono","Recorded on January 4, 1960.
Original mono pressings have deep groove, plastylite ""P"" (incorrectly referred to as ""ear"") in deadwax, RVG stamp in deadwax.
Back cover bears the 43 W 61st address. Both center labels bear 47 West 63rd address.",Jazz,Jun 1960,Hard Bop,"Rated 4.07 of 29 votes (365 have, 145 want)",Very Good Plus (VG+),Sleeve: Very Good (VG),92.6%,"Van Gelder Studio, Englewood Cliffs, New Jersey",Plastylite,$45.00
The Milt Jackson Quartet Featuring Horace Silver – Soul Pioneers,"Prestige – PR 7224, Prestige – PRLP 7224",US,"Vinyl, LP, Album, Mono, Reissue","Recorded May 20, 1955.

PRESTIGE RECORDS, Inc., 203 South Washington Ave., Bergenfield, N.J.",Jazz,1962,"Hard Bop, Soul-Jazz","Rated 4.29 of 14 votes (138 have, 50 want)",Near Mint (NM or M-),Sleeve: Very Good Plus (VG+),100.0%,"Van Gelder Studio, Hackensack, New Jersey","Abbey Record Manufacturing Co., Inc.",$45.00
Miles Davis – Seven Steps To Heaven,Columbia – CS 8851,US,"Vinyl, LP, Album, Stereo","A1, A3 and B2 recorded in Hollywood
A2, B1 and B3 recorded in New York

This is the original US stereo release on red two eye Columbia labels with nonbreakable to left of center hole and '360 Sound' in black print at bottom.",Jazz,Sep 1963,"Hard Bop, Modal","Rated 4.61 of 23 votes (252 have, 134 want)",Very Good (VG),Sleeve: Very Good Plus (VG+),98.7%,nan,"Columbia Records Pressing Plant, Pitman",$45.00
The Horace Silver Quintet Featuring Stanley Turrentine – Serenade To A Soul Sister,Blue Note – BST 84277,US,"Vinyl, LP, Album, Stereo, Gatefold","Recorded on February, 23 (A1-A3) and March 29 (B1-B3), 1968

Label is blue and white with ""Blue Note Records • A Division Of Liberty Records, Inc."".
Presumably pressed by Southern Plastics or another pressing plant based on the smaller pressing ring around spindle hole using metal from All Disc with 114 etches and VAN GELDER stamped in both sides runout.
Side A is printed as ""Side I"" (sans serif and not all caps) instead of ""Side 1"" or ""SIDE 1""",Jazz,1968,"Hard Bop, Latin Jazz","Rated 4.27 of 49 votes (494 have, 180 want)",Very Good Plus (VG+),Sleeve: Very Good Plus (VG+),100.0%,nan,nan,$45.00
Dave Grusin – Kaleidoscope,Columbia – CL 2344,US,"Vinyl, LP, Album, Mono",nan,Jazz,1965,Hard Bop,"No Rating Yet (28 have, 35 want)",Near Mint (NM or M-),Sleeve: Near Mint (NM or M-),100.0%,nan,nan,$45.00
Blue Mitchell – A Sure Thing,Riverside Records – RLP 9414,US,"Vinyl, LP, Album, Stereo","Recorded at Plaza Sound Studios, New York City; March 7, 8, and 28, 1962.",Jazz,1962,Hard Bop,"Rated 2.00 of 1 votes (25 have, 65 want)",Very Good Plus (VG+),Sleeve: Very Good (VG),100.0%,Plaza Sound Studios,nan,$45.00
"Benny Golson With J.J. Johnson, Wynton Kelly, Max Roach – Reunion",Jazzland – JLP 85,US,"Vinyl, LP, Album, Mono, Reissue","Recorded at Reeves Sound Studios; New York City.
This recording is available in both stereophonic (AS 985) and monaural (AM 85) form.
Orpheum Productions",Jazz,1966,Hard Bop,"Rated 4.40 of 5 votes (39 have, 37 want)",Near Mint (NM or M-),Sleeve: Near Mint (NM or M-),99.7%,nan,nan,$45.95
Art Blakey And The Jazz Messengers* – A Midnight Session With...,Versailles (2) – STD 2023,France,"Vinyl, LP, 10"", Album","Jackie McLean, Courtesy of Prestige Records

Date for Basie Atomic record dates 'Grand Prix Jazz Hot 1960', so this must be from 1960 or 1961",Jazz,1961,Hard Bop,"Rated 3.83 of 6 votes (21 have, 35 want)",Near Mint (NM or M-),Sleeve: Near Mint (NM or M-),99.5%,nan,nan,$45.00
Monk* – Monk.,Columbia – CS 9091,US,"Vinyl, LP, Album, Stereo","Red ""360 Sound"" labels with black lettering and arrows in the rim text.
NONBREAKABLE under CS 9091 on Labels (both sides)",Jazz,1965,Hard Bop,"Rated 4.33 of 84 votes (998 have, 284 want)",Near Mint (NM or M-),Sleeve: Very Good Plus (VG+),100.0%,nan,nan,$45.00
Lee Morgan – The Sidewinder,"Blue Note – BST 84157, Blue Note – ST-84157, Blue Note – 84157",US,"Vinyl, LP, Album, Stereo","First US Stereo release with ""Blue Note Records, Inc. • New York USA"" printed on labels and the Plastylite ""ear"" etching in the runout. No deep groove on either label.

First catalog number on center labels, second on back sleeve, third on front sleeve.

Barry Harris performs courtesy of Riverside Records.",Jazz,1964,Hard Bop,"Rated 4.72 of 109 votes (965 have, 810 want)",Good Plus (G+),Sleeve: Good Plus (G+),98.8%,nan,Plastylite,$45.00
John Coltrane – Dakar,Prestige – PRLP 7280,US,"Vinyl, LP, Album, Mono","Yellow NJ fireworks label. Original cover with blue and orange type.

Originally released as one side of Prestige 16-6.",Jazz,1963,Hard Bop,"Rated 3.89 of 9 votes (88 have, 219 want)",Good (G),Sleeve: Good (G),100.0%,"Van Gelder Studio, Hackensack, New Jersey",nan,$45.00
Thelonious Monk – Solo Monk,Columbia – CS 9149,US,"Vinyl, LP, Album, Stereo, 360 Sound, 2-Eye Label, Non-Breakable",nan,Jazz,1965,"Hard Bop, Bop","Rated 4.40 of 10 votes (123 have, 150 want)",Very Good Plus (VG+),Sleeve: Very Good Plus (VG+),100.0%,nan,nan,$45.00
"The Miles Davis Sextet Featuring John Coltrane And ""Cannonball"" Adderley*, The Thelonious Monk Quartet And Pee Wee Russell – Miles & Monk At Newport",Columbia – CL 2178,US,"Vinyl, LP, Album, Mono","Miles Davis Sextet's set recorded live at Newport Jazz Festival in 1958. Thelonious Monk Quartet's set recorded live at Newport Jazz Festival in 1963.

Originally released 1963 on CS 8978.",Jazz,Jun 1964,"Hard Bop, Bop, Modal","Rated 4.21 of 29 votes (437 have, 81 want)",Near Mint (NM or M-),Sleeve: Near Mint (NM or M-),94.4%,Newport Jazz Festival,nan,$45.00
Milt Jackson Quartet* – Statements,Impulse! – A-14,US,"Vinyl, LP, Album, Mono, Ampar","Mono first pressing with Ampar on labels.

Released in a gatefold cover.

Recorded December 14 and 15, 1961",Jazz,1962,"Bop, Hard Bop","Rated 4.38 of 24 votes (231 have, 84 want)",Very Good Plus (VG+),Sleeve: Very Good Plus (VG+),100.0%,nan,nan,$45.00
Phil Woods And His European Rhythm Machine – Alive And Well In Paris,True Sound Manufacturing Corp. – AS 9179,US,"Vinyl, LP, Album, Test Pressing",US test pressing.,Jazz,1969,"Hard Bop, Free Jazz","No Rating Yet (1 have, 6 want)",Very Good (VG),Sleeve: No Cover,99.9%,nan,nan,$45.00
"The Cannonball Adderley Quintet – Mercy, Mercy, Mercy! - Live At ""The Club""",Capitol Records – ST 2663,US,"Vinyl, LP, Album, Stereo, Jacksonville Pressing","Pressed at Capitol's Jacksonville, IL plant, as identified by ""4"" printed on back cover, bottom right corner.

Recorded live at ""the Club"" (formerly the Club De Lisa) on State Street in Chicago, Illinois.","Jazz, Funk / Soul, Blues",Feb 1967,Hard Bop,"Rated 4.13 of 15 votes (245 have, 61 want)",Very Good Plus (VG+),Sleeve: Very Good Plus (VG+),99.7%,nan,"Capitol Records Pressing Plant, Jacksonville",$45.00
Miles Davis All Stars – Vol. 1,"Prestige – LP 196, Prestige – PRLP 196",US,"Vinyl, LP, 10""","50s pressing with ""deep groove"" yellow labels. 446 W. 50th St., New York address on cover and labels.

2nd pressing w/ y/b fireworks label and NYC address. 1st pressing has maroon labels and NYC address.

Recorded at Rudy Van Gelder Studio, Hackensack, NJ, December 24, 1954 [jazzdisco.org].",Jazz,1955,"Bop, Hard Bop","Rated 4.50 of 4 votes (31 have, 78 want)",Good (G),Sleeve: Good Plus (G+),99.0%,"Van Gelder Studio, Hackensack, New Jersey",nan,$45.00
Slide Hampton Octet – Sister Salvation,Atlantic – 1339,US,"Vinyl, LP, Album, Mono",Printed in U.S.A.,Jazz,1960,"Hard Bop, Instrumental","Rated 4.20 of 5 votes (114 have, 34 want)",Very Good Plus (VG+),Sleeve: Very Good Plus (VG+),100.0%,nan,nan,$45.00
The Thelonious Monk Quartet – Monk's Dream,Columbia – CL 1965,US,"Vinyl, LP, Album, Mono",Original release.,Jazz,1963,Hard Bop,"Rated 4.54 of 131 votes (1317 have, 888 want)",Very Good (VG),Sleeve: Very Good (VG),84.0%,nan,nan,$45.00
Sonny Rollins – On Impulse!,"Impulse! – A-91, Impulse! – AS-91",US,"Vinyl, LP, Album, Stereo","second Impulse label (1963 - 1966)
Impulse Records, a product of ABC-Paramount Records, Inc.
Printed in USA
Recorded 8 July, 1965

Cat# variations on release:
- spine Stereo A-91
- frontcover & rear cover: A-91 + ""Stereo"" printed on cover
- disc label: AS-91 Stereo

Re track A2: writing credits on label as follows: Tom Adair-Matt Dennis
Combined profil was made invalid by member.",Jazz,1965,"Post Bop, Hard Bop","Rated 4.15 of 27 votes (339 have, 183 want)",Very Good (VG),Sleeve: Very Good Plus (VG+),100.0%,nan,nan,$45.00
Miles Davis – Miles Davis In Europe,Columbia – CL 2183,US,"Vinyl, LP, Album, Mono, Pitman Pressing","Recorded Live At The Antibes International Jazz Festival - Juan-Les-Pins, 1963.",Jazz,1964,"Hard Bop, Modal","Rated 4.24 of 42 votes (504 have, 94 want)",Very Good Plus (VG+),Sleeve: Very Good Plus (VG+),99.9%,Antibes Jazz Festival,"Columbia Records Pressing Plant, Pitman",$45.00
Oliver Nelson Orchestra* – Afro/American Sketches,"Prestige – PR 7225, Prestige – PRLP 7225",US,"Vinyl, LP, Album, Mono","Yellow/Black Fireworks label, Black lettering, Bergenfield address, RVG stamped in the dead wax.

1st date: A1, B1
2nd date: A3, B3, B4
3rd date: A2, B2

Recorded: September 29, 1961 and November 10, 1961

solos [from liner notes]:
A1 - Dodgion - fl, Davis - b, Shaughnessy, Barretto - d
A3 - Newman, Brown, Nelson - as
B1 (full title: There's A Yearnin' Deep Inside Me) - Dodgion - fl
B2 - Nelson - ts
B3 - McCracken - cello",Jazz,1962,"Big Band, Hard Bop","Rated 4.57 of 7 votes (106 have, 69 want)",Very Good Plus (VG+),Sleeve: Near Mint (NM or M-),100.0%,"Van Gelder Studio, Englewood Cliffs, New Jersey","Abbey Record Manufacturing Co., Inc.",$45.00
The Chet Baker Quintet – Comin' On With The Chet Baker Quintet,Prestige – PR 7478,US,"Vinyl, LP, Album, Mono",Blue trident labels.,Jazz,1967,Hard Bop,"Rated 3.83 of 6 votes (47 have, 56 want)",Very Good Plus (VG+),Sleeve: Very Good Plus (VG+),100.0%,nan,nan,$45.00
Miles Davis – Miles Davis And The Modern Jazz Giants,Prestige – PRLP 7150,US,"Vinyl, LP, Compilation, Mono","Recorded on December 24, 1954 and October 26, 1956 (B1). Released early 1958 [? - see edit notes], simulated stereo copies do exist.

Track B3 was previously released as a 10 inch, 16rpm disc.

Copies are (deep groove) pressed on heavy vinyl with yellow labels. The have company address of ""203 So. Washington Ave, Bergenfield, N.J."". Cover has laminated foil over cover artwork paper.",Jazz,1959,Hard Bop,"Rated 4.56 of 52 votes (497 have, 416 want)",Very Good (VG),Sleeve: Very Good (VG),100.0%,nan,nan,$45.00
The Chet Baker Quintet – Smokin' With The Chet Baker Quintet,"Prestige – PR 7449, Prestige – PRST 7449",US,"Vinyl, LP, Album, Stereo",nan,Jazz,1966,"Hard Bop, Cool Jazz","Rated 4.17 of 6 votes (84 have, 51 want)",Very Good Plus (VG+),Sleeve: Very Good Plus (VG+),99.9%,nan,nan,$45.00
Miles Davis – Odyssey!,"Prestige – PR 7540, Prestige – PRST 7540",US,"Vinyl, LP, Album, Stereo, Reissue, Remastered",nan,Jazz,1967,"Bop, Hard Bop","Rated 4.13 of 15 votes (172 have, 76 want)",Very Good Plus (VG+),Sleeve: Very Good Plus (VG+),100.0%,nan,nan,$45.00
Miles Davis – Blue Moods,Fantasy – 86001,US,"Vinyl, LP, Album, Reissue, Stereo","Recorded July 9, 1955.",Jazz,1962,Hard Bop,"Rated 5.00 of 1 votes (27 have, 65 want)",Near Mint (NM or M-),Sleeve: Near Mint (NM or M-),99.4%,nan,nan,$44.99
Roy Ayers – Virgo Vibes,Atlantic – SD 1488,US,"Vinyl, LP, Album, Stereo, Monarch Pressing",nan,Jazz,1967,"Soul-Jazz, Hard Bop","Rated 4.50 of 2 votes (14 have, 96 want)",Very Good Plus (VG+),Sleeve: Very Good Plus (VG+),99.9%,nan,nan,$45.00
The Horace Silver Quintet – Doin' The Thing - At The Village Gate,Blue Note – BLP 4076,US,"Vinyl, LP, Album, Repress, Mono","Recorded on May 19 & 20, 1961.

Blue Mitchell performs by courtesy of Riverside Records.

Early Mono repress has:
- blue/white Blue Note Records Inc - New York Usa labels
- no deep groove on either side
- RVG stamped in the dead wax, both sides
- ""P"" (otherwise wrongly called ""ear"") for Plastylite plant etched in the trail off, both sides,
- laminated jacket,
- back cover does not advertise The Horace Silver Quintet - The Tokyo Blues as other represses do (this one is earliest repress from 1962)
- 43 West 61st St., New York 23 address on back cover",Jazz,1962,Hard Bop,"Rated 4.50 of 8 votes (84 have, 37 want)",Very Good Plus (VG+),Sleeve: Very Good Plus (VG+),100.0%,Village Gate,Plastylite,$45.00
John Coltrane – Blue Train,Blue Note – NP-2014,Japan,"Vinyl, 7"", 45 RPM, Single, Reissue, Stereo",nan,Jazz,1968,Hard Bop,"Rated 5.00 of 1 votes (4 have, 56 want)",Very Good Plus (VG+),Sleeve: Very Good Plus (VG+),100.0%,nan,nan,$45.00
