Artist_Album,Label,Country,Format,Notes,Genre,Release_Date,Style,Rate_Haves_Wants,Media_Condition,Sleeve_Condition,Seller_Rating,Recorded_at,Pressed_by,Price
John Coltrane – Lush Life,"Prestige – 7188, Prestige – PRLP 7188",US,"Vinyl, LP, Album, Mono","First pressing with yellow fireworks label featuring Bergenfield address.

1st cat# on front cover; 2nd cat# on center labels

= = =
Composition credits from labels, sides A and B
Alternate titles:
Lush Life : John Coltrane / Trio, Quartet, And Quintet (jacket, rear)
Lush Life : John Coltrane / (Trio & Quintet) -- disc labels, sides A and B
A2 -- Trane's Slo Blues (label) ; Trane's Slow Blues (jacket, rear)",Jazz,Jan 1961,Hard Bop,"Rated 4.51 of 76 votes (574 have, 642 want)",Good Plus (G+),Sleeve: Very Good (VG),100.0%,"Van Gelder Studio, Hackensack, New Jersey","Abbey Record Manufacturing Co., Inc.",$65.00
"Johnny Griffin Sextet, Johnny Griffin – Johnny Griffin Sextet",Riverside Records – RLP 12-264,US,"Vinyl, LP, Album, Mono","Recorded in New York; February 25, 1958.

Large blue Riverside label, 'Bill Grauer Productions New York City' on label. No 'INC' on labels.",Jazz,1958,Hard Bop,"Rated 4.22 of 9 votes (81 have, 137 want)",Very Good (VG),Sleeve: Very Good (VG),99.3%,nan,nan,$64.98
Kenny Burrell – All Day Long,"Prestige – PR 7277, Prestige – PRLP 7277",US,"Vinyl, LP, Album, Reissue, Mono",Red Spiral Prestige logo on front. Yellow label.,Jazz,1963,Hard Bop,"Rated 4.00 of 1 votes (49 have, 55 want)",Very Good Plus (VG+),Sleeve: Very Good Plus (VG+),99.5%,nan,nan,$65.00
Miles Davis – Bags Groove,"Prestige – SMJX-10044(M), Prestige – SMJX-10044Ⓜ, Prestige – SPRES-10019",Japan,"Vinyl, LP, Album, Mono, Reissue, Gatefold","Recorded on June 29, 1954 (Tracks B1 to B5) and December 24, 1954 (Tracks A1, A2)

Manufactured by Victor Record Company Ltd.
From a master recording owned by Prestige Records Inc., U.S.A. by agreement with Cosdel Inc.

Include obi.",Jazz,1969,"Bop, Hard Bop","Rated 4.80 of 5 votes (35 have, 121 want)",Near Mint (NM or M-),Sleeve: Near Mint (NM or M-),100.0%,nan,nan,$65.00
Jimmy Smith – House Party,Blue Note – BLP 4002,US,"Vinyl, LP, Album, Reissue, Mono","Recorded at Manhattan Towers, NYC; August 25, 1957 (tracks B1 & B2) & February 25, 1958 (tracks A1 & A2).

Early Mono Reissue
Labels Read 'Blue Note Records Inc. 47 West 63rd NYC'
Deep Groove both sides. RVG stamp and 'Ear' mark present both sides
Back cover at bottom states 'Blue Note Records Inc., 43 West 61st St., New York 23'.",Jazz,1959,"Hard Bop, Bop","Rated 4.83 of 6 votes (86 have, 56 want)",Very Good (VG),Sleeve: Very Good (VG),100.0%,Manhattan Towers,Plastylite,$64.99
Don Menza – Morning Song,SABA – SB 15 066 ST,Germany,"Vinyl, LP, Album, Stereo","Recorded at Trixi Tonstudio, Munich, December 22, 1965.",Jazz,1966,"Hard Bop, Modal","Rated 4.67 of 9 votes (50 have, 72 want)",Near Mint (NM or M-),Sleeve: Very Good Plus (VG+),99.9%,nan,nan,$65.00
"Hampton Hawes Trio – Hampton Hawes Trio, Vol. 1","Contemporary Records – C3505, Trova – c3505",Argentina,"Vinyl, LP, Album, Reissue, Mono",track list in spanish,Jazz,1966,"Bop, Hard Bop, Swing","Rated 5.00 of 1 votes (2 have, 5 want)",Near Mint (NM or M-),Sleeve: Very Good Plus (VG+),99.7%,nan,nan,$65.00
John Coltrane – Selflessness Featuring My Favorite Things,"Impulse! – AS-9161, ABC Records – AS-9161",US,"Vinyl, LP, Album, Stereo",slightly diffr. label and no tracklist on backcover,Jazz,1968,"Hard Bop, Free Jazz","Rated 4.64 of 11 votes (224 have, 91 want)",Very Good Plus (VG+),Sleeve: Very Good Plus (VG+),100.0%,Newport Jazz Festival,nan,$65.00
The Horace Silver Quintet – Further Explorations,"Blue Note – BST 81589, BLP 1589",US,"Vinyl, LP, Album, Reissue, Stereo","The Finest In Jazz Since 1939, Blue Note - A Product of Liberty Records
Research Craft press indicated by ""Re"" suffix at the end of the runout matrix string.
Labels printed by Bert-Co between 66-70.",Jazz,1967,"Hard Bop, Swing","Rated 4.50 of 2 votes (20 have, 28 want)",Near Mint (NM or M-),Sleeve: Very Good Plus (VG+),100.0%,"Van Gelder Studio, Hackensack, New Jersey",Research Craft,$65.00
Miles Davis – Seven Steps To Heaven,Columbia – CL 2051,US,"Vinyl, LP, Album, Mono, Terre-Haute","Tracks A1, A3, B2 recorded in Hollywood, Cal.
Tracks A2, B1, B3 recorded in New York

Also released in a Stereo version, Seven Steps To Heaven (CS 8851).

Columbia - 2 walking eyes - ""Nonbreakable"" - ""Guaranteed High Fidelity"" label.",Jazz,Sep 1963,"Hard Bop, Modal","Rated 4.31 of 81 votes (955 have, 414 want)",Very Good Plus (VG+),Sleeve: Very Good (VG),99.3%,nan,"Columbia Records Pressing Plant, Terre Haute",$65.00
Nat Adderley And The Big Sax Section – That's Right!,Riverside Records – RLP 330,US,"Vinyl, LP, Album, Mono","Recorded Aug. 9 and Sept., 1960.",Jazz,1960,Hard Bop,"Rated 4.29 of 14 votes (139 have, 29 want)",Mint (M),Sleeve: Mint (M),100.0%,Plaza Sound Studios,nan,$64.99
Art Blakey & The Jazz Messengers – Meet You At The Jazz Corner Of The World (Volume 2),Blue Note – BLP 4055,US,"Vinyl, LP, Album, Mono","Recorded live on September 14, 1960.

1st original mono pressing has:
- deep grooved blue/white Blue Note Records INC. labels with 47 West 63rd - NYC address with INC. and (R) under the E in Note
- RVG stamped and ""P"" (otherwise wrongly called ""ear"") for Plastylite etched in the trail off
- front laminated cover with no address on back

A1, A2, B2 published by Groove Music - BMI",Jazz,Apr 1962,Hard Bop,"Rated 4.58 of 12 votes (108 have, 152 want)",Very Good (VG),Sleeve: Very Good (VG),99.0%,Birdland,Plastylite,$65.00
Gene Ammons – Boss Tenor,Prestige – PRLP 7180,US,"Vinyl, LP, Album, Mono","First edition of this release, deep groove mono.

Recorded June 16, 1960.",Jazz,1960,"Hard Bop, Soul-Jazz","Rated 4.72 of 25 votes (209 have, 157 want)",Good Plus (G+),Sleeve: Good (G),100.0%,"Van Gelder Studio, Englewood Cliffs, New Jersey",nan,$65.00
The Andrzej Trzaskowski Quintet – Polish Jazz Vol. 4,Polskie Nagrania Muza – XL 0258,Poland,"Vinyl, LP, Album","Recorded in January 1965, Warsaw.",Jazz,1965,"Modal, Post Bop, Hard Bop","Rated 4.81 of 27 votes (155 have, 250 want)",Very Good Plus (VG+),Sleeve: Very Good (VG),100.0%,nan,nan,$65.00
The Incredible Jimmy Smith* – Midnight Special,Blue Note – BLP 4078,US,"Vinyl, LP, Album, Mono, No DG","Recorded on April 25, 1960.
For Complete Catalog Write to ""Blue Note Records Inc., 43 West 61st St., New York 23
White/Blue non-DG ""Blue Note Records Inc. New York USA"" label with ®
RVG stamped and Plastylite ""P"" on both sides","Jazz, Blues",1961,"Soul-Jazz, Hard Bop","Rated 4.38 of 84 votes (1011 have, 263 want)",Very Good Plus (VG+),Sleeve: Very Good Plus (VG+),99.5%,"Van Gelder Studio, Englewood Cliffs, New Jersey",Plastylite,$64.00
Miles Davis Sextet* – Someday My Prince Will Come,Columbia – CL 1656,US,"Vinyl, LP, Album, Mono","First pressing: Six-eyes Columbia logo on the labels.

Label variant - this label has songs center justified, whereas Miles Davis Sextet* - Someday My Prince Will Come has songs left justified and different font.",Jazz,11 Dec 1961,"Hard Bop, Modal","Rated 4.49 of 55 votes (479 have, 217 want)",Very Good Plus (VG+),Sleeve: Very Good Plus (VG+),99.5%,nan,nan,$63.00
Sonny Rollins – Shadow Waltz,JAZZLAND – AM 86,US,"Vinyl, LP, Album, Reissue, Mono","Reissue of Riverside RLP 12-258 entitled ""Freedom Suite"".
ORANGE LABEL / MONO",Jazz,1962,Hard Bop,"Rated 3.00 of 1 votes (51 have, 44 want)",Very Good Plus (VG+),Sleeve: Very Good Plus (VG+),100.0%,nan,nan,$65.00
Stan Getz Meets Gerry Mulligan – Getz Meets Mulligan In Hi-FI,La Voz De Su Amo – LCLP 165,Spain,"Vinyl, LP, Album","Recorded at Los Angeles, CA, October 12, 1957",Jazz,1961,"Bop, Hard Bop","Rated 4.00 of 3 votes (3 have, 19 want)",Very Good Plus (VG+),Sleeve: Very Good Plus (VG+),93.8%,nan,nan,$65.00
The Poll Winners – The Poll Winners,"Stereo Records (4) – S7010, Contemporary Records – S7010",US,"Vinyl, LP, Album, Stereo","Deep Groove

Recorded March 18 & 19, 1957 at Contemporary's Studio, Los Angeles",Jazz,1958,Hard Bop,"Rated 4.50 of 2 votes (66 have, 70 want)",Very Good Plus (VG+),Sleeve: Good Plus (G+),100.0%,nan,nan,$65.00
Jimmy Smith – Jimmy Smith At The Organ (Volume 1),"Blue Note – 1551, Blue Note – BLP 1551",US,"Vinyl, LP, Album, Repress, Mono","Originally recorded at Manhattan Towers, NYC, February 12, 1957.

47 West 63rd NYC label

This version can be differentiated by the company information printed on the labels and by the absence of a ® symbol, all of which indicate that it was likely released between 1958 and 1959.",Jazz,1958,"Bop, Hard Bop","Rated 4.11 of 9 votes (175 have, 101 want)",Very Good Plus (VG+),Sleeve: Very Good (VG),100.0%,nan,Plastylite,$60.00
McCoy Tyner – Tender Moments,Blue Note – BST 84275,US,"Vinyl, LP, Album, Stereo","Recorded on December 1, 1967.

""A Division of Liberty Records, Inc."" on labels.
""VAN GELDER"" stamped in run-out.",Jazz,1968,Hard Bop,"Rated 4.46 of 41 votes (378 have, 271 want)",Very Good Plus (VG+),Sleeve: Very Good (VG),99.2%,"Van Gelder Studio, Englewood Cliffs, New Jersey",nan,$61.91
The Dave Brubeck Quartet – Time Out,Columbia – CL 1397,US,"Vinyl, LP, Album, Mono","1st pressing, Cover has black bottom printed edge and excludes ""featuring"" text on front top. Labels have red and black six ""eye"" design. LP housed in company sleeve (as pictured)

1. Rear sleeve has a ""1"" printed down at the bottom
2. Center label does not have ""CBS"" under the Columbia logo.",Jazz,1959,"Bop, Hard Bop","Rated 4.60 of 30 votes (330 have, 364 want)",Good Plus (G+),Sleeve: Good Plus (G+),99.9%,nan,nan,$60.00
Ken McIntyre – Stone Blues,"Prestige – NJ 8259, New Jazz – NJ 8259, New Jazz – PRNJ 8259",US,"Vinyl, LP, Album, Mono","Recorded in Englewood Cliffs, NJ; May 31, 1960.

Purple labels with silver writing.",Jazz,1961,"Hard Bop, Post Bop","Rated 4.25 of 12 votes (71 have, 127 want)",Very Good (VG),Sleeve: Very Good (VG),99.8%,"Van Gelder Studio, Englewood Cliffs, New Jersey",nan,$60.00
Jimmy Smith – Midnight Special,Blue Note – BST-84078,US,"Vinyl, LP, Album, Stereo, Plastylite Pressing",Plastylite Pressing indicated by 'ear mark' in dead wax.,"Jazz, Blues",1961,"Soul-Jazz, Hard Bop","Rated 4.00 of 48 votes (479 have, 232 want)",Very Good Plus (VG+),Sleeve: Fair (F),100.0%,nan,Plastylite,$60.00
The Horace Silver Quintet Plus J.J. Johnson – The Cape Verdean Blues,Blue Note – BST 84220,US,"Vinyl, LP, Album, Reissue, Stereo","Label information:

LIBERTY UA. INC., LOS ANGELES, CALIFORNIA",Jazz,1970,"Hard Bop, Post Bop, Latin Jazz","No Rating Yet (0 have, 4 want)",Very Good Plus (VG+),Sleeve: Good Plus (G+),100.0%,"Van Gelder Studio, Englewood Cliffs, New Jersey","All Disc Records, Inc.",$60.00
Brown And Roach Incorporated* – Brown And Roach Incorporated,"Emarcy – MG 36008, Mercury – MG 36008",US,"Vinyl, LP, Album, Mono","Available on 45 rpm - EP-1-6111, EP-1-6112 and EP-1-6113",Jazz,1955,"Bop, Hard Bop","Rated 4.50 of 34 votes (254 have, 178 want)",Very Good Plus (VG+),Sleeve: Very Good Plus (VG+),97.0%,nan,nan,$60.00
Stanley Turrentine With The Three Sounds – Blue Hour,Blue Note – BLP 4057,US,"Vinyl, LP, Album, Mono","Recorded on December 16, 1960.",Jazz,1961,"Cool Jazz, Hard Bop","Rated 4.26 of 19 votes (149 have, 333 want)",Good (G),Sleeve: Good Plus (G+),100.0%,"Van Gelder Studio, Englewood Cliffs, New Jersey",nan,$60.00
Miles Davis – Round About Midnight / Four,Prestige – SMJ-20,Japan,"Vinyl, 7"", 33 ⅓ RPM, EP",nan,Jazz,1965,Hard Bop,"Rated 5.00 of 1 votes (3 have, 6 want)",Near Mint (NM or M-),nan,50.0%,nan,nan,$60.00
Sonny Rollins – Moving Out,Prestige – LP 7058,US,"Vinyl, LP, Album, Mono","#A1-B1: Recorded August 18, 1954
#B2: Recorded October 25, 1954

(AB) in runouts stands for Abbey Pressing in New Jersey.",Jazz,1956,"Bop, Hard Bop","Rated 4.29 of 21 votes (131 have, 275 want)",Fair (F),Sleeve: No Cover,99.9%,"Van Gelder Studio, Hackensack, New Jersey","Abbey Record Manufacturing Co., Inc.",$60.00
The Dave Bailey Quintet – Shiny Stockings,Epic – A7 17021,US,"Vinyl, 7"", 33 ⅓ RPM, Stereo",nan,Jazz,1961,Hard Bop,"Rated 5.00 of 1 votes (3 have, 11 want)",Very Good Plus (VG+),Sleeve: Very Good (VG),99.8%,nan,nan,$60.00
"Hank Mobley, Billy Root, Curtis Fuller, Lee Morgan – Another Monday Night At Birdland",Roulette – SR 52022,US,"Vinyl, LP, Album, Stereo","Recorded April 28, 1958.",Jazz,1959,Hard Bop,"Rated 4.00 of 2 votes (41 have, 97 want)",Near Mint (NM or M-),Sleeve: Very Good (VG),91.7%,Birdland,nan,$60.00
Cannonball Adderley With Milt Jackson – Things Are Getting Better,Riverside Records – RLP 1128,US,"Vinyl, LP, Album, Repress, Stereo","Recorded in New York; October 28, 1958.",Jazz,1960,"Bop, Hard Bop","Rated 4.29 of 7 votes (49 have, 74 want)",Very Good Plus (VG+),Sleeve: Very Good Plus (VG+),99.5%,Reeves Sound Studios,nan,$60.00
Lee Morgan – The Rumproller,Blue Note – BST 84199,US,"Vinyl, LP, Album, Reissue","Liberty pressing: white/blue labels reading ""Blue Note Records, a division of Liberty Records, Inc.""
VAN GELDER stamped in run-out, both sides.

Ronnie Mathews performs by courtesy of Prestige Records.",Jazz,1966,"Hard Bop, Modal","Rated 4.57 of 14 votes (90 have, 111 want)",Very Good Plus (VG+),Sleeve: Very Good (VG),99.7%,"Van Gelder Studio, Englewood Cliffs, New Jersey",nan,$60.00
The John Coltrane Quartet – Africa / Brass,Impulse! – SR-3071,Japan,"Vinyl, LP, Album, Reissue, Stereo",nan,Jazz,1970,"Free Jazz, Hard Bop, Modal","Rated 5.00 of 3 votes (20 have, 115 want)",Near Mint (NM or M-),Sleeve: Very Good Plus (VG+),99.9%,nan,nan,$62.00
John Coltrane – Lush Life,"Prestige – 7188, Prestige – PRLP 7188",US,"Vinyl, LP, Album, Mono","First pressing with yellow fireworks label featuring Bergenfield address.

1st cat# on front cover; 2nd cat# on center labels

= = =
Composition credits from labels, sides A and B
Alternate titles:
Lush Life : John Coltrane / Trio, Quartet, And Quintet (jacket, rear)
Lush Life : John Coltrane / (Trio & Quintet) -- disc labels, sides A and B
A2 -- Trane's Slo Blues (label) ; Trane's Slow Blues (jacket, rear)",Jazz,Jan 1961,Hard Bop,"Rated 4.51 of 76 votes (574 have, 642 want)",Good Plus (G+),Sleeve: Good Plus (G+),99.4%,"Van Gelder Studio, Hackensack, New Jersey","Abbey Record Manufacturing Co., Inc.",$60.00
Wynton Kelly – Kelly Great,"Vee Jay Records – VJLP-3004, Vee Jay Records – LP 3004",US,"Vinyl, LP, Album, Reissue, Mono","Rainbow Oval VeeJay label.

Catalog # LP 3004 on jacket, VJLP-3004 on labels.

Correct spelling of ""KELLY"" on front cover.

Paper label for side 1 is applied to runout-labeled side 2, and vice versa

Recorded Fine Sound Studios, NYC, August 12, 1959.",Jazz,1964,Hard Bop,"Rated 5.00 of 1 votes (58 have, 45 want)",Very Good Plus (VG+),Sleeve: Near Mint (NM or M-),100.0%,Fine Recording Studios,nan,$60.00
Miles Davis – Seven Steps To Heaven,Columbia – CS 8851,US,"Vinyl, LP, Album, Repress, Stereo","Tracks A1, A3, B2 recorded in Hollywood, Cal.
Tracks A2, B1, B3 recorded in New York.

Columbia 2-Eye label. STEREO & ""360 SOUND"" in white text which replaced the first press black text in 1963. Probably a repress but most likely this edition is simply a label change.",Jazz,1963,"Hard Bop, Modal","Rated 5.00 of 2 votes (28 have, 48 want)",Very Good Plus (VG+),Sleeve: Near Mint (NM or M-),100.0%,nan,nan,$60.00
Oliver Nelson's Big Band – Live From Los Angeles,Impulse! – AS-9153,US,"Vinyl, LP","Recorded June 2, 3 & 4, 1967
Gatefold jacket",Jazz,1967,"Hard Bop, Post Bop","Rated 4.40 of 5 votes (117 have, 29 want)",Very Good Plus (VG+),Sleeve: Very Good Plus (VG+),100.0%,nan,nan,$60.00
Miles Davis – Miles In Berlin,CBS/Sony – SONP 50127,Japan,"Vinyl, LP, Album, Stereo",nan,Jazz,1969,"Hard Bop, Modal","Rated 4.63 of 8 votes (57 have, 50 want)",Near Mint (NM or M-),Sleeve: Near Mint (NM or M-),99.7%,nan,nan,$60.00
Enrique Villegas / Paul Gonsalves / Willie Cook – Encuentro,Trova – TL-22,Argentina,"Vinyl, LP, Album, Mono",Grabado el 15 de Setiembre de 1968,Jazz,1969,Hard Bop,"Rated 5.00 of 1 votes (21 have, 28 want)",Very Good Plus (VG+),Sleeve: Very Good Plus (VG+),99.7%,nan,nan,$60.00
Gene Ammons & Sonny Stitt – Boss Tenors In Orbit!,Verve Records – V6-8468,US,"Vinyl, LP, Album, Stereo",Gene Ammons & Sonny Stitt + Organ recorded in New York February 1962.,Jazz,1962,"Soul-Jazz, Hard Bop","Rated 3.73 of 11 votes (107 have, 61 want)",Very Good Plus (VG+),Sleeve: Near Mint (NM or M-),99.7%,nan,nan,$60.00
Joe Harriott - John Mayer Double Quintet* – Indo-Jazz Fusions II,Columbia – SX 6215,UK,"Vinyl, LP, Album, Mono",nan,"Jazz, Folk, World, & Country",1968,"Hard Bop, Indian Classical","Rated 4.57 of 7 votes (69 have, 167 want)",Very Good Plus (VG+),Sleeve: Very Good (VG),100.0%,nan,nan,$60.00
Charles Mingus – Mingus Ah Um,Columbia – CS 8171,Canada,"Vinyl, LP, Album, Reissue, Stereo","2 eye Columbia label
""360 sound stereo"" in white lettering at bottom",Jazz,1966,"Hard Bop, Bop","Rated 5.00 of 1 votes (9 have, 182 want)",Very Good (VG),Sleeve: Very Good (VG),100.0%,Columbia 30th Street Studio,nan,$60.00
Abbey Lincoln – Abbey Is Blue,Riverside Records – RLP 12-308,US,"Vinyl, LP, Album, Mono","Recorded in New York; Spring and Fall, 1959.

Blue 'mic and reel' labels with 'BILL GRAUER PRODUCTIONS INC.' along the bottom of labels and no deep groove - the pressing from 1962-1963.

Slight label font variation from alternative 1959 12-308 mono release.",Jazz,1962,"Vocal, Hard Bop","Rated 5.00 of 3 votes (12 have, 45 want)",Very Good Plus (VG+),Sleeve: Good Plus (G+),99.6%,nan,nan,$60.00
The Horace Silver Quintet – Song For My Father (Cantiga Para Meu Pai),Blue Note – BLP 4185,US,"Vinyl, LP, Album","Blue/white ""A Division Of Liberty Records, Inc."" labels.",Jazz,1966,"Hard Bop, Latin Jazz","Rated 4.71 of 14 votes (90 have, 245 want)",Very Good (VG),Sleeve: Very Good Plus (VG+),98.8%,nan,nan,$60.00
"Art Blakey Quintet – A Night At Birdland, Volume 2",Blue Note – BLP 1522,US,"Vinyl, LP, Compilation, Reissue, Mono","Recorded live on February 21, 1954.",Jazz,1966,Hard Bop,"Rated 4.80 of 10 votes (120 have, 131 want)",Near Mint (NM or M-),Sleeve: Very Good (VG),92.6%,Birdland,nan,$60.00
"Art Blakey, Charlie Persip, Elvin Jones, ""Philly"" Joe Jones – Gretsch Drum Night At Birdland",Roulette – R 52049,US,"Vinyl, LP, Album, Mono","White label with multicolored pinwheel ""spokes"" emanating from center.",Jazz,1960,Hard Bop,"Rated 4.00 of 10 votes (93 have, 64 want)",Near Mint (NM or M-),Sleeve: Near Mint (NM or M-),99.6%,nan,nan,$60.00
Miles Davis – Miles Davis In Europe,Columbia – CS 8983,US,"Vinyl, LP, Album, Stereo, Terre Haute Pressing","Recorded Live At The Antibes International Jazz Festival - Juan-Les-Pins, 1963.

Two white ""walking"" eyes. Red 1964 Columbia black ""360 SOUND"" STEREO with black arrows and ""nonbreakable"" left of spindle hole.",Jazz,1964,"Hard Bop, Modal","Rated 4.29 of 49 votes (691 have, 184 want)",Near Mint (NM or M-),Sleeve: Very Good Plus (VG+),99.8%,Antibes Jazz Festival,"Columbia Records Pressing Plant, Terre Haute",$60.00
John Coltrane With Hank Mobley – 2 Tenors,Prestige – PRST 7670,US,"Vinyl, LP, Album, Reissue, Remastered, Stereo","Electronically remastered for stereo. Blue labels, trident in circle on top. Originally on Prestige 7043. VAN GELDER stamped on both sides of the deadwax.",Jazz,1969,Hard Bop,"Rated 5.00 of 2 votes (30 have, 48 want)",Very Good Plus (VG+),Sleeve: Very Good Plus (VG+),100.0%,"Van Gelder Studio, Hackensack, New Jersey",nan,$62.00
Lem Winchester & Benny Golson – Winchester Special,New Jazz – NJLP-8223,US,"Vinyl, LP, Album, Mono","Recorded in Englewood Cliffs, NJ; September 25, 1959.
First Press has Purple deep groove New Jazz labels with silver print.",Jazz,1959,Hard Bop,"Rated 4.00 of 6 votes (61 have, 102 want)",Very Good (VG),Sleeve: Very Good (VG),99.0%,nan,nan,$61.00
The Horace Silver Quintet & The Horace Silver Trio – Blowin' The Blues Away,"Blue Note – BST 84017, Blue Note – ST-84017, Blue Note – 84017",US,"Vinyl, LP, Album, Stereo","LABELS:
- Blue/white labels
- ""47 West 63rd ∙ NYC"" address
- Deep 'groove' on both sides

SLEEVE:
- Laminated on front only
- Address on back is ""47 West 63rd St., New York 23""
- ""Blue Mitchell performs by courtesy of Riverside Records""

CATALOG NUMBERS:
- BST 84017 on labels
- ST-84017 on back of sleeve
- 84017 on front of sleeve and spine

OTHER INFORMATION:
- Recorded 29 August - 13 September 1959 at Van Gelder Studio, Englewood Cliffs, NJ
- Corresponding mono version has cat# BLP 4017",Jazz,1959,Hard Bop,"Rated 4.30 of 20 votes (144 have, 184 want)",Very Good (VG),Sleeve: Very Good (VG),100.0%,"Van Gelder Studio, Englewood Cliffs, New Jersey",Plastylite,$60.00
The Miles Davis Sextet & The Thelonious Monk Quartet – Miles & Monk At Newport,Columbia – CS 8978.,US,"Vinyl, LP, Album, Stereo","Miles Davis Sextet's set recorded live at Newport Jazz Festival in 1958. Thelonious Monk Quartet's set recorded live at Newport Jazz Festival in 1963.

First pressing with 2 ""Eye"" label with '360 Stereo Sound' in black lettering.",Jazz,Jun 1964,"Hard Bop, Bop, Modal","Rated 4.46 of 46 votes (684 have, 205 want)",Near Mint (NM or M-),Sleeve: Very Good Plus (VG+),100.0%,Newport Jazz Festival,"Columbia Records Pressing Plant, Terre Haute",$60.00
Cannonball Adderley With Milt Jackson – Things Are Getting Better,Riverside Records – RLP 12-286,US,"Vinyl, LP, Album, Mono","Recorded in New York; October 28, 1958.",Jazz,1958,"Bop, Hard Bop","Rated 4.33 of 18 votes (255 have, 138 want)",Very Good Plus (VG+),Sleeve: Very Good Plus (VG+),99.0%,nan,nan,$60.00
Miles Davis – Orbits,Columbia Musical Treasuries – DS 417,US,"Vinyl, LP, Compilation, Stereo, Red Labels","Red labels.

Another issue with gold label & red perimeter scroll here: Orbits

1968 CBS Direct Marketing Services
Manufactured by Columbia Record Club/CBS, Inc./51 W. 52 Street/New York, N.Y.

A Product of Columbia Musical Treasury",Jazz,1968,"Post Bop, Hard Bop, Modal","Rated 4.11 of 9 votes (158 have, 34 want)",Mint (M),Sleeve: Very Good Plus (VG+),100.0%,nan,nan,$61.96
The Incredible Jimmy Smith* – Rockin' The Boat,"Blue Note – 84141, Blue Note – BST 84141, Blue Note – ST-84141",US,"Vinyl, LP, Album, Stereo","Recorded on February 7, 1963.

Likely released during September of 1963.

Back cover: Blue Note Records, Inc., 43 West 61st St., New York 23",Jazz,Sep 1963,"Hard Bop, Soul-Jazz","Rated 4.39 of 18 votes (295 have, 83 want)",Near Mint (NM or M-),Sleeve: Near Mint (NM or M-),100.0%,nan,Plastylite,$60.99
Lee Morgan – Delightfulee,"Blue Note – BST 84243, Blue Note – BLP 4243",US,"Vinyl, LP, Album, Stereo, Reissue","Recorded on April 8 (A3, B1) and May 27 (all others), 1966
Liberty UA, Inc. with Black Label/Blue Note block on left.

Publishers:
- A1, A2, B2, B3: Blue Horizon Music - BMI
- A3: Maclen Music, Inc. - BMI
- B1: Sunbeam Music Corp. - BMI",Jazz,1970,Hard Bop,"Rated 4.00 of 8 votes (121 have, 82 want)",Very Good Plus (VG+),Sleeve: Near Mint (NM or M-),99.3%,"Van Gelder Studio, Englewood Cliffs, New Jersey",nan,$60.00
Cannonball Adderley – Somethin' Else,"Blue Note – 1595, Blue Note – BST 1595",US,"Vinyl, LP, Album, Repress, Stereo","With printed inner sleeve ""1939-1964 25 YEARS BLUE NOTE the first name in jazz""

Address on labels: Blue Note Records Inc. • New York
Address on back cover and printed inner sleeve: Blue Note Records Inc., 43 West 61st St., New York 23

Catalog number on front cover, back cover: 1595
Catalog number on labels: BST 1595

Identifying characteristics:
- deep groove on side 1 only
- 'New York' labels on both sides
- 'RVG STEREO' stamped in the runout area
- Plastylite 'ear' symbol etched in the runout area
- Front laminated cover with gold sticker ""STEREO""
- printed inner sleeve ""25 years of Blue Note 1939-1964"" with promo photos of another Blue Notes's releases.",Jazz,1964,"Bop, Hard Bop","Rated 4.93 of 14 votes (87 have, 263 want)",Good Plus (G+),Sleeve: Very Good (VG),99.7%,nan,Plastylite,$60.00
"Sonny Rollins – Original Music From The Score ""Alfie""",Impulse! – AS-9111,US,"Vinyl, LP, Album, Stereo, Gatefold","Recorded January 26, 1966.

Gatefold liner sleeve includes photo stills from the Paramount picture ""Alfie.""

Orange and black Impulse! label.","Jazz, Stage & Screen",1966,"Hard Bop, Theme, Score","Rated 4.38 of 32 votes (243 have, 149 want)",Very Good Plus (VG+),Sleeve: Very Good Plus (VG+),99.6%,nan,nan,$60.38
The Dave Brubeck Quartet – Time Further Out (Miro Reflections),Columbia – CS 8490,US,"Vinyl, LP, Album, Repress, Stereo","labels: ""360 Sound"" in white - without ""Nonbreakable""
Back cover: Bold numeral ""1"" in the lower-right corner

A Blues Suite
The Selections--Published by Derry Music Co. (BMI)",Jazz,1964,Hard Bop,"Rated 3.93 of 14 votes (91 have, 46 want)",Mint (M),Sleeve: Near Mint (NM or M-),98.9%,nan,"Columbia Records Pressing Plant, Pitman",$60.00
Miles Davis – Seven Steps To Heaven,Columbia – CL 2051,US,"Vinyl, LP, Album, Mono, Terre-Haute","Tracks A1, A3, B2 recorded in Hollywood, Cal.
Tracks A2, B1, B3 recorded in New York

Also released in a Stereo version, Seven Steps To Heaven (CS 8851).

Columbia - 2 walking eyes - ""Nonbreakable"" - ""Guaranteed High Fidelity"" label.",Jazz,Sep 1963,"Hard Bop, Modal","Rated 4.31 of 81 votes (955 have, 414 want)",Very Good Plus (VG+),Sleeve: Very Good Plus (VG+),100.0%,nan,"Columbia Records Pressing Plant, Terre Haute",$61.17
