Artist_Album,Label,Country,Format,Notes,Genre,Release_Date,Style,Rate_Haves_Wants,Media_Condition,Sleeve_Condition,Seller_Rating,Recorded_at,Pressed_by,Price
Stan Getz Meets Gerry Mulligan – Getz Meets Mulligan In Hi-FI,Verve Records – MG V-8249,US,"Vinyl, LP, Album","Recorded at Los Angeles, CA, October 12, 1957

Similar version: Stan Getz Meets Gerry Mulligan - Getz Meets Mulligan In Hi-FI",Jazz,Dec 1957,"Bop, Hard Bop","Rated 3.95 of 19 votes (292 have, 123 want)",Very Good (VG),Sleeve: Very Good (VG),99.5%,nan,nan,$30.00
Wild Bill Davis – At Birdland,Epic – LN 3118,US,"Vinyl, LP, Album, Mono","Epic - A product of CBS.
Yellow Epic Label, has no specified ""Side 1"" and ""Side 2"".
Sides are denoted by labels indicating: XEM34962 and XEM34963.",Jazz,Apr 1955,Hard Bop,"Rated 3.75 of 4 votes (112 have, 19 want)",Very Good Plus (VG+),Sleeve: Very Good (VG),100.0%,nan,nan,$30.00
John Coltrane – Black Pearls,"Prestige – PRST 7316, Prestige – PR 7316, Prestige – PRESTIGE 7316",US,"Vinyl, LP, Album, Stereo","Recorded May 23, 1958.
This is the silver/black Trident label. (1964 -1971)",Jazz,1964,"Hard Bop, Post Bop","Rated 4.60 of 5 votes (27 have, 63 want)",Very Good Plus (VG+),Sleeve: Very Good Plus (VG+),99.7%,"Van Gelder Studio, Hackensack, New Jersey",nan,$30.00
Freddie Hubbard – The Night Of The Cookers - Live At Club La Marchal - Volume 2,Blue Note – BST 84208,US,"Vinyl, LP, Album, Reissue, Stereo","Recorded April 9, 1965
Blue and white Blue Note label with Division Of Liberty, second issue for this title, as used 1966-70.
West coast pressing, by label fonts/design.
No Van Gelder stamp in dead-wax.",Jazz,1966,"Hard Bop, Post Bop","Rated 3.88 of 8 votes (41 have, 28 want)",Very Good Plus (VG+),Sleeve: Very Good (VG),99.7%,Club La Marchal,nan,$30.00
Thad Jones & Mel Lewis – Consummation,"Blue Note – BST 84346, Blue Note – BNST-84346",US,"Vinyl, LP, Album, Stereo, Gatefold","Alternate black label version.

Recorded January 20, 21, 28 & May 25, 1970 at A&R Studios.",Jazz,1970,"Big Band, Hard Bop","Rated 4.63 of 8 votes (62 have, 24 want)",Very Good Plus (VG+),Sleeve: Near Mint (NM or M-),100.0%,A&R Studios,nan,$30.00
Various – Groovy Goodies,Prestige – PR 7298,US,"Vinyl, LP, Compilation, Mono",nan,"Jazz, Funk / Soul, Blues",1964,"Hard Bop, Electric Blues, Rhythm & Blues, Soul-Jazz","Rated 4.33 of 3 votes (42 have, 18 want)",Near Mint (NM or M-),Sleeve: Very Good Plus (VG+),99.5%,nan,nan,$30.00
Bennie Green – Blows His Horn,Prestige – 7160,US,"Vinyl, LP, Album, Mono, Reissue, Bergenfield Labels","Side A recorded 6/10/55
Side B recorded 9/22/55

Second pressing re-released in 1960 with a different cover and the Bergenfield, NJ address replacing W.50th Street on the labels and back cover.",Jazz,1960,Hard Bop,"Rated 5.00 of 1 votes (28 have, 29 want)",Very Good (VG),Sleeve: Very Good (VG),99.6%,nan,nan,$30.00
Sonny Rollins – Decision,Blue Note – 45-1669,US,"Vinyl, 7"", 45 RPM","Recorded on December 16, 1956.",Jazz,1957,Hard Bop,"Rated 4.67 of 3 votes (12 have, 16 want)",Very Good Plus (VG+),Sleeve: Generic,100.0%,"Van Gelder Studio, Hackensack, New Jersey",nan,$30.00
Freddie Hubbard – The Hub Of Hubbard,MPS Records – MPS 15 267 ST,Germany,"Vinyl, LP, Album, Gatefold","Recorded at MPS-Studio, Villingen/Black Forest, Dec. 9th, 1969.",Jazz,1970,Hard Bop,"Rated 3.89 of 19 votes (147 have, 132 want)",Very Good Plus (VG+),Sleeve: Very Good Plus (VG+),100.0%,"MPS-Studio, Villingen",nan,$30.00
The Thelonious Monk Quartet – Misterioso,Riverside Records – RLP 1133,US,"Vinyl, LP, Album, Stereo",nan,Jazz,1966,"Bop, Hard Bop","Rated 1.00 of 1 votes (18 have, 46 want)",Very Good Plus (VG+),Sleeve: Very Good (VG),99.4%,Five Spot Café,nan,$30.00
The Incredible Jimmy Smith* – Crazy! Baby,"Blue Note – 4030, Blue Note – BLP 4030",US,"Vinyl, LP, Album, Mono","Recorded on January 4, 1960.
Original mono pressings have deep groove, plastylite ""P"" (incorrectly referred to as ""ear"") in deadwax, RVG stamp in deadwax.
Back cover bears the 43 W 61st address. Both center labels bear 47 West 63rd address.",Jazz,Jun 1960,Hard Bop,"Rated 4.07 of 29 votes (366 have, 146 want)",Very Good (VG),Sleeve: Very Good Plus (VG+),100.0%,"Van Gelder Studio, Englewood Cliffs, New Jersey",Plastylite,$30.00
Cannonball Adderley – Cannonball Adderley-Live!,Capitol Records – ST 2399,US,"Vinyl, LP, Album","Recorded live at Shelly Manne´s ""Manne-Hole""",Jazz,1965,"Hard Bop, Soul-Jazz, Modal","Rated 3.86 of 22 votes (299 have, 59 want)",Very Good (VG),Sleeve: Very Good (VG),99.5%,Shelly's Manne-Hole,nan,$30.00
"The Incredible Jimmy Smith* – At Club ""Baby Grand"" Wilmington, Delaware, Volume 1",Blue Note – BLP 1528,US,"Vinyl, LP, Album, Mono","Recorded live on August 4, 1956 at Club Baby Grand, Wilmington, Delaware.",Jazz,1956,"Soul-Jazz, Hard Bop","Rated 4.45 of 11 votes (126 have, 185 want)",Good Plus (G+),Sleeve: Not Graded,100.0%,Club Baby Grand,Plastylite,$30.00
Monk* – Monk.,Columbia – CS 9091,US,"Vinyl, LP, Album, Stereo","Red ""360 Sound"" labels with black lettering and arrows in the rim text.
NONBREAKABLE under CS 9091 on Labels (both sides)",Jazz,1965,Hard Bop,"Rated 4.33 of 85 votes (998 have, 286 want)",Very Good (VG),Sleeve: Very Good (VG),99.7%,nan,nan,$30.00
Art Blakey's Jazz Messengers* With Thelonious Monk – Art Blakey's Jazz Messengers With Thelonious Monk,"Atlantic – SD 1278, Atlantic – 1278",US,"Vinyl, LP, Album, Stereo","Original 1958 stereo edition with green deep-grooved labels, no fan logo. The cover has a large ""Stereo Disc"" logo in black print that appears to be silkscreened onto the glossy jacket.",Jazz,1958,"Bop, Hard Bop","Rated 4.57 of 7 votes (116 have, 213 want)",Very Good (VG),Sleeve: Very Good Plus (VG+),100.0%,nan,nan,$30.00
Roland Kirk – We Free Kings,Mercury – SR-625-C,US,"Vinyl, 7"", 33 ⅓ RPM, Album, Stereo","Deep groove pressing with blue labels and silver print.

Four track sampler from the LP of same title.

Intended for the jukebox market.",Jazz,1962,"Hard Bop, Soul-Jazz","No Rating Yet (2 have, 17 want)",Very Good Plus (VG+),Sleeve: Very Good Plus (VG+),98.1%,nan,"Richmond Record Pressings, Inc.",$30.00
Getz* Meets Mulligan* – Getz Meets Mulligan,Columbia – 33CX 10120,UK,"Vinyl, LP, Album","""Getz Meets Mulligan In Hi-Fi"" on front cover, just ""Getz Meets Mulligan"" everywhere else.

Made in Gt. Britain",Jazz,1958,"Bop, Hard Bop","Rated 4.67 of 3 votes (50 have, 44 want)",Very Good Plus (VG+),Sleeve: Good Plus (G+),100.0%,nan,nan,$30.00
Lou Donaldson – Play Ray / Autumn Nocturne,Blue Note – 45-1721,US,"Vinyl, 7""","47 W.63rd Street, New York 23, N.Y.

Excerpt From Album BLP 1593",Jazz,1959,"Hard Bop, Soul-Jazz","Rated 5.00 of 2 votes (13 have, 15 want)",Very Good Plus (VG+),Sleeve: Generic,99.7%,nan,nan,$30.00
Shelly Manne & His Men – Play Peter Gunn,Contemporary Records – C3560,US,"Vinyl, LP, Album, Mono",nan,Jazz,1959,"Hard Bop, Cool Jazz","Rated 4.00 of 17 votes (201 have, 28 want)",Very Good Plus (VG+),Sleeve: Very Good Plus (VG+),99.6%,nan,nan,$30.00
Sonny Rollins – Sonny Rollins,"Everest Records Archive Of Folk & Jazz Music – FS-220, Archive Of Folk Music – FS-220",US,"Vinyl, LP, Album","An Everest Records Production
Recorded Nov 4, 1957 in New York

Electronically enhanced for stereo effect.
Track A1 wrongly titled ""Sunny Moon For Two"".

Variations on this release:
- Record Label on spine: Archive Of Folk Music
- Record Label on frontcover: Archive Of Folk Music [Jazz Series]
- Record Label on Center Labels: Everest Records Archive Of Folk & Jazz Music

Cat#
on Center Labels: FS 220",Jazz,1968,"Hard Bop, Bop","Rated 4.11 of 18 votes (367 have, 39 want)",Near Mint (NM or M-),Sleeve: Very Good Plus (VG+),100.0%,nan,Allentown Record Co. Inc.,$30.00
Eddie Harris – High Voltage,Atlantic – SD 1529,US,"Vinyl, LP, Album, Mono, Promo",Recorded live at the Village Gate in New York and at Shelly's Manne-Hole in Hollywood.,"Jazz, Funk / Soul, Blues",1969,"Hard Bop, Post Bop, Soul-Jazz","Rated 4.50 of 2 votes (13 have, 32 want)",Near Mint (NM or M-),Sleeve: Very Good Plus (VG+),99.9%,Shelly's Manne-Hole,Presswell,$30.00
The J.J. Johnson Quintet – Dial J.J. 5,Columbia – CL 1084,US,"Vinyl, LP, Album, Mono","Red and black label with six ""eye"" logos.",Jazz,1957,"Bop, Hard Bop","Rated 3.95 of 22 votes (273 have, 35 want)",Near Mint (NM or M-),Sleeve: Very Good Plus (VG+),100.0%,nan,nan,$30.00
John Jenkins (2) – Jazz Eyes,"Regent – MG 6056, Regent – RMG 6056",US,"Vinyl, LP, Album","Recorded September 10, 1957.
Front cover & label credits Art Taylor, not Arthur Taylor as on the rear cover.
Green Regent label with ""RMG 6056"" as catalog number.
Runoff grooves has ""RVG"", ""RMG 6056-A"" and ""RMG 6056-B"" and X20 engraved. Also the horizontal ""A"".",Jazz,1957,"Hard Bop, Bop","Rated 3.75 of 4 votes (39 have, 109 want)",Good (G),Sleeve: Poor (P),100.0%,"Van Gelder Studio, Hackensack, New Jersey",nan,$30.00
The Horace Silver Quintet – You Gotta Take A Little Love,Blue Note – BST 84309,US,"Vinyl, LP, Album, Stereo, Unipak","Recorded January 10 & 17, 1969.

Writing credits listed as ""H. Silver"" and ""B. Maupin"" on back cover and as ""Silver"" and ""Bennie Maupin"" on labels",Jazz,1969,"Hard Bop, Soul-Jazz","Rated 4.50 of 44 votes (441 have, 127 want)",Near Mint (NM or M-),Sleeve: Very Good Plus (VG+),100.0%,"Van Gelder Studio, Englewood Cliffs, New Jersey","All Disc Records, Inc.",$30.00
Art Farmer & Donald Byrd – Trumpets All Out,Prestige – PR 7344,US,"2 × Vinyl, LP, Compilation, Mono, RVG","Gatefold album. This is a compilation of two previously released albums on Prestige, Farmer* / Byrd* - 2 Trumpets and Art Farmer / Donald Byrd / Idrees Sulieman - Three Trumpets.

Matrix etchings (PRLP 7062 & PRLP 7092) from original albums are scratched out with PR-7344 release etched in.",Jazz,1964,Hard Bop,"Rated 4.75 of 8 votes (54 have, 8 want)",Very Good Plus (VG+),Sleeve: Very Good Plus (VG+),99.7%,nan,"Abbey Record Manufacturing Co., Inc.",$30.00
Art Farmer & Donald Byrd – Trumpets All Out,Prestige – PR 7344,US,"2 × Vinyl, LP, Compilation, Mono, RVG","Gatefold album. This is a compilation of two previously released albums on Prestige, Farmer* / Byrd* - 2 Trumpets and Art Farmer / Donald Byrd / Idrees Sulieman - Three Trumpets.

Matrix etchings (PRLP 7062 & PRLP 7092) from original albums are scratched out with PR-7344 release etched in.",Jazz,1964,Hard Bop,"Rated 4.75 of 8 votes (54 have, 8 want)",Near Mint (NM or M-),Sleeve: Very Good Plus (VG+),100.0%,nan,"Abbey Record Manufacturing Co., Inc.",$30.00
Miles Davis – Miles Davis At Carnegie Hall,Columbia – CS 8612,US,"Vinyl, LP, Album, Stereo","Two-eye Columbia label with black 360º Sound on the bottom of the label.
Label variation, this was released right on the transition from 6 eye to 2 eye label & as such, depending on the pressing plant label stock, it appeared with both 6 eye & 2 eye labels. The transition began in June 62. This LP was pressed & released in July 62. The 6 eyes are definitely from June-July 62 but the 2 eyes will be from June 62-July 63 when the 2 eye label changed again to include small black arrows at either end of the ""360 Sound Stereo"" lettering.",Jazz,1962,"Hard Bop, Modal","Rated 4.28 of 25 votes (278 have, 91 want)",Very Good (VG),Sleeve: Very Good (VG),99.9%,nan,nan,$30.00
The Dave Brubeck Quartet – Time Further Out (Miro Reflections),Columbia – CL 1690,US,"Vinyl, LP, Album, Mono",6-eye Columbia logo,Jazz,1961,Hard Bop,"Rated 4.16 of 117 votes (1544 have, 81 want)",Very Good Plus (VG+),Sleeve: Mint (M),99.7%,nan,"Columbia Records Pressing Plant, Pitman",$30.00
The Incredible Jimmy Smith* Featuring Kenny Burrell And Grady Tate – Organ Grinder Swing,Verve Records – V-8628,US,"Vinyl, LP, Album, Mono","Different from The Incredible Jimmy Smith* Featuring Kenny Burrell And Grady Tate - Organ Grinder Swing
- This release is not Deep Groove
- Very subtle text alignment differences on label.

Recorded June 14 and 15, 1965 at Van Gelder Recording Studio, Englewood Cliffs, New Jersey.
Tracks A1, B2, B3 ASCAP.
Tracks A2, A3 BMI.
Track B1 P.D. (public domain).

Gatefold cover with printed inner company sleeve.",Jazz,1965,"Hard Bop, Soul-Jazz","No Rating Yet (44 have, 14 want)",Near Mint (NM or M-),Sleeve: Near Mint (NM or M-),100.0%,nan,MGM Record Manufacturing Division,$30.00
Herb Geller – Herb Geller Plays,EmArcy – MG-36045,US,"Vinyl, LP, Album, Mono","Tracks A1-A2 and B1-B2 recorded August 24, 1955.
Tracks A3-A5 and B6 recorded August 9, 1954.
Tracks A6 and B3-B5 recorded August 6, 1954.",Jazz,1955,"Bop, Hard Bop","Rated 3.75 of 8 votes (45 have, 21 want)",Very Good Plus (VG+),Sleeve: Very Good Plus (VG+),98.7%,nan,nan,$30.00
Howard McGhee – Maggie's Back In Town !!,Contemporary Records – M3596,US,"Vinyl, LP, Album, Mono","Recorded June 26, 1961 at Contemporary Records in Los Angeles.",Jazz,1961,Hard Bop,"Rated 4.60 of 5 votes (45 have, 56 want)",Very Good (VG),Sleeve: Very Good Plus (VG+),99.6%,Contemporary Records,nan,$30.00
Miles Davis All Stars – Walkin',"Prestige – 7076, Prestige – PRLP 7076",US,"Vinyl, LP, Album, Repress, Mono","Yellow deep groove Prestige fireworks label with ""203 South Washington Ave. Bergenfield, N.J."" address on the labels, second pressing. Small secondary pressing ring around side B spindle hole attributed to Abbey Record Manufacturing.

Laminated front cover. Back cover has ""PRESTIGE RECORDS, INC., 447 West 50th Street, New York 19, N.Y."" address along bottom.",Jazz,1959,Hard Bop,"Rated 4.39 of 38 votes (348 have, 188 want)",Good Plus (G+),Sleeve: Good Plus (G+),100.0%,nan,"Abbey Record Manufacturing Co., Inc.",$30.00
Sonny Rollins – Jazz Classics,Prestige – PRST 7433,US,"Vinyl, LP, Album, Stereo, Blue label with silver trident","Stereo US pressing with blue label and silver trident on right.
Liner notes on back cover dated Feb. 1966

A1 - B1 recorded August 18, 1954
B2 recorded October 25, 1954",Jazz,1967,"Bop, Hard Bop","Rated 3.67 of 3 votes (34 have, 31 want)",Near Mint (NM or M-),Sleeve: Very Good (VG),100.0%,"Van Gelder Studio, Hackensack, New Jersey",nan,$30.00
Shirley Scott Trio – Great Scott!!,Impulse! – A-67,US,"Vinyl, LP, Mono","Tracks A1 to A5 - Recorded May 20, 1964.
Tracks B1 to B4 - Recorded May 14, 1964.",Jazz,1964,"Soul-Jazz, Hard Bop","Rated 3.92 of 13 votes (291 have, 50 want)",Near Mint (NM or M-),Sleeve: Very Good Plus (VG+),96.5%,nan,nan,$30.00
Art Farmer And His Orchestra – The Aztec Suite,United Artists Records – UAS 5082,US,"Vinyl, LP, Album, Reissue, Stereo",nan,Jazz,1960,"Bop, Cool Jazz, Hard Bop","No Rating Yet (15 have, 16 want)",Very Good Plus (VG+),Sleeve: Very Good Plus (VG+),99.8%,nan,nan,$30.00
Gigi Gryce – Gigi Gryce,MetroJazz – E1006,US,"Vinyl, LP, Album, Mono","Recorded in New York City, 1958.",Jazz,1958,Hard Bop,"Rated 4.00 of 2 votes (15 have, 46 want)",Very Good (VG),Sleeve: Very Good (VG),99.6%,nan,nan,$30.00
Shirley Scott – Girl Talk,"Impulse! – A-9141, ABC Records – A-9141",US,"Vinyl, LP, Album, Stereo",gatefold,Jazz,1967,"Soul-Jazz, Hard Bop","Rated 3.70 of 10 votes (151 have, 45 want)",Near Mint (NM or M-),Sleeve: Near Mint (NM or M-),99.4%,nan,nan,$30.00
Jimmy Smith – Groove Drops,Verve Records – V6-8794,US,"Vinyl, LP, Album, Stereo",nan,"Jazz, Funk / Soul",1969,"Soul-Jazz, Hard Bop","Rated 4.04 of 25 votes (320 have, 133 want)",Near Mint (NM or M-),Sleeve: Near Mint (NM or M-),100.0%,nan,nan,$30.00
The Incredible Jimmy Smith* – Crazy! Baby,Blue Note – BST 84030,US,"Vinyl, LP, Album, Repress, Stereo","Recorded on January 4th, 1960.

""New York USA"" address on labels.",Jazz,1962,Hard Bop,"Rated 3.60 of 10 votes (136 have, 54 want)",Very Good Plus (VG+),Sleeve: Very Good Plus (VG+),99.5%,"Van Gelder Studio, Englewood Cliffs, New Jersey",Plastylite,$30.00
Eddie Harris – Smokin,Janus Records – JLS 3020,US,"Vinyl, LP, Album, Stereo","No line-up indicated
Electronically re-channeled for stereo",Jazz,1970,"Soul-Jazz, Hard Bop","Rated 4.38 of 16 votes (146 have, 168 want)",Mint (M),Sleeve: Very Good Plus (VG+),100.0%,nan,nan,$30.00
Miles Davis – Mode Study,"Columbia – S - I ~ II, CBS – S - I ~ II",Japan,"Vinyl, LP, Album, Mono
Vinyl, LP, Album, Misprint, Mono
All Media, Compilation","• Japanese 1962 pressing
• Made by Nippon Columbia Co. Ltd Japan
• Orange One-Eye Columbia Long Playing Label
• First-run II LP side 2 track listing error (""Flamenco Sketches"" listed first)",Jazz,1962,"Bop, Hard Bop, Modal","Rated 5.00 of 2 votes (19 have, 12 want)",Very Good (VG),Sleeve: Good (G),99.7%,nan,nan,$30.00
Various – The Jazz Life!,"Candid – 8019, Candid – CJM-8019",US,"Vinyl, LP, Album, Mono","All the selections except the Lucky Thompson were recorded at Nola Penthouse Studios, New York.
Tracks A1 & B2 recorded November 11, 1960.
Track A2 recorded November 15, 1960.
Track A3 recorded January 13, 1961.
Track B3 recorded November 1, 1960.

Orange and yellow label, deep groove.","Jazz, Blues",Oct 1961,"Hard Bop, Swing","Rated 4.83 of 6 votes (29 have, 17 want)",Very Good Plus (VG+),Sleeve: Very Good (VG),99.9%,Nola Recording Studios,nan,$30.00
Jimmy Smith – I'm Movin' On,Blue Note – BST 84255,US,"Vinyl, LP, Album, Stereo, Pitman Press",Recorded in 1963,Jazz,Aug 1967,"Hard Bop, Soul-Jazz","Rated 3.94 of 34 votes (415 have, 85 want)",Very Good Plus (VG+),Sleeve: Very Good Plus (VG+),99.5%,nan,"Columbia Records Pressing Plant, Pitman",$30.00
Wes Montgomery – Down Here On The Ground,A&M Records – SP-3006,US,"Vinyl, LP, Album","CTI
Gatefold,Stereo
(CTS 3011/3012)

Recorded December 20, 21, 1967 and January 22, 26, 1968 at Van Gelder Studio",Jazz,1968,"Hard Bop, Contemporary Jazz","Rated 4.00 of 14 votes (165 have, 52 want)",Near Mint (NM or M-),Sleeve: Very Good Plus (VG+),99.5%,"Van Gelder Studio, Englewood Cliffs, New Jersey",nan,$30.00
Dizzy Reece – The Rake / The Rebound,Blue Note – 45-1759,US,"Vinyl, 7""","47 W.63rd

Exerpt from Album BLP 4023",Jazz,1959,Hard Bop,"Rated 5.00 of 1 votes (13 have, 28 want)",Near Mint (NM or M-),Sleeve: Generic,99.3%,nan,nan,$30.00
Wynton Kelly – Wynton Kelly!,"Vee Jay Records – LP-3022, Vee Jay Records – VJLP-3022",US,"Vinyl, LP, Album, Mono","Cover/rear jacket and spine: LP-3022
Labels: VJLP-3022

Recorded July 20 & 21, 1961.",Jazz,1961,Hard Bop,"Rated 4.25 of 8 votes (136 have, 81 want)",Very Good (VG),Sleeve: Good (G),100.0%,Bell Sound Studios,"RCA Records Pressing Plant, Indianapolis",$30.00
"Johnny ""Hammond"" Smith* With Lem Winchester – Gettin' The Message","Prestige – PR 7217, Prestige – PRST 7217",US,"Vinyl, LP, Album, Stereo, Microgroove","Recorded at the Van Gelder Studio, Englewood Cliffs, NJ; Oct. 14, 1960.",Jazz,1961,"Hard Bop, Soul-Jazz","Rated 5.00 of 1 votes (28 have, 24 want)",Very Good Plus (VG+),Sleeve: Very Good Plus (VG+),92.3%,"Van Gelder Studio, Englewood Cliffs, New Jersey","Abbey Record Manufacturing Co., Inc.",$30.00
Clifford Brown And Max Roach – Study In Brown,"EmArcy – MG 36037, EmArcy – MG-36037",US,"Vinyl, LP, Album, Mono","Label: Small drummer label with silver rim
Record: Stamped YMG on one side
Cover: Blue back

Front jacket and labels: MG-36037
Spine and rear jacket: MG 36037",Jazz,1955,"Bop, Hard Bop","Rated 4.75 of 48 votes (375 have, 418 want)",Good (G),Sleeve: Good (G),100.0%,nan,"RCA Records Pressing Plant, Indianapolis",$30.00
Sonny Rollins – Shadow Waltz,JAZZLAND – JLP 86,US,"Vinyl, LP, Album, Reissue, Remastered, Mono","Reissue of Riverside RLP 12-258 entitled ""Freedom Suite"".",Jazz,1962,Hard Bop,"Rated 4.33 of 6 votes (50 have, 48 want)",Very Good Plus (VG+),Sleeve: Very Good (VG),99.8%,WOR Studios,nan,$30.00
Philly Joe Jones' Big Band Sounds* – Drums Around The World,Riverside Records – RLP 12-302,US,"Vinyl, LP, Album, Mono","New York; May, 1959.

Blue and silver label, deep groove.",Jazz,1959,"Big Band, Hard Bop","Rated 4.50 of 6 votes (78 have, 93 want)",Very Good Plus (VG+),Sleeve: Good (G),99.9%,Reeves Sound Studios,nan,$30.00
Charlie Mingus* – Tijuana Moods,RCA Victor – LPM-2533,US,"Vinyl, LP, Album, Remastered, Mono, Hollywood","Recorded July 18 and August 6, 1957.

West coast pressing (H) stamped in runouts.",Jazz,1962,"Hard Bop, Post Bop","Rated 4.42 of 48 votes (368 have, 328 want)",Very Good Plus (VG+),Sleeve: Fair (F),100.0%,"RCA Studios, New York","RCA Records Pressing Plant, Hollywood",$30.00
The Jaki Byard Quartet – Live! Vol. 1,Prestige – PR 7419,US,"Vinyl, LP, Album, Mono","Mono pressing on Blue “trident” label with Silver text
(Recorded live! at Lennie's on the Turnpike)",Jazz,1966,Hard Bop,"No Rating Yet (24 have, 17 want)",Very Good (VG),Sleeve: Very Good (VG),100.0%,nan,nan,$30.00
Clifford Brown – Remember Clifford,"Mercury – 20022 MCL, Mercury – 125 268 MCL",UK,"Vinyl, LP, Compilation, Mono",nan,Jazz,1964,Hard Bop,"Rated 4.00 of 2 votes (35 have, 9 want)",Very Good Plus (VG+),Sleeve: Very Good Plus (VG+),99.6%,nan,nan,$30.00
The Horace Silver Quintet Featuring Stanley Turrentine – Serenade To A Soul Sister,Blue Note – BST 84277,US,"Vinyl, LP, Album, Stereo, Gatefold","Recorded on February, 23 (A1-A3) and March 29 (B1-B3), 1968

Label is blue and white with ""Blue Note Records • A Division Of Liberty Records, Inc."".
Presumably pressed by Southern Plastics or another pressing plant based on the smaller pressing ring around spindle hole using metal from All Disc with 114 etches and VAN GELDER stamped in both sides runout.
Side A is printed as ""Side I"" (sans serif and not all caps) instead of ""Side 1"" or ""SIDE 1""",Jazz,1968,"Hard Bop, Latin Jazz","Rated 4.27 of 49 votes (496 have, 180 want)",Very Good (VG),Sleeve: Very Good Plus (VG+),99.9%,nan,nan,$30.00
James Moody – Cookin' The Blues,"Argo (6) – LP 756, Argo (6) – DJLP-756",US,"Vinyl, LP, Album, Promo, Mono","Recorded at the Jazz Workshop, San Francisco, 1961","Jazz, Blues",1965,Hard Bop,"No Rating Yet (1 have, 1 want)",Near Mint (NM or M-),Sleeve: Very Good Plus (VG+),96.7%,nan,nan,$30.00
Gil Evans Orchestra* Featuring Cannonball Adderley – New Bottle Old Wine,World Pacific Records – STEREO-1011,US,"Vinyl, LP, Stereo, Album",nan,Jazz,1958,"Hard Bop, Soul-Jazz","Rated 4.33 of 3 votes (50 have, 118 want)",Very Good Plus (VG+),Sleeve: Very Good (VG),99.0%,nan,nan,$30.00
Shirley Scott – Girl Talk,"Impulse! – A-9141, ABC Records – A-9141",US,"Vinyl, LP, Album, Stereo",gatefold,Jazz,1967,"Soul-Jazz, Hard Bop","Rated 3.70 of 10 votes (151 have, 45 want)",Near Mint (NM or M-),Sleeve: Very Good Plus (VG+),100.0%,nan,nan,$30.00
The Dave Brubeck Quartet – Time Changes,Columbia – CL 2127,US,"Vinyl, LP, Mono, Album","Red Two-Eye label w/ 'Guaranteed High Fidelity' rim text (1962 to 1964).
This version has one line of text left of Columbia logo on top-right corner of back cover.
For back cover variant with same labels see The Dave Brubeck Quartet - Time Changes.
For back cover with one text line, but a small 8 in lower right corner—with same labels—see The Dave Brubeck Quartet - Time Changes.

Recorded in NYC, October 15, 1963 (A5), November 20, 1963 (A4), December 3, 1963 (A1 to A3), December 12, 1963 and January 8, 1964 (B).",Jazz,1964,"Hard Bop, Post Bop","Rated 4.09 of 46 votes (742 have, 51 want)",Near Mint (NM or M-),Sleeve: Near Mint (NM or M-),100.0%,nan,nan,$30.00
Wes Montgomery – Full House,Riverside Records – SE-2076,USA & Canada,"Vinyl, 7"", 33 ⅓ RPM, Jukebox, Stereo",nan,Jazz,1962,Hard Bop,"No Rating Yet (5 have, 20 want)",Very Good (VG),Sleeve: Not Graded,100.0%,nan,nan,$30.00
Shirley Scott Trio – Great Scott!!,Impulse! – AS-67,US,"Vinyl, LP, Stereo","Tracks A1 to A5 - Recorded May 20, 1964.
Tracks B1 to B4 - Recorded May 14, 1964.

Publishers:
- A1, A5: Twin-Chris Music - ASCAP
- A2: United Artists Music Corp. - ASCAP
- A3: United Artists Music Co., Inc.
- A4: Noslen Music, Inc. - BMI
- B1: Advanced Music Corp. - ASCAP
- B2: Pamco Music, Inc. - BMI
- B3: Mills Music, Inc. - ASCAP
- B4: Stratford Music Corp. - ASCAP",Jazz,1964,"Soul-Jazz, Hard Bop","Rated 4.17 of 18 votes (253 have, 47 want)",Very Good Plus (VG+),Sleeve: Very Good Plus (VG+),100.0%,nan,nan,$30.00
Willis Jackson Quintet – Please Mr. Jackson,Prestige – PR 7162,US,"Vinyl, LP, Album, Mono","Recorded in Hackensack, NJ; May 25, 1959.",Jazz,1959,"Hard Bop, Soul-Jazz","Rated 4.33 of 9 votes (114 have, 84 want)",Very Good Plus (VG+),Sleeve: Not Graded,100.0%,"Van Gelder Studio, Hackensack, New Jersey",nan,$30.00
Oscar Peterson Trio* – West Side Story,Verve Records – V6-8454,US,"Vinyl, LP, Album, Stereo","Recorded in New York City, Jan. 24 & 25, 1962",Jazz,1962,"Hard Bop, Modal","Rated 4.09 of 22 votes (381 have, 41 want)",Near Mint (NM or M-),Sleeve: Near Mint (NM or M-),100.0%,nan,nan,$30.00
Sonny Rollins – Worktime,"Prestige – PR 7246, Prestige – PRLP 7246",US,"Vinyl, LP, Album, Mono, Reissue","Yellow and black label with Bergenfield address.

Recorded December 2, 1955.",Jazz,1962,"Bop, Hard Bop","Rated 5.00 of 4 votes (102 have, 81 want)",Very Good Plus (VG+),Sleeve: Good (G),99.2%,"Van Gelder Studio, Hackensack, New Jersey",nan,$30.00
The Thelonious Monk Quartet – Monk's Dream,Columbia – CS 8765,US,"Vinyl, LP, Album, Stereo","This version: Columbia 2-eye labels, '360 Stereo Sound' in black without arrows, Stereo CS 8765 in oval circle on cover front",Jazz,1963,Hard Bop,"Rated 4.57 of 133 votes (1364 have, 487 want)",Good Plus (G+),Sleeve: Very Good (VG),99.5%,nan,nan,$30.00
