Artist_Album,Label,Country,Format,Notes,Genre,Release_Date,Style,Rate_Haves_Wants,Media_Condition,Sleeve_Condition,Seller_Rating,Recorded_at,Pressed_by,Price
The Horace Silver Quintet – Doin' The Thing - At The Village Gate,Blue Note – BLP 4076,US,"Vinyl, LP, Album, Mono","Recorded on May 19 & 20, 1961.

Blue Mitchell performs by courtesy of Riverside Records.

Alfred Lion of Blue Note extends special thanks to Art D'Lagoff whose genial cooperation made this recording session possible.",Jazz,1966,Hard Bop,"Rated 4.67 of 6 votes (60 have, 53 want)",Near Mint (NM or M-),Sleeve: Near Mint (NM or M-),93.4%,Village Gate,nan,$52.29
Sonny Rollins And Coleman Hawkins – Sonny Meets Hawk!,RCA Victor – LPM-2712,US,"Vinyl, LP, Mono","Recorded in RCA Victor's Studio B, New York City.",Jazz,1963,"Bop, Hard Bop","Rated 4.20 of 5 votes (90 have, 69 want)",Near Mint (NM or M-),Sleeve: Very Good Plus (VG+),99.8%,nan,"RCA Records Pressing Plant, Rockaway",$50.00
Art Blakey – Holiday For Skins Vol. 2,Blue Note – BST 84005,US,"Vinyl, LP, Album, Stereo, Reissue","Additional/alternate title on the spine and cover reads “A Message From Blakey Vol. 2”.

Labels read: Blue Note Records - A division of Liberty Records, Inc.

Session recorded November 9th 1958.",Jazz,1966,"Hard Bop, Afro-Cuban Jazz","Rated 4.33 of 9 votes (60 have, 76 want)",Mint (M),Sleeve: Mint (M),99.6%,nan,nan,$52.50
Donald Byrd – Bo,Blue Note – 45-1799,US,"Vinyl, 7"", 45 RPM, Mono",Excerpt from Album BLP 4048,Jazz,1961,Hard Bop,"Rated 4.00 of 1 votes (13 have, 60 want)",Very Good (VG),Sleeve: Generic,100.0%,nan,nan,$50.00
Sonny Rollins Quartet – Tenor Madness,Prestige – PRLP 7047,US,"Vinyl, LP, Album, Reissue, Mono","Recorded in Hackensack, NJ; May 24, 1956.

Deep groove both sides of the label.
Bergenfield, NJ address on the label.",Jazz,1958,"Bop, Hard Bop","Rated 4.80 of 10 votes (72 have, 113 want)",Good (G),Sleeve: Fair (F),100.0%,"Van Gelder Studio, Hackensack, New Jersey","Abbey Record Manufacturing Co., Inc.",$50.00
The Incredible Jimmy Smith* – Crazy! Baby,"Blue Note – 4030, Blue Note – BLP 4030",US,"Vinyl, LP, Album, Repress, Mono","Recorded on January 4, 1960.

Labels: Blue Note Records Inc. • New York USA
Back cover: Blue Note Records Inc., 43 West 61st St., New York 23

First released in 1960.

This version was likely repressed between 1962 and 1966 and can be identified by the company information printed on the labels.

This version has the title and shapes in blue on the cover.",Jazz,1962,Hard Bop,"Rated 3.53 of 17 votes (306 have, 75 want)",Good Plus (G+),Sleeve: Very Good Plus (VG+),98.9%,"Van Gelder Studio, Englewood Cliffs, New Jersey",Plastylite,$50.00
Enrique Villegas / Paul Gonsalves / Willie Cook – Encuentro,Trova – TL-22,Argentina,"Vinyl, LP, Album, Mono",Grabado el 15 de Setiembre de 1968,Jazz,1969,Hard Bop,"Rated 5.00 of 1 votes (21 have, 28 want)",Very Good Plus (VG+),Sleeve: Very Good (VG),97.6%,nan,nan,$50.00
The Kenny Drew Trio – Pal Joey,Riverside Records – RLP 12-249,US,"Vinyl, LP, Album, Mono","Recorded in New York; October 15, 1957.

Deep groove, blue labels.",Jazz,1957,Hard Bop,"Rated 5.00 of 1 votes (46 have, 60 want)",Very Good Plus (VG+),Sleeve: Very Good (VG),99.7%,nan,nan,$50.00
Art Farmer – Brass Shout,United Artists Records – UAS 5079,US,"Vinyl, LP, Album, Reissue, Stereo",nan,Jazz,1962,Hard Bop,"Rated 3.00 of 1 votes (10 have, 23 want)",Near Mint (NM or M-),Sleeve: Near Mint (NM or M-),99.6%,nan,nan,$50.00
The Horace Silver Quintet – Silver's Serenade,Blue Note – BST 84131,US,"Vinyl, LP, Album, Stereo","Silver's Serenade and Nineteen Bars recorded May 7, 1963 at Rudy Van Gelder Studio, Englewood Cliffs, NJ. Let's Get To The Nitty Gritty, Sweet Sweetie Dee and The Dragon Lady recorded May 8, 1963 at Rudy Van Gelder Studio, Englewood Cliffs, NJ.

""VAN GELDER"" and ""STEREO"" are stamped and the symbol of an ear is inscribed in the run out groove of both sides.

Blue and white label, with ""Blue Note Records Inc • New York USA"".

Back cover reads ""43 West 61st St., New York 23"".",Jazz,1963,Hard Bop,"Rated 4.52 of 25 votes (187 have, 119 want)",Very Good Plus (VG+),Sleeve: Very Good Plus (VG+),99.5%,"Van Gelder Studio, Englewood Cliffs, New Jersey",Plastylite,$50.00
Joe Masters – The Jazz Mass,Columbia – CL 2598,US,"Vinyl, LP, Album, Mono, Promo","White Columbia ""2-eyes"" labels have ""Radio Station Copy - Not For Resale"" printed.",Jazz,1967,"Cool Jazz, Hard Bop","Rated 3.50 of 2 votes (16 have, 8 want)",Near Mint (NM or M-),Sleeve: Very Good Plus (VG+),99.8%,nan,nan,$50.00
Brown And Roach Incorporated* – Brown And Roach Incorporated,"Emarcy – MG 36008, Mercury – MG 36008",US,"Vinyl, LP, Album, Mono","Available on 45 rpm - EP-1-6111, EP-1-6112 and EP-1-6113",Jazz,1955,"Bop, Hard Bop","Rated 4.50 of 34 votes (254 have, 178 want)",Very Good (VG),Sleeve: Good Plus (G+),99.9%,nan,nan,$50.00
Wes Montgomery – Down Here On The Ground,"A&M Records – SP-3006, CTI Records – SP-3006",US,"Vinyl, LP, Album, Stereo, Gatefold","1968 US gate fold release with a full matte laminated jacket with full tip on center sheet.
Recorded December 20, 21, 1967 and January 22, 26, 1968 at Van Gelder Studio.",Jazz,1968,"Hard Bop, Post Bop","Rated 4.50 of 4 votes (104 have, 26 want)",Near Mint (NM or M-),Sleeve: Near Mint (NM or M-),100.0%,"Van Gelder Studio, Englewood Cliffs, New Jersey",nan,$50.00
"Donald Byrd – At The Half Note Cafe, Volume 1",Blue Note – BST 84060,US,"Vinyl, LP, Album, Reissue, Stereo","Recorded live at the Half Note Cafe, New York City on November 11, 1960.

Introduction (side A) by Ruth Mason
Introduction (side B) by Donald Byrd

Black & light blue label, used 1970-71",Jazz,1970,Hard Bop,"Rated 4.56 of 16 votes (139 have, 59 want)",Very Good Plus (VG+),Sleeve: Very Good Plus (VG+),96.5%,Half Note,nan,$50.00
Art Blakey And The Jazz Messengers* – The Witch Doctor,Blue Note – BST 84258,US,"Vinyl, LP, Album","This label was used from 1966-1970.
Recorded on March 14, 1961.

Matrix: BNST-84258-1 and BNST-84258-2 no VAN GELDER stamp like earlier pressing.
West coast pressing

Publishers:
- A1 to A3, B2: Blue Horizon Music, Inc. - BMI
- B1: Orricle Music Publ. Corp. - BMI
- B3: Conrad Music - BMI",Jazz,1967,Hard Bop,"Rated 4.00 of 5 votes (68 have, 105 want)",Near Mint (NM or M-),Sleeve: Very Good Plus (VG+),97.2%,"Van Gelder Studio, Englewood Cliffs, New Jersey",nan,$50.00
Michel Roques Trio – Safari,Homère – HO 5004,France,"Vinyl, LP, Album","Prix Django Reinhardt 1969
Gravure Universelle

Track A2 named ""Ay Cuba-Libre"" on center label only.",Jazz,1969,"Free Jazz, Hard Bop, Avant-garde Jazz","Rated 4.86 of 7 votes (21 have, 96 want)",Very Good Plus (VG+),Sleeve: Very Good Plus (VG+),100.0%,nan,nan,$50.00
The Horace Silver Quintet – Song For My Father (Cantiga Para Meu Pai),Blue Note – BST 84185,US,"Vinyl, LP, Album, Stereo","Labels: BST 84185
Rear jacket: BLP-4185/84185
Front cover and spine: 84185

Blue/White Stereo labels- ""BLUE NOTE RECORDS • A DIVISION OF LIBERTY RECORDINGS, INC.""",Jazz,1966,"Hard Bop, Latin Jazz","Rated 4.13 of 8 votes (91 have, 174 want)",Very Good (VG),Sleeve: Very Good Plus (VG+),100.0%,nan,nan,$50.00
Miles Davis – Jazz Track,Columbia – CL 1268,US,"Vinyl, LP, Mono","This record has a ""Red & Black 6 Eye"" label.

The Jazz Track LP compilation is made up of two unrelated studio sessions.
The A side recorded on Dec 4, 1957, is devoted to ten songs composed for the soundtrack to the French film ""L'Ascenseur Pour l'Echafaud."" The B side represents only a portion of the May 26, 1958, studio session that has since been reissued in full on CD.",Jazz,Nov 1959,Hard Bop,"Rated 4.31 of 59 votes (687 have, 276 want)",Very Good Plus (VG+),Sleeve: Good Plus (G+),97.2%,nan,nan,$50.00
Sonny Rollins – The Bridge,"RCA Victor – LPM/LSP-2527, RCA Victor – LPM 2527",US,"Vinyl, LP, Album, Mono","Recorded at RCA Victor's Studio B, New York City on January 30, 1962 (B2), February 13, 1962 (A2,A3,B3), February 14, 1962 (A1,B1).

(C) 1962",Jazz,1962,Hard Bop,"Rated 4.45 of 51 votes (495 have, 477 want)",Very Good (VG),Sleeve: Very Good Plus (VG+),99.6%,RCA's Studio B,"RCA Records Pressing Plant, Rockaway",$50.00
Nick Ayoub Quintet – The Montreal Scene,RCA Victor – PC-1042,Canada,"Vinyl, LP, Album, Mono","Title appears as ""The Jazz Scene: Montreal"" on labels
Dynagroove",Jazz,1964,"Hard Bop, Cool Jazz","Rated 4.25 of 4 votes (44 have, 157 want)",Good (G),Sleeve: Fair (F),98.7%,nan,nan,$50.00
Manfred Krug Und Die Modern Jazz Big Band 65 – Manfred Krug Und Die Modern Jazz Big Band 65,AMIGA – 8 50 057,German Democratic Republic (GDR),"Vinyl, LP, Album, Repress, Mono",Mitschnitt einer öffentlichen Veranstaltung im Theater der Freundschaft in Berlin am 22. Januar 1965,"Jazz, Pop",1968,"Big Band, Vocal, Hard Bop","Rated 5.00 of 1 votes (18 have, 28 want)",Near Mint (NM or M-),Sleeve: Very Good Plus (VG+),100.0%,"Theater Der Freundschaft, Berlin",nan,$50.00
Sonny Stitt – Only The Blues,Verve Records – MG V-8250,US,"Vinyl, LP, Album",nan,Jazz,1958,Hard Bop,"Rated 4.20 of 5 votes (84 have, 56 want)",Very Good Plus (VG+),Sleeve: Very Good Plus (VG+),99.6%,nan,nan,$50.00
The Thelonious Monk Orchestra – At Town Hall,Riverside Records – RLP 1138,US,"Vinyl, LP, Album, Stereo, Reissue","Recorded in concert in New York City; Feb. 28, 1959.",Jazz,1963,"Bop, Hard Bop","Rated 4.00 of 3 votes (40 have, 31 want)",Near Mint (NM or M-),Sleeve: Very Good Plus (VG+),99.6%,"Town Hall, New York",nan,$50.00
Charles Mingus – Mingus At Monterey,"Jazz Workshop – JWS 001, Jazz Workshop – JWS 002",US,"2 × Vinyl, LP, Album, Repress, Stereo","Recorded September 20, 1964, at the Monterey Jazz Festival, Monterey, California.

Finally released for world-wide public sale by Charles Mingus.
Exclusively distributed by Saul Zaentz and Fantasy Records.
Balanced Stereo printed at bottom of labels.

Sides as follows:

Side 1A = side 1
Side 2A = side 2
Side 1B = side 3
Side 2B = side 4

Some copies contained a rare lithographed letter written by Charles Mingus asking for donations because of financial problems he faced from not receiving royalty payments from past recordings (see images).

Issued in a gatefold cover.",Jazz,1968,"Hard Bop, Post Bop","Rated 4.14 of 21 votes (217 have, 59 want)",Very Good Plus (VG+),Sleeve: Good Plus (G+),99.9%,Monterey Jazz Festival,nan,$50.00
Lee Morgan – Charisma,Blue Note – BST 84312,US,"Vinyl, LP, Album, Gatefold","A division of Liberty Records, Inc.

Recorded at Rudy Van Gelder Studio, Englewood Cliffs, NJ, September 29, 1966.",Jazz,1969,"Hard Bop, Latin Jazz","Rated 4.55 of 47 votes (359 have, 229 want)",Very Good Plus (VG+),Sleeve: Very Good Plus (VG+),99.9%,"Van Gelder Studio, Englewood Cliffs, New Jersey",nan,$50.00
Gene Ammons – Nice An' Cool,"Moodsville – MV 18, Moodsville – MVLP 18",US,"Vinyl, LP, Album","Recorded January 26, 1961.",Jazz,1961,Hard Bop,"Rated 4.43 of 7 votes (66 have, 74 want)",Near Mint (NM or M-),Sleeve: Very Good Plus (VG+),98.8%,"Van Gelder Studio, Englewood Cliffs, New Jersey",nan,$50.00
Lou Donaldson – Blues Walk,Blue Note – BLP 1593,US,"Vinyl, LP, Album, Repress, Mono, NY label","Blue & white label
""New York USA"" address
""33 1/3 microgroove LONG PLAYING""
RVG, P (ear), 9M

Recorded on July 28, 1958.",Jazz,1962,"Bop, Hard Bop","Rated 3.25 of 4 votes (30 have, 119 want)",Good Plus (G+),Sleeve: Very Good (VG),99.9%,"Van Gelder Studio, Hackensack, New Jersey",Plastylite,$50.00
Miles Davis – Jazz Track,Columbia – CL 1268,US,"Vinyl, LP, Mono","This record has a ""Red & Black 6 Eye"" label.
Label variation of release 511939: Larger fonts, ""ELEVATOR TO THE SCAFFOLD"" text split in two lines, track titles left-justified.

The Jazz Track LP compilation is made up of two unrelated studio sessions.
The A side recorded on Dec 4, 1957, is devoted to ten songs composed for the soundtrack to the French film ""L'Ascenseur Pour l'Echafaud."" The B side represents only a portion of the May 26, 1958, studio session that has since been reissued in full on CD.",Jazz,Nov 1959,Hard Bop,"Rated 4.67 of 6 votes (46 have, 56 want)",Very Good Plus (VG+),Sleeve: Good Plus (G+),100.0%,nan,nan,$50.00
Miles Davis – Seven Steps To Heaven,Columbia – CS 8851,US,"Vinyl, LP, Album, Repress, Stereo","Tracks A1, A3, B2 recorded in Hollywood, Cal.
Tracks A2, B1, B3 recorded in New York.

Columbia 2-Eye label. STEREO & ""360 SOUND"" in white text which replaced the first press black text in 1963. Probably a repress but most likely this edition is simply a label change.",Jazz,1963,"Hard Bop, Modal","Rated 5.00 of 2 votes (28 have, 48 want)",Very Good Plus (VG+),Sleeve: Very Good Plus (VG+),99.8%,nan,nan,$50.00
Lee Morgan – The Sidewinder,"Blue Note – BLP 4157, Blue Note – 4157",US,"Vinyl, LP, Album, Mono","Recorded on December 21, 1963.

Barry Harris performs courtesy of Riverside Records.

1st Pressings have labels with “New York, USA” address, vangelder and ear (P for Plastylite pressing plant) in the matrix.",Jazz,Jul 1964,Hard Bop,"Rated 4.62 of 140 votes (1163 have, 1104 want)",Good Plus (G+),Sleeve: Good (G),100.0%,"Van Gelder Studio, Englewood Cliffs, New Jersey",Plastylite,$50.00
"Various – The Playboy Jazz All-Stars, Volume 3",Playboy Records – PB1959S,US,"3 × Vinyl, LP, Album, Stereo
Box Set, Compilation","Boxset Including 3 LPs (Album A, Album B, Album C) and a 28-page 12""x12"" booklet.
© 1960 Playboy Records, a division of Playboy Magazine

Track A1 recorded August 8, 1959 at Playboy Jazz Festival, Chicago, Illinois.
Track A2 recorded March 1958 at New York. Roulette Records.
Track A3 recorded August 9, 1959 at Playboy Jazz Festival, Chicago, Illinois.
Track A4 recorded May 26, 1959 at Los Angeles, California. Contemporary Records.
Track A5 recorded October 19, 1957 at Hollywood, California. Verve Records.
Track A6 recorded January 25, 1959 at Compton College, Compton, California. Capitol Records.
Track B1 recorded September 11, 1956 at New York. Columbia Records.
Track B2 recorded July 1, 1959 at the Roundtable, New York. Roulette Records.
Track B3 recorded April 27, 1959 at New York. Columbia Records.
Track B4 recorded December 9, 1957 at New York. World Pacific Records.
Track B5 recorded July 13, 1957 at New York. World Pacific Records.
Track C1 recorded August 9, 1959 at Playboy Jazz Festival, Chicago, Illinois. Verve Records.
Track C2 recorded October 8, 1957 at Hollywood, California. Capitol Records.
Track C3 recorded September 4, 1958 at Hollywood, California. Park Recording Company, Inc., Chess Records.
Track C4 recorded July 10, 1959 at New York. Verve Records.
Track C5 recorded January 12, 1959 at Hollywood, California. Columbia Records.
Track D1 recorded August 8, 1959 at Playboy Jazz Festival, Chicago, Illinois. Verve Records.
Track D2 recorded October 14, 1957 at Hollywood, California. Verve Records.
Track D3 recorded December 19, 1958 at Los Angeles, California. Contemporary Records.
Track D4 recorded August 23, 1958 at New York. Columbia Records.
Track D5 recorded March 5, 1954 at New York. Prestige Records.
Track E1 recorded August 8, 1959 at Playboy Jazz Festival, Chicago, Illinois.
Track E2 recorded December 11, 1957 at New York. Verve Records.
Track E3 recorded January 5, 1959 at New York. Columbia Records.
Track E4 recorded December 1958 at Hollywood, California. King Records.
Track E5 recorded December 4, 1957 at New York. World Pacific Records.
Track F1 recorded April 13, 1959 at New York. Audio Fidelity Records.
Track F2 recorded September 7, 1959 at New York. Warner Brothers Records.
Track F3 recorded May 21, 1957 at New York. Atlantic Records.
Track F4 recorded April 10, 1957 at Hollywood, California. Capitol Records, Essex Productions.
Track F5 recorded October 22, 1958 at Los Angeles, California. Contemporary Records.
Track F6 recorded October 10, 1959 at Chicago, Illinois. Playboy Records.",Jazz,1960,"Cool Jazz, Dixieland, Swing, Hard Bop, Big Band, Bop","Rated 4.33 of 9 votes (177 have, 49 want)",Very Good Plus (VG+),Sleeve: Very Good (VG),99.7%,Playboy Jazz Festival,nan,$50.00
Billy Larkin And The Delegates – Don't Stop!,World Pacific Records – WPS-21863,US,"Vinyl, LP, Album, Stereo",nan,Jazz,1967,"Hard Bop, Soul-Jazz","Rated 4.57 of 14 votes (94 have, 83 want)",Near Mint (NM or M-),Sleeve: Very Good (VG),100.0%,nan,nan,$50.00
"Eddie ""Lockjaw"" Davis / Johnny Griffin Quintet* – The Tenor Scene (A Live Recording At Minton's Playhouse)","Prestige – PRLP 7191, Prestige – Prestige 7191",US,"Vinyl, LP, Album, Mono","Jacket and spine: Prestige 7191
Labels: PRLP 7191

Prestige Records
203 South Washington Ave., Bergenfield, N.J.

Alt. title from label... The Tenor Scenes
Eddie ""Lockjaw"" Davis / Johnny Griffin Quintet
At Minton's Playhouse",Jazz,1961,Hard Bop,"Rated 3.89 of 9 votes (85 have, 101 want)",Very Good Plus (VG+),Sleeve: Very Good (VG),100.0%,Minton's Playhouse,"Abbey Record Manufacturing Co., Inc.",$50.00
Elvin Jones – Dear John C.,Impulse! – LP AS-88,US,"Vinyl, 7"", 33 ⅓ RPM, Jukebox, Stereo","7"" jukebox mini LP with cardboard cover and Seeburg jukebox title strips.",Jazz,1965,Hard Bop,"Rated 5.00 of 2 votes (20 have, 38 want)",Very Good Plus (VG+),Sleeve: Very Good Plus (VG+),100.0%,nan,nan,$50.00
The Incredible Jimmy Smith* – Back At The Chicken Shack,Blue Note – BST 84117,US,"Vinyl, LP, Album, Reissue, Stereo","Originally released 1963. On center label: ""A division of LIberty Records, Inc."", indicating release date is between 1966-1970, where Goldmine has this dated 1967.

Track A2 is incorrectly credited to Rodgers-Hammerstein on the back cover.",Jazz,1967,Hard Bop,"Rated 4.75 of 8 votes (102 have, 155 want)",Very Good Plus (VG+),Sleeve: Very Good Plus (VG+),99.4%,nan,nan,$50.00
Miles Davis – Birth Of The Cool,"Capitol Records – DT-8-1974, Capitol Records – DT 8-1974",US,"Vinyl, LP, Compilation, Club Edition, Reissue, Duophonic Stereo","11 tracks

Reissue of Capitol: T 762

Capitol black/rainbow label with Capitol logo above spindle hole. ""Manufactured Under License From Capitol Records Inc."" on bottom rim means Decca press.

Copies of non-gatefold Capitol albums that were released through the record club from 1969 through 1972 have three ""hash marks"" at the upper left hand corner of the cover.

Capitol label releases that were pressed by Decca for Longines and distributed by Longines were first made available in early 1969. The black label, shown, continued until about July of that year, just after the regular Capitol releases changed to the new green label. The print at the rim of the label states that the records were ""Manufactured under license from Capitol..."" rather than ""Mfd. by Capitol.""",Jazz,1969,"Bop, Hard Bop","Rated 4.33 of 6 votes (75 have, 284 want)",Very Good Plus (VG+),Sleeve: Very Good (VG),100.0%,nan,nan,$50.00
Prince Lasha Ensemble – Insight,CBS – 62409,UK,"Vinyl, LP, Album, Stereo",Recorded 1966 in England,Jazz,1966,"Cool Jazz, Hard Bop","Rated 4.50 of 8 votes (43 have, 142 want)",Good Plus (G+),Sleeve: Very Good (VG),100.0%,nan,nan,$50.00
"Arnett Cobb And Eddie ""Lockjaw"" Davis – Blow, Arnett, Blow","Prestige – 7151, Prestige – PRST 7151",US,"Vinyl, LP, Album, Stereo","1st cat# on front sleeve; 2nd cat# on center labels

silver and black Prestige stereo center labels",Jazz,1959,"Hard Bop, Soul-Jazz","Rated 4.33 of 6 votes (67 have, 33 want)",Very Good (VG),Sleeve: Very Good (VG),100.0%,nan,nan,$50.00
The Birdland Stars – The Birdland Stars On Tour Vol. 2,RCA Victor – LPM-1328,US,"Vinyl, LP, Album, Mono",nan,Jazz,1956,Hard Bop,"Rated 4.00 of 1 votes (77 have, 8 want)",Near Mint (NM or M-),Sleeve: Near Mint (NM or M-),99.6%,nan,nan,$50.00
John Coltrane – Stardust,"Prestige – PR 7268, Prestige – PRST 7268",US,"Vinyl, LP, Album, Repress, Stereo","Blue ""trident"" labels.",Jazz,1964,Hard Bop,"Rated 4.50 of 4 votes (44 have, 93 want)",Very Good Plus (VG+),Sleeve: Very Good Plus (VG+),100.0%,nan,nan,$50.00
The Kenny Drew Trio – Pal Joey,Riverside Records – RLP-1112,US,"Vinyl, LP, Album, Stereo","Recorded at NYC, October 15, 1957.

Original Riverside black label stereo release.",Jazz,1959,Hard Bop,"Rated 4.33 of 3 votes (18 have, 35 want)",Near Mint (NM or M-),Sleeve: Very Good Plus (VG+),100.0%,nan,nan,$50.00
Horace Silver Quintet* – 6 Pieces Of Silver,Blue Note – BLP 1539,US,"Vinyl, LP, Album, Mono","Recorded on November 10, 1956.

Address at bottom of back cover: Blue Note Records, 767 Lexington Ave, New York 21.

The first pressing of BLP 1539 has the Blue Note labels with the 767 Lexington Avenue address in the rim of the labels and no ""inc"" no ® and the 'deep groove' pressed in the label paper [see images].

The 47 west 63rd NYC address (also still with no ""inc"" no ® on labels, including 'deep groove' pressed in the label paper of both sides) features with those details on the first 1958 reissue, which can be found here; the bottom of the back cover also states the address Blue Note Records Inc, 47 West 63rd St., New York 23. Later reissues do carry the ""inc"" and ® on the labels.

These details have been extensively documented in the Blue Note guide for identifying original pressings by Frederic Cohen from the Jazz Record Center in New York.

The 1st original MONO issue has:
- blue and white Blue Note Records 767 Lexington Ave NYC address on deep grooved labels
- flat rim vinyl
- RVG etched and P for Plastylite plant etched in the dead wax, both sides,
- 767 Lexington Ave., New York 21 address on back-cover
- framed non laminated cover
- blank spine",Jazz,Nov 1956,Hard Bop,"Rated 4.31 of 35 votes (257 have, 371 want)",Fair (F),Sleeve: Fair (F),97.0%,"Van Gelder Studio, Hackensack, New Jersey",Plastylite,$50.00
The Gil Evans Orchestra* – Out Of The Cool,"Impulse! – AS-4, Impulse! – A-4, Impulse! – A-4-S",US,"Vinyl, LP, Album, Stereo","""A PRODUCT OF AM-PAR RECORD CORP"" on the bottom of labels.
""RVG STEREO"" stamped in dead wax.",Jazz,1961,"Hard Bop, Contemporary Jazz","Rated 4.59 of 51 votes (395 have, 257 want)",Very Good Plus (VG+),Sleeve: Good (G),95.5%,nan,nan,$50.00
Andrew Hill – Andrew!!!,Blue Note – BLP 4203,US,"Vinyl, LP, Album, Promo, Mono","Recorded on June 25, 1964.

Mono promo copies indicated by sticker at top reading ""Audition Mono LP Not For Sale"". Catalogue number on labels (BLP 4203) differs from cover (BST 4203). Apparently, Blue Note never made mono covers and used this sticker to identify mono promo copies.",Jazz,Apr 1968,"Post Bop, Hard Bop","Rated 4.75 of 4 votes (22 have, 200 want)",Very Good (VG),Sleeve: Poor (P),99.6%,"Van Gelder Studio, Englewood Cliffs, New Jersey",nan,$50.00
Stan Getz And J.J. Johnson – At The Opera House,Verve Records – MG V-8265,US,"Vinyl, LP, Album, Mono","Deep groove black trumpeter labels. This version does not have ""High Fidelity"" at the end of the bottom rim text.

Recorded Oct. 19, 1957",Jazz,1957,"Bop, Hard Bop","Rated 4.00 of 11 votes (179 have, 53 want)",Very Good Plus (VG+),Sleeve: Good (G),100.0%,Chicago Civic Opera House,nan,$50.00
Billy Mitchell – This Is Billy Mitchell,Smash Records (4) – MGS-27027,US,"Vinyl, LP, Mono","Recorded October 29 and 30, 1962, at Universal Studios, Chicago

Mono

Red Label",Jazz,1962,Hard Bop,"Rated 4.00 of 5 votes (43 have, 46 want)",Very Good Plus (VG+),Sleeve: Near Mint (NM or M-),99.7%,nan,nan,$50.00
Art Blakey And The Jazz Messengers* – Art Blakey And The Jazz Messengers,Fontana – FON-5024,Japan,"Vinyl, LP, Compilation, Mono",nan,Jazz,1961,Hard Bop,"Rated 4.67 of 3 votes (7 have, 4 want)",Very Good Plus (VG+),Sleeve: Very Good Plus (VG+),99.7%,nan,nan,$50.00
Miles Davis – Seven Steps To Heaven,Columbia – CS 8851,US,"Vinyl, LP, Album, Stereo","A1, A3 and B2 recorded in Hollywood
A2, B1 and B3 recorded in New York

This is the original US stereo release on red two eye Columbia labels with nonbreakable to left of center hole and '360 Sound' in black print at bottom.",Jazz,Sep 1963,"Hard Bop, Modal","Rated 4.61 of 23 votes (252 have, 134 want)",Very Good Plus (VG+),Sleeve: Very Good Plus (VG+),99.5%,nan,"Columbia Records Pressing Plant, Pitman",$50.00
John Coltrane With The Red Garland Trio – Traneing In,"Prestige – 7123, Prestige – PRLP 7123",US,"Vinyl, LP, Album, Reissue, Repress, Mono, Blue Trident Label","1964 repress of John Coltrane With The Red Garland Trio - Traneing In with blue Prestige ""trident"" labels, Washington St. Bergenfield address, no deep groove (see images). Cover is not laminated.

Catalog number on the front and back cover: 7123
Catalog number on the labels: PRLP 7123",Jazz,1964,Hard Bop,"Rated 4.50 of 6 votes (43 have, 104 want)",Very Good Plus (VG+),Sleeve: Very Good (VG),100.0%,nan,nan,$50.00
John Coltrane – Giant Steps,Atlantic – 1311,US,"Vinyl, LP, Album, Reissue, Mono",nan,Jazz,1967,Hard Bop,"Rated 4.50 of 10 votes (48 have, 432 want)",Very Good (VG),Sleeve: Generic,100.0%,nan,nan,$50.00
Monk* – Monk.,Columbia – CS 9091,US,"Vinyl, LP, Album, Stereo","Red ""360 Sound"" labels with black lettering and arrows in the rim text.
NONBREAKABLE under CS 9091 on Labels (both sides)",Jazz,1965,Hard Bop,"Rated 4.33 of 84 votes (998 have, 284 want)",Near Mint (NM or M-),Sleeve: Very Good Plus (VG+),98.9%,nan,nan,$50.00
Miles Davis – Miles Davis And The Modern Jazz Giants,"Prestige – PR 7650, Prestige – PRST 7650",US,"Vinyl, LP, Compilation, Remastered, Stereo","""The complete, historic, all-star recording session of December 24, 1954.""
""Electronically remastered for stereo.""",Jazz,1969,Hard Bop,"Rated 4.67 of 9 votes (96 have, 26 want)",Near Mint (NM or M-),Sleeve: Near Mint (NM or M-),100.0%,"Van Gelder Studio, Hackensack, New Jersey",nan,$50.00
