Artist_Album,Label,Country,Format,Notes,Genre,Release_Date,Style,Rate_Haves_Wants,Media_Condition,Sleeve_Condition,Seller_Rating,Recorded_at,Pressed_by,Price
"Freddie Hubbard – The Night Of The Cookers - Live At Club La Marchal, Volume 2",Blue Note – BLP 4208,US,"Vinyl, LP, Album, Mono","Recorded live on April 9, 1965.

1st original MONO issue has:
- blue/white Blue Note Records labels with NEW YORK USA,
- VAN GELDER stamped and ""P"" (wrongly called ""ear"") for Plastylite plant etched in the dead wax, both sides,
- non-laminated cover with 43 West 61st St., New York 23 address on back

Side 1 runout matrix has an ""X"" etched over the incorrect ""8"" and then followed by a correct ""7"".
Side 2 runout matrix has an ""X"" etched over the incorrect ""8"" and then followed by a correct ""7"" and then the correct ""B"" etched over the incorrect ""A"".",Jazz,1966,"Hard Bop, Post Bop","Rated 4.18 of 11 votes (68 have, 128 want)",Very Good Plus (VG+),Sleeve: Very Good Plus (VG+),99.7%,Club La Marchal,Plastylite,$175.00
"Freddie Redd Quartet With Jackie McLean – The Music From ""The Connection""","Blue Note – BLP 4027, Blue Note – 4027",US,"Vinyl, LP, Album, Mono, Deep groove labels","This version has Deep Groove labels that say Blue Note Records Inc 47 West 63rd NYC
RVG and Plastylite ""Ear"" stamped in deadwax

Laminated front cover",Jazz,1960,Hard Bop,"Rated 4.31 of 16 votes (193 have, 181 want)",Very Good Plus (VG+),Sleeve: Very Good (VG),97.4%,"Van Gelder Studio, Englewood Cliffs, New Jersey",Plastylite,$174.99
John Coltrane – Giant Steps,"Atlantic – SD-1311, Atlantic – SD 1311",US,"Vinyl, LP, Album, Reissue, Stereo","Reissue with black fan and ""Atlantic"" written vertically on both labels",Jazz,1965,Hard Bop,"Rated 5.00 of 1 votes (11 have, 118 want)",Very Good Plus (VG+),Sleeve: Very Good Plus (VG+),nan,nan,nan,$176.56
Blue Mitchell Sextet – Blue Soul,Riverside Records – RLP 12-309,US,"Vinyl, LP, Album, Mono","New York; September, 1959.",Jazz,1959,Hard Bop,"Rated 4.43 of 7 votes (78 have, 179 want)",Very Good (VG),Sleeve: Good Plus (G+),99.5%,Reeves Sound Studios,nan,$169.95
John Coltrane – Settin' The Pace,"Prestige – PR 7213, Prestige – PRLP 7213",US,"Vinyl, LP, Album, Mono","Recorded March 26, 1958.

Yellow confetti labels with Bergenfield, NJ address.",Jazz,1961,Hard Bop,"Rated 4.48 of 25 votes (241 have, 262 want)",Very Good Plus (VG+),Sleeve: Very Good Plus (VG+),100.0%,"Van Gelder Studio, Hackensack, New Jersey","Abbey Record Manufacturing Co., Inc.",$179.99
The Red Garland Trio Plus Ray Barretto – Manteca,Prestige – PRLP 7139,US,"Vinyl, LP, Album, Mono, Bergenfield, NJ","Original Mono pressing with yellow/black labels and 203 South Washington Ave., Bergenfield, N.J. address.

Recorded in Hackensack, NJ; April 1958.

The Red Garland Trio plus Ray Baretto on Conga.

Pressed onto very heavy vinyl and has visible rings on labels but not deep groove rings.",Jazz,1958,Hard Bop,"Rated 4.75 of 8 votes (66 have, 63 want)",Very Good Plus (VG+),Sleeve: Very Good Plus (VG+),99.6%,nan,nan,$175.00
Art Blakey – Blakey,EmArcy – MG 26030,US,"Vinyl, LP, 10""","Recorded on May 20, 1954 at Fine Sound, New York City;",Jazz,1955,Hard Bop,"Rated 4.57 of 7 votes (34 have, 75 want)",Very Good Plus (VG+),Sleeve: Very Good Plus (VG+),100.0%,Fine Sound,nan,$164.99
Cannonball Adderley – Somethin' Else,"Blue Note – BLP 1595, Blue Note – 1595",US,"Vinyl, LP, Album, Mono","This pressing has:
- W 63 street address.
- No ® and ""Blue Note Inc"" on side 1 label, but ® and ""Blue Note Inc"" are present on side 2 label.
- Deep groove on both sides.
- no Inc. in address on back cover.
-""P"", for Plastylite Recording plant etched.
- RVG stamped in the trail off, both sides.

Miles Davis performs by courtesy of Columbia Records.
Hank Jones performs by courtesy of Capitol Records.
Recorded on March 9, 1958.",Jazz,May 1958,"Bop, Hard Bop","No Rating Yet (7 have, 75 want)",Good Plus (G+),Sleeve: Good Plus (G+),100.0%,nan,Plastylite,$179.99
Art Blakey And The Jazz Messengers* – Art Blakey And The Jazz Messengers,Blue Note – BLP 4003,US,"Vinyl, LP, Album, Repress, Mono","Recorded on October 30, 1958.
Side 1 label reads: Blue Note Records Inc . New York USA
Side 2 label reads: Blue Note Records Inc. 47 West 63rd. NYC
RVG is (stamped) in runout and 'ear' (hand edged) symbol is present..
This is a pressing later than first due to presence of the Inc. and R. on labels and Inc. on back cover
Back cover reads Blue Note records Inc., 43 West 61st St., New York 23.",Jazz,1962,Hard Bop,"Rated 4.67 of 15 votes (107 have, 372 want)",Very Good Plus (VG+),Sleeve: Very Good Plus (VG+),99.9%,"Van Gelder Studio, Hackensack, New Jersey",Plastylite,$176.59
The Jazz Messengers* – The Jazz Messengers,Columbia – CL 897,US,"Vinyl, LP, Album, Mono","Similar to the other first pressing The Jazz Messengers* - The Jazz Messengers with the same six-eye deep groove Columbia labels, but with only slight variations to the label and back cover layouts.

On the labels, ""The Jazz Messengers"" is in three lines, not two. The side number is larger and to the right of the label code, not on top of it.

The back cover has a similar full-color layout of Columbia catalog records, but reads ""exciting moments from Columbia's treasury of jazz,"" with different records pictured. There is no address listed at the bottom. Otherwise, everything is the same.",Jazz,1956,Hard Bop,"Rated 5.00 of 3 votes (24 have, 85 want)",Very Good Plus (VG+),Sleeve: Very Good Plus (VG+),100.0%,nan,nan,$169.00
Lee Morgan – Volume 2 - Sextet,Blue Note – BST 81541,US,"Vinyl, LP, Album, Reissue, Stereo, Electronically Re-Recorded To Stimulate Stereo","Recorded on December 2, 1956.

Title on labels and back cover: ""Lee Morgan Sextet.""
Title on spine: ""Lee Morgan Volume 2.""

Re-channeled stereo reissue with blue/white labels stating ""BLUE NOTE RECORDS * A DIVISION OF LIBERTY RECORDS, INC,"" in use from 1966-1970.",Jazz,1966,Hard Bop,"Rated 5.00 of 3 votes (48 have, 82 want)",Near Mint (NM or M-),Sleeve: Very Good Plus (VG+),97.1%,"Van Gelder Studio, Hackensack, New Jersey",nan,$170.00
Harold Vick – Steppin' Out!,Blue Note – BLP 4138,US,"Vinyl, LP, Mono","Recorded on May 27, 1963.

Original first pressings must have the following details:

Laminated front cover
Labels do *not* have the 'deep groove' pressed in them on either side
Address on labels: Blue Note Records, Inc. New York USA
Address on back cover: Blue Note Records, Inc., 43 West 61st St., New York 23
Plastylite ""ear"" (pretzel shaped P) etched in the deadwax
VAN GELDER stamped in the deadwax

All the above details taken from the book ""Blue Note Records - A Guide for Identifying Original Pressings"", written by Frederic Cohen from Jazz Record Centre, New York.","Jazz, Blues",1963,"Soul-Jazz, Post Bop, Hard Bop","Rated 4.47 of 15 votes (81 have, 270 want)",Very Good (VG),Sleeve: Good Plus (G+),100.0%,"Van Gelder Studio, Englewood Cliffs, New Jersey",Plastylite,$169.99
Bobby Hutcherson – Components,Blue Note – BLP 4213,US,"Vinyl, LP, Album, Mono","Recorded on June 10, 1965.

""VAN GELDER"" is stamped into the run out groove of both sides.

Label is blue and white, with ""Blue Note Records Inc • New York USA"".

Back cover reads ""43 West 61st St., New York 23"".",Jazz,1966,"Post Bop, Avant-garde Jazz, Hard Bop","Rated 4.70 of 23 votes (160 have, 497 want)",Very Good (VG),Sleeve: Very Good Plus (VG+),98.7%,"Van Gelder Studio, Englewood Cliffs, New Jersey",nan,$170.00
Cannonball Adderley – Somethin' Else,"Blue Note – BST 81595, Blue Note – BLP 1595, Blue Note – BST 1595, Blue Note – 81595",US,"Vinyl, LP, Album, Reissue, Stereo, Liberty Pressing","Catalog number on the labels: BST 1595
Catalog number on the back cover: 81595
Catalog numbers on the front cover: BST 81595 and BLP 1595

Originally released in 1958.

This version is the Liberty Pressing, which was likely released between 1966 and 1970 and can be identified by the ""Blue Note Records • A Division of Liberty Records, Inc."" printed on the labels",Jazz,1966,Hard Bop,"Rated 4.67 of 51 votes (307 have, 416 want)",Very Good Plus (VG+),Sleeve: Near Mint (NM or M-),100.0%,nan,nan,$175.00
The Horace Silver Quintet – Doin' The Thing - At The Village Gate,Blue Note – BLP 4076,US,"Vinyl, LP, Album, Mono","Recorded on May 19 & 20, 1961.

Blue Mitchell performs by courtesy of Riverside Records.

Alfred Lion of Blue Note extends special thanks to Art D'Lagoff whose genial cooperation made this recording session possible.

1st original Mono issue has:
- blue/white Blue Note Records Inc - New York Usa labels, deep groove on 1 side only,
- RVG stamped in the dead wax, both sides,
- ""P"" (otherwise wrongly called ""ear"") for Plastylite plant etched in the trail off, both sides,
- laminated jacket,
- 43 West 61st St., New York 23 address on back cover",Jazz,Aug 1961,Hard Bop,"Rated 4.28 of 53 votes (598 have, 245 want)",Very Good Plus (VG+),Sleeve: Very Good (VG),100.0%,Village Gate,Plastylite,$180.00
Freddie Hubbard – The Night Of The Cookers - Live At Club La Marchal - Volume 1,Blue Note – BST 84207,US,"Vinyl, LP, Album, Stereo","Recorded on April 10, 1965.

1st original STEREO issue has:
- blue/white Blue Note Records labels with NEW YORK USA,
- VAN GELDER stamped and ""P"" (wrongly called ""ear"") for Plastylite plant etched in the dead wax, both sides,
- non-laminated cover with 43 West 61st St., New York 23 address on back.",Jazz,Nov 1965,"Hard Bop, Post Bop","Rated 4.42 of 12 votes (105 have, 104 want)",Near Mint (NM or M-),Sleeve: Very Good Plus (VG+),100.0%,Club La Marchal,Plastylite,$160.71
Stanley Turrentine – Rough 'N Tumble,Blue Note – BLP 4240,US,"Vinyl, LP, Album, Mono","The back cover on this pressing does not include the ""monaural"" or ""for complete catalog..."" text at the bottom; includes Blue Note logo at top left. Labels read ""Blue Note Records Inc - New York USA"".",Jazz,1966,"Hard Bop, Soul-Jazz","Rated 4.27 of 11 votes (60 have, 55 want)",Very Good Plus (VG+),Sleeve: Very Good Plus (VG+),99.2%,"Van Gelder Studio, Englewood Cliffs, New Jersey",nan,$179.82
Larry Young – Unity,Blue Note – BLP 4221,US,"Vinyl, LP, Album, Repress, Mono","Elvin Jones performs by courtesy of Atlantic Recording Corp.

Recorded on November 10, 1965.

New York, USA address on label. Van Gelder stamp in run-out but no Plastylite P (ear). Liberty pressing probably 1967.",Jazz,1967,"Avant-garde Jazz, Hard Bop, Post Bop","Rated 5.00 of 2 votes (25 have, 114 want)",Very Good Plus (VG+),Sleeve: Good Plus (G+),99.9%,"Van Gelder Studio, Englewood Cliffs, New Jersey",nan,$174.89
Sonny Rollins – Way Out West,"Contemporary Records – C 3530, Contemporary Records – C3530",US,"Vinyl, LP, Album, Mono","Recorded at Contemporary's studio in Los Angeles March 7, 1957. Liner notes dated June 6, 1957.

First cat.nr. on cover, second on label.",Jazz,1957,Hard Bop,"Rated 4.59 of 46 votes (337 have, 575 want)",Very Good (VG),Sleeve: Very Good (VG),100.0%,Contemporary's Studio,"RCA Records Pressing Plant, Hollywood",$174.99
Art Blakey & The Jazz Messengers – Indestructible,"Blue Note – BLP 4193, Blue Note – 4193",US,"Vinyl, LP, Album, Mono","Recorded on April 24 & May 15, 1964.

All titles Blue Horizon Music-BMI
EXCEPT
B3: Miyako Music Inc.-BMI

Cat. Numbers: BLP 4193 on labels, 4193 on jacket.

1st original Mono issue has:
- blue/white Blue Note Records Inc - New York Usa labels,
- Van Gelder stamped in the dead wax, both sides,
- laminated jacket,
- 43 West 61st St., New York 23 address on back cover",Jazz,1966,Hard Bop,"Rated 4.57 of 35 votes (279 have, 364 want)",Very Good Plus (VG+),Sleeve: Very Good Plus (VG+),99.9%,"Van Gelder Studio, Englewood Cliffs, New Jersey",nan,$179.50
Sonny Rollins – Sonny Rollins (Vol. 2),"Blue Note – BLP 1558, Blue Note – 1558",US,"Vinyl, LP, Album, Repress, Mono","Originally released in 1957.

This version can be identified by the company information on the labels coupled with the runout groove etchings, which indicates it was likely repressed between 1964 and 1966.
-
Thick cardboard, unlaminated cover.
-
Deep groove on the labels.
On labels:
33 1/3 Microgroove Long Playing
Blue Note Records Inc ▪ New York USA
-
Encircled R under the E of Note. (labels)
Blue Note Records Inc., on rear of cover. (bottom)
-
Jay Jay Johnson performs by courtesy of Columbia Recordss. Thelonious Monk performs by courtesy of Riverside Records.

Recorded on April 14, 1957.",Jazz,1964,Hard Bop,"Rated 4.50 of 12 votes (93 have, 125 want)",Very Good Plus (VG+),Sleeve: Very Good Plus (VG+),100.0%,nan,Plastylite,$175.00
Hank Mobley – Hi Voltage,Blue Note – BST 84273,US,"Vinyl, LP, Album, Stereo","Title on cover spine and label: High Voltage.
Recorded on October 9, 1967.

Label is blue and white, with ""Blue Note Records • A Division Of Liberty Records, Inc."".

Cover has the ""1776 Broadway, New York, N.Y./6920 Sunset Blvd., Los Angeles, Calif."" address.",Jazz,1967,Hard Bop,"Rated 4.36 of 36 votes (337 have, 185 want)",Near Mint (NM or M-),Sleeve: Near Mint (NM or M-),100.0%,"Van Gelder Studio, Englewood Cliffs, New Jersey",nan,$180.00
Elmo Hope Ensemble – Sounds From Rikers Island,Audio Fidelity – AFSD 6119,US,"Vinyl, LP, Album, Stereo","Recorded in Riker's Island, New York, on August 19, 1963
Copyright 1963 by Audio Fidelity, Inc.
Printed in U.S.A.",Jazz,1963,Hard Bop,"Rated 4.50 of 2 votes (18 have, 94 want)",Near Mint (NM or M-),Sleeve: Very Good Plus (VG+),98.5%,nan,nan,$178.50
Freddie Hubbard – Ready For Freddie,Blue Note – BST 84085,US,"Vinyl, LP, Reissue, Stereo","Recorded on August 21, 1961.

'A Division of Liberty Records, Inc.' address on blue and white labels.

No address on back cover.",Jazz,1967,Hard Bop,"Rated 4.83 of 12 votes (84 have, 149 want)",Near Mint (NM or M-),Sleeve: Very Good (VG),100.0%,"Van Gelder Studio, Englewood Cliffs, New Jersey",nan,$169.00
Cecil Taylor Quintet – Hard Driving Jazz,United Artists Records – UAL 4014,US,"Vinyl, LP, Album, Mono","Recorded in New York City on October 13, 1958.",Jazz,1959,"Hard Bop, Modal","Rated 3.94 of 16 votes (99 have, 291 want)",Very Good Plus (VG+),Sleeve: Near Mint (NM or M-),99.5%,nan,nan,$175.00
Art Blakey & The Jazz Messengers – Meet You At The Jazz Corner Of The World (Volume 1),Blue Note – BLP 4054,US,"Vinyl, LP, Album, Mono","1st original mono US issue has:
- blue and white deep grooved labels with 47 West 63rd address with INC and (R) for registration mark under the E in Note
- RVG stamped and etched ""ear"" for Plastylite symbol in the run-out groove
- front laminated jacket with no address on back

Attention! Not to be confused with volumes I and II (BLP 4015 and 4016) with similar title ""At the Corner of the World"" but recorded earlier on April 15, 1959.

NB: Note that the deep groove version (on both sides) of BLP 4054 is a rarity since it falls into the transition time deep groove to non-deep groove label at Blue Note (according to Fred Cohen "" A guide for Identifying Original Pressings"" page 94).

Recorded live on September 14, 1960.",Jazz,Jul 1961,Hard Bop,"Rated 4.23 of 26 votes (175 have, 169 want)",Near Mint (NM or M-),Sleeve: Very Good Plus (VG+),100.0%,Birdland,Plastylite,$170.00
Kenny Drew Quintet / Quartet* – This Is New,Riverside Records – RLP 12-236,US,"Vinyl, LP, Album, Mono","Side A: New York; March 28, 1957.
Side B: New York; April 3, 1957.",Jazz,1957,Hard Bop,"Rated 4.00 of 8 votes (47 have, 178 want)",Good Plus (G+),Sleeve: Very Good (VG),99.9%,Reeves Sound Studios,nan,$170.00
The Red Garland Trio Plus Ray Barretto – Manteca,Prestige – PRLP 7139,US,"Vinyl, LP, Album, Mono, Bergenfield, NJ","Original Mono pressing with yellow/black labels and 203 South Washington Ave., Bergenfield, N.J. address.

Recorded in Hackensack, NJ; April 1958.

The Red Garland Trio plus Ray Baretto on Conga.

Pressed onto very heavy vinyl and has visible rings on labels but not deep groove rings.",Jazz,1958,Hard Bop,"Rated 4.75 of 8 votes (66 have, 63 want)",Very Good Plus (VG+),Sleeve: Very Good Plus (VG+),98.8%,nan,nan,$165.00
Red Garland – Red In Bluesville,"Prestige – PRLP 7157, Prestige – 7157",US,"Vinyl, LP, Album, Mono","First cat.nr. on labels, second on cover.

'Fireworks' labels with Bergenfield, N.J. address.","Jazz, Blues",1959,Hard Bop,"Rated 4.67 of 12 votes (153 have, 138 want)",Very Good Plus (VG+),Sleeve: Good Plus (G+),99.0%,nan,"Abbey Record Manufacturing Co., Inc.",$177.88
Yusef Lateef – Suite 16,Atlantic – SD 1563,US,"Vinyl, LP",nan,Jazz,1970,"Soul-Jazz, Classical, Hard Bop","Rated 4.06 of 33 votes (498 have, 215 want)",Mint (M),Sleeve: Mint (M),92.5%,nan,nan,$174.99
Art Blakey And The Jazz Messengers* – Art Blakey And The Jazz Messengers,Blue Note – BLP 4003,US,"Vinyl, LP, Album, Repress, Mono, NY USA Pressing","Recorded on October 30, 1958.
Labels read: Blue Note Records Inc. - New York USA. RVG is (stamped) in runout and 'ear' symbol is present.
Back cover reads Blue Note records Inc., 43 West 61st St., New York 23.

There is another version with the same 'NY USA' label on side A, but a '47 West 63rd St.' label on side B.

This version was likely released between 1962 and 1966.",Jazz,1962,Hard Bop,"Rated 4.84 of 19 votes (133 have, 326 want)",Very Good (VG),Sleeve: Very Good Plus (VG+),99.9%,"Van Gelder Studio, Hackensack, New Jersey",Plastylite,$170.00
The Jazz Messengers* – At The Cafe Bohemia Volume 1,Blue Note – BLP 1507,US,"Vinyl, LP, Album, Mono","Recorded live on November 23, 1955.

The 1st original mono issue has:
- deep grooved blue/white Blue Note Records labels with 767 Lexington Ave N.Y.C. addess,
- flat edge vinyl with RVG and ""P"" (otherwise wrongly called ""ear"") for Plastylite plant, both etched in the trail off,
- non laminated framed front cover,
- Blue Note Records, 767 Lexington Ave., New York 21 address on back cover,
- blank spine on cover.",Jazz,Jan 1956,Hard Bop,"Rated 4.52 of 46 votes (303 have, 435 want)",Good Plus (G+),Sleeve: Good (G),100.0%,Café Bohemia,Plastylite,$175.00
Hank Mobley – The Turnaround,Blue Note – BLP 4186,US,"Vinyl, LP, Album, Mono, Plastylite Pressing","Recorded on March 7, 1963 (#2 & 3) and February 5, 1965 (all others) at the Van Gelder Studio, Englewood Cliffs, New Jersey.
New York, USA adress on label. Ear and RVG in dead wax.",Jazz,1965,Hard Bop,"Rated 4.66 of 35 votes (197 have, 374 want)",Very Good (VG),Sleeve: Very Good Plus (VG+),99.1%,"Van Gelder Studio, Englewood Cliffs, New Jersey",Plastylite,$175.00
Blue Mitchell – The Thing To Do,Blue Note – BLP 4178,US,"Vinyl, LP, Album, Mono","Recorded on July 30, 1964.

1st original Mono issue has:
- blue/white Blue Note Records Inc • New York USA labels,
- VAN GELDER stamped in the dead wax, both sides,
- P (""ear"") for Plastylite plant stamped in the runout, both sides,
- non laminated jacket,
- Blue Note Records Inc., 43 West 61st St., New York 23 address on back cover

A1, B1, B2 published by Blue Horizon Music, Inc.(BMI)
A2, A3 published by MJQ Music, Inc. (BMI)",Jazz,May 1965,Hard Bop,"Rated 4.80 of 15 votes (118 have, 316 want)",Good Plus (G+),Sleeve: Very Good (VG),100.0%,"Van Gelder Studio, Englewood Cliffs, New Jersey",Plastylite,$170.00
The Red Garland Quintet Featuring John Coltrane And Donald Byrd – Soul Junction,Prestige – PRLP 7181,US,"Vinyl, LP, Album, Mono, Deep groove",First pressing of Mono version with yellow deep groove Bergenfield labels and RVG stamped into dead wax.,Jazz,Oct 1960,Hard Bop,"Rated 4.28 of 32 votes (218 have, 363 want)",Very Good (VG),Sleeve: Very Good Plus (VG+),99.6%,nan,nan,$175.00
Sonny Rollins – Way Out West,"Contemporary Records – C 3530, Contemporary Records – C3530",US,"Vinyl, LP, Album, Mono","Recorded at Contemporary's studio in Los Angeles March 7, 1957. Liner notes dated June 6, 1957.

First cat.nr. on cover, second on label.",Jazz,1957,Hard Bop,"Rated 4.59 of 46 votes (337 have, 575 want)",Very Good (VG),Sleeve: Very Good (VG),99.5%,Contemporary's Studio,"RCA Records Pressing Plant, Hollywood",$172.99
"The Incredible Jimmy Smith* – At Club ""Baby Grand"" Wilmington, Delaware, (Volume 1)",Blue Note – BLP 1528,US,"Vinyl, LP, Album, Repress, Mono","Recorded live on August 4, 1956 at Club Baby Grand, Wilmington, Delaware.

Repress with 47 WEST 63rd, NYC address on label

Likely released between 1958 and 1959.",Jazz,1958,"Soul-Jazz, Hard Bop","Rated 4.00 of 2 votes (43 have, 51 want)",Near Mint (NM or M-),Sleeve: Very Good Plus (VG+),98.2%,Club Baby Grand,Plastylite,$180.00
The Incredible Jimmy Smith* – Midnight Special,Blue Note – BLP 4078,US,"Vinyl, LP, Album, Mono, No DG","Recorded on April 25, 1960.
For Complete Catalog Write to ""Blue Note Records Inc., 43 West 61st St., New York 23
White/Blue non-DG ""Blue Note Records Inc. New York USA"" label with ®
RVG stamped and Plastylite ""P"" on both sides","Jazz, Blues",1961,"Soul-Jazz, Hard Bop","Rated 4.39 of 83 votes (1010 have, 264 want)",Very Good Plus (VG+),Sleeve: Near Mint (NM or M-),99.9%,"Van Gelder Studio, Englewood Cliffs, New Jersey",Plastylite,$179.99
Ray Draper Quintet* – Tuba Sounds,Prestige – PRLP 7096,US,"Vinyl, LP, Album, Mono","Recorded March 15, 1957.

Mono release.

Sleeve text:
Printed in U.S.A.
Printed and packaged by G E M Albums, Inc., N.Y.
Runoff grooves has inscriptions: ""RVG"", ""PRLP-7096-A"" (for the A side) and ""PRLP-7096-B"" for the B side, and a horizontal ""A"" and an ""AB"".",Jazz,1957,Hard Bop,"Rated 3.00 of 2 votes (28 have, 131 want)",Very Good Plus (VG+),Sleeve: Very Good (VG),100.0%,"Van Gelder Studio, Hackensack, New Jersey","Abbey Record Manufacturing Co., Inc.",$180.00
Charles Mingus – Mingus Ah Um,Columbia – CL 1370,US,"Vinyl, LP, Album, Promo, Mono","White promo label with red text.

Recorded at 30th Street Studio, NYC.
May 5, 1959 (A1, B1-B4) / May 12, 1959 (A2-A5).",Jazz,1959,"Hard Bop, Bop","Rated 4.82 of 11 votes (92 have, 499 want)",Very Good (VG),Sleeve: Good Plus (G+),100.0%,Columbia 30th Street Studio,nan,$165.00
John Coltrane – Olé Coltrane,Atlantic – 1373,US,"Vinyl, LP, Album, Mono","Printed in U.S.A.

Pressing on plum/orange labels with white band, black printing, logo box and white fan. Says ""Stereo"" at top-right of back cover despite being a mono pressing. See attached images for details.",Jazz,1961,"Hard Bop, Avant-garde Jazz, Modal","Rated 4.80 of 15 votes (82 have, 270 want)",Very Good (VG),Sleeve: Very Good Plus (VG+),100.0%,A&R Studios,MGM Custom Pressing Division,$175.00
Charles Mingus – Mingus At Monterey,"Jazz Workshop – JWS 001, Jazz Workshop – JWS 002",US,"2 × Vinyl, LP, Album","Recorded September 20, 1964, at the Monterey Jazz Festival, Monterey, California.
Original private pressing available through mail order only from Mingus himself.

Issued in a gatefold cover.

other matrix numbers:
Record 1
1A : RR4M-5086-2
2A : RR4M-5087-2
Record 2
2B : RR4M-5088-2
1B : RR4M-5089-2",Jazz,1966,"Hard Bop, Post Bop","Rated 4.64 of 11 votes (81 have, 87 want)",Very Good Plus (VG+),Sleeve: Very Good (VG),100.0%,Monterey Jazz Festival,nan,$169.00
Charles Mingus – Mingus At Monterey,"Jazz Workshop – JWS 001, Jazz Workshop – JWS 002",US,"2 × Vinyl, LP, Album","Recorded September 20, 1964, at the Monterey Jazz Festival, Monterey, California.
Original private pressing available through mail order only from Mingus himself.

Issued in a gatefold cover.

other matrix numbers:
Record 1
1A : RR4M-5086-2
2A : RR4M-5087-2
Record 2
2B : RR4M-5088-2
1B : RR4M-5089-2",Jazz,1966,"Hard Bop, Post Bop","Rated 4.64 of 11 votes (81 have, 87 want)",Near Mint (NM or M-),Sleeve: Very Good (VG),100.0%,Monterey Jazz Festival,nan,$175.00
"Sonny Rollins – A Night At The ""Village Vanguard""",Blue Note – BLP 1581,US,"Vinyl, LP, Album, Mono, Reissue","A Division of Liberty Records, Inc., RVG stamp.",Jazz,1966,"Hard Bop, Bop","Rated 4.60 of 5 votes (58 have, 135 want)",Very Good (VG),Sleeve: Very Good Plus (VG+),100.0%,Village Vanguard,nan,$174.99
Art Blakey & The Jazz Messengers – Meet You At The Jazz Corner Of The World (Volume 1),Blue Note – BST 84054,US,"Vinyl, LP, Album, Stereo","1st original stereo US issue has:
- blue and white deep grooved labels with 47 West 63rd address with INC and (R) for registration mark under the E in Note
- RVG stamped and etched ""ear"" for Plastylite symbol in the run-out groove
- front laminated jacket with no address on back

Recorded live on September 14, 1960.",Jazz,Jul 1961,Hard Bop,"Rated 4.67 of 6 votes (62 have, 65 want)",Very Good Plus (VG+),Sleeve: Very Good (VG),100.0%,Birdland,Plastylite,$179.99
The Miles Davis Quintet – Cookin' With The Miles Davis Quintet,"Prestige – PRLP 7094, Prestige – Prestige 7094",US,"Vinyl, LP, Album, Mono, Repress","Labels: PRLP 7094
Spine and front/rear jacket: Prestige 7094

Recorded on October 26, 1956.

Second press address for this release.
Labels read:
Prestige Records, Inc.,
203 South Washington Ave, Bergenfield NJ",Jazz,1958,Hard Bop,"Rated 4.82 of 34 votes (315 have, 259 want)",Very Good Plus (VG+),Sleeve: Very Good (VG),99.9%,nan,"Abbey Record Manufacturing Co., Inc.",$171.09
Don Friedman Trio – Circle Waltz,"Riverside Records – RLP 431, Riverside Records – 431",US,"Vinyl, LP, Album, Mono",nan,Jazz,1962,"Hard Bop, Post Bop","Rated 4.50 of 2 votes (20 have, 71 want)",Near Mint (NM or M-),Sleeve: Very Good (VG),100.0%,Plaza Sound Studios,MGM Record Manufacturing Division,$175.00
