Artist_Album,Label,Country,Format,Notes,Genre,Release_Date,Style,Rate_Haves_Wants,Media_Condition,Sleeve_Condition,Seller_Rating,Recorded_at,Pressed_by,Price
Booker Ervin – The In Between,Blue Note – BST 84283,US,"Vinyl, LP, Album, Stereo","Recorded on January 12, 1968.",Jazz,1968,"Hard Bop, Post Bop, Modal","Rated 4.67 of 3 votes (40 have, 35 want)",Near Mint (NM or M-),Sleeve: Near Mint (NM or M-),99.6%,"Van Gelder Studio, Englewood Cliffs, New Jersey",nan,$89.99
Wynton Kelly – Wynton Kelly!,"Vee Jay Records – LP-3022, Vee Jay Records – VJLP-3022",US,"Vinyl, LP, Album, Mono","Cover/rear jacket and spine: LP-3022
Labels: VJLP-3022

Recorded July 20 & 21, 1961.",Jazz,1961,Hard Bop,"Rated 4.25 of 8 votes (136 have, 81 want)",Very Good Plus (VG+),Sleeve: Very Good Plus (VG+),99.9%,Bell Sound Studios,"RCA Records Pressing Plant, Indianapolis",$89.95
Lee Morgan – The Sidewinder,"Blue Note – BST 84157, Blue Note – ST-84157, Blue Note – 84157",US,"Vinyl, LP, Album, Stereo","First US Stereo release with ""Blue Note Records, Inc. • New York USA"" printed on labels and the Plastylite ""ear"" etching in the runout. No deep groove on either label.

First catalog number on center labels, second on back sleeve, third on front sleeve.

Barry Harris performs courtesy of Riverside Records.",Jazz,1964,Hard Bop,"Rated 4.72 of 109 votes (965 have, 810 want)",Very Good (VG),Sleeve: Very Good (VG),97.2%,nan,Plastylite,$87.35
John Coltrane – Lush Life,"Prestige – 7188, Prestige – PRLP 7188",US,"Vinyl, LP, Album, Mono","First pressing with yellow fireworks label featuring Bergenfield address.

1st cat# on front cover; 2nd cat# on center labels

= = =
Composition credits from labels, sides A and B
Alternate titles:
Lush Life : John Coltrane / Trio, Quartet, And Quintet (jacket, rear)
Lush Life : John Coltrane / (Trio & Quintet) -- disc labels, sides A and B
A2 -- Trane's Slo Blues (label) ; Trane's Slow Blues (jacket, rear)",Jazz,Jan 1961,Hard Bop,"Rated 4.51 of 76 votes (574 have, 642 want)",Very Good (VG),Sleeve: Very Good (VG),100.0%,"Van Gelder Studio, Hackensack, New Jersey","Abbey Record Manufacturing Co., Inc.",$85.00
Freddie Roach – Mo' Greens Please,Blue Note – BLP 4128,US,"Vinyl, LP, Album, Mono","Recorded on January 21, 1963 (tracks A2, A3, B1, B2, B3) and on March 11, 1963 (tracks A1, A4, A5, B4, B5).",Jazz,1963,"Hard Bop, Soul-Jazz","Rated 4.59 of 17 votes (142 have, 131 want)",Very Good Plus (VG+),Sleeve: Very Good Plus (VG+),nan,"Van Gelder Studio, Englewood Cliffs, New Jersey",nan,$85.00
Lee Morgan – Cornbread,Blue Note – BST 84222,US,"Vinyl, LP, Album, Stereo","Recorded on September 18, 1965.

Stereo 1st Pressings have VAN GELDER Mastering Stampers in the Dead Wax and have Blue + White Blue Note Labels that say:

BLUE NOTE RECORDS INC - NEW YORK USA

Stereo 1st Pressings have the following address Near the bottom of the Back Cover:

BLUE NOTE RECORDS INC., 43 West 61st St., New York, N.Y. 10023

Publishers:
- A1 to B1, B3: Blue Horizon Music - BMI
- B2: Mills Music, Inc. - ASCAP",Jazz,Jan 1967,"Hard Bop, Post Bop","Rated 4.56 of 39 votes (338 have, 339 want)",Very Good Plus (VG+),Sleeve: Very Good Plus (VG+),99.9%,nan,"All Disc Records, Inc.",$85.00
Miles Davis – Miles Davis At Carnegie Hall,Columbia – CS 8612,US,"Vinyl, LP, Album, Stereo","Two-eye Columbia label with white ""360º Sound "" on the bottom of the label- white arrows, 1963/1970.

Label variation, this was released right on the transition from 6 eye to 2 eye label & as such, depending on the pressing plant label stock, it appeared with both 6 eye & 2 eye labels. The transition began in June 62. This LP was pressed & released in July 62. The 6 eyes are definitely from June-July 62 but the 2 eyes will be from June 62-July 63 when the 2 eye label changed again to include small black arrows at either end of the ""360 Sound Stereo"" lettering.",Jazz,1963,"Hard Bop, Modal","Rated 4.80 of 5 votes (46 have, 45 want)",Near Mint (NM or M-),Sleeve: Very Good Plus (VG+),99.2%,nan,nan,$88.99
"Art Blakey Quintet – A Night At Birdland, Volume 2",Blue Note – BLP 1522,US,"Vinyl, LP, Compilation, Reissue, Mono","Recorded live on February 21, 1954.

This issue is for the blue white deep grooved labels on both sides with:
- ""Blue Note Records Inc - 47 West 63rd - NYC"" (NB: the 'Inc')
- RVG etched, ""P"" etched for Plastylite plant and 9M etched in the dead wax,

This kind of label has been used from the end of 1959 up to early 1962.",Jazz,1959,Hard Bop,"Rated 4.27 of 15 votes (106 have, 99 want)",Very Good Plus (VG+),Sleeve: Very Good Plus (VG+),99.5%,Birdland,Plastylite,$89.00
The Kenny Burrell Trio – A Night At The Vanguard,Argo (6) – LPS-655,US,"Vinyl, LP, Album, Stereo","Recorded Sept. 16 and 17, 1959, during actual performance at the Village Vanguard in New York.",Jazz,1960,"Hard Bop, Soul-Jazz","Rated 4.33 of 3 votes (24 have, 65 want)",Very Good Plus (VG+),Sleeve: Very Good Plus (VG+),99.1%,Village Vanguard,nan,$89.99
John Coltrane – Lush Life,"Prestige – PR 7581, MPS Records – PR 7581",Germany,"Vinyl, LP, Album, Remastered, Stereo",Original german first pressing on purple MPS Prestige label!,Jazz,1969,Hard Bop,"Rated 4.50 of 6 votes (56 have, 94 want)",Very Good Plus (VG+),Sleeve: Very Good (VG),100.0%,nan,nan,$89.00
Stanley Turrentine With The Three Sounds – Blue Hour,Blue Note – BST 84057,US,"Vinyl, LP, Album, Repress, Stereo","Recorded on December 16, 1960.

West 63rd labels with (Inc) & ®. Deep Groove Side B only RVG STEREO Stamped on both sides along with the “P” or aka Ear.",Jazz,1962,Hard Bop,"Rated 4.38 of 16 votes (137 have, 196 want)",Very Good (VG),Sleeve: Good Plus (G+),100.0%,"Van Gelder Studio, Englewood Cliffs, New Jersey",Plastylite,$88.14
Cannonball Adderley – Somethin' Else,Blue Note – BLP 1595,US,"Vinyl, LP, Album, Reissue, Mono","Miles Davis performs by courtesy of Columbia Records.
Hank Jones performs by courtesy of Capital Records.
Recorded on March 9, 1958.

RVG stamp and Plastylite P (wrongly referred to as 'ear'), has W 63rd address, ""inc"" and ""r""",Jazz,1960,"Bop, Hard Bop","Rated 4.63 of 19 votes (116 have, 438 want)",Very Good (VG),Sleeve: Very Good Plus (VG+),100.0%,"Van Gelder Studio, Hackensack, New Jersey",Plastylite,$85.00
Miles Davis And Milt Jackson – Quintet / Sextet,"Prestige – LP 7034, Prestige – PRLP 7034",US,"Vinyl, LP, Album, Mono","Label variation: deep groove yellow and black fireworks labels with W. 50th St, NYC address.
Cover variation: no text on back at bottom-left or bottom-right corners.

Recorded on August 5, 1955.",Jazz,1956,"Bop, Hard Bop","Rated 4.42 of 33 votes (324 have, 304 want)",Very Good Plus (VG+),Sleeve: Very Good (VG),100.0%,"Van Gelder Studio, Hackensack, New Jersey",nan,$85.00
Miles Davis – Miles Davis At Carnegie Hall,Columbia – CS 8612,US,"Vinyl, LP, Album, Stereo","The Legendary Performance Of May 19, 1961.

Electronically Re-Channeled For Stereo

Ⓒ Columbia Records 1962
Printed in U.S.A.

Front Cover gives the Catalogue number for the Stereo version - CS 8612 - and the Monoaural version - CL 1812. This is the Stereo version

Players are only credited as ""Featuring""

Label variations, this was released right on the transition from 6 eye to 2 eye label & as such, depending on the pressing plant label stock, it appeared originally with both 6 eye & 2 eye labels. The transition began in June 62. This LP was pressed & released in July 62. The 6 eyes are definitely from June-July 62 but the 2 eyes will be from June 62-July 63 when the 2 eye label changed again to include small black arrows at either end of the ""360 Sound Stereo"" lettering.",Jazz,1962,"Hard Bop, Modal","Rated 4.12 of 52 votes (724 have, 113 want)",Very Good Plus (VG+),Sleeve: Very Good Plus (VG+),99.5%,nan,nan,$85.00
John Coltrane – Bahia,"Prestige – PRST- 7353, Prestige – PR 7353, Prestige – 7353",US,"Vinyl, LP, Album, Stereo","Stereo original with dark blue labels having trident logo at right.

First cat.nr. on label, second on front cover, third on back cover.

Prestige Records Inc., 203 S. Washington Ave., Bergenfield, N. J.",Jazz,May 1965,Hard Bop,"Rated 4.21 of 24 votes (188 have, 145 want)",Near Mint (NM or M-),Sleeve: Very Good Plus (VG+),99.7%,nan,nan,$85.00
Art Blakey & The Jazz Messengers – The Freedom Rider,Blue Note – BST 84156,US,"Vinyl, LP, Album, Repress, Stereo","Recorded on February 18 (track B2) & May 27, 1961 (tracks A1-B1, B3).

No ""Ear"" or Plastylite “P”. VAN GELDER stamped in the trail off, both sides.
Released after Liberty take-over, but with old stock labels.",Jazz,1966,Hard Bop,"Rated 5.00 of 1 votes (14 have, 64 want)",Very Good Plus (VG+),Sleeve: Very Good Plus (VG+),100.0%,"Van Gelder Studio, Englewood Cliffs, New Jersey",nan,$89.00
"J.R. Monterose, Jon Eardley, Rein De Graaff, Henk Haverhoek, Pierre Courbois – Body And Soul",Munich – 6803 654 M3,Netherlands,"Vinyl, LP, Album","Recorded: January 31, 1970 (At the Auditorium of Wageningen Agricultural University).
Only the front cover is coated.",Jazz,1970,"Free Jazz, Hard Bop","Rated 5.00 of 1 votes (15 have, 27 want)",Near Mint (NM or M-),Sleeve: Very Good (VG),100.0%,Wageningen Agricultural University,nan,$89.99
The Incredible Jimmy Smith* – Rockin' The Boat,"Blue Note – 4141, Blue Note – BLP 4141",US,"Vinyl, LP, Album, Mono","Recorded on February 7, 1963.

Catalog number on the jacket: 4141
Catalog number on the labels: BLP 4141

This original mono pressing, which was likely released during September of 1963, can be identified by:
- Blue/white deep groove labels with ""Blue Note Records Inc. ● New York USA""
- VAN GELDER stamped and Plastylite 'ear' symbol in the runout grooves
- Laminated cover with 43 West 61st St., New York 23 address on back.",Jazz,Sep 1963,"Hard Bop, Soul-Jazz","Rated 4.43 of 37 votes (426 have, 104 want)",Very Good Plus (VG+),Sleeve: Very Good Plus (VG+),100.0%,nan,Plastylite,$85.00
The Jaki Byard Quartet – Live! Vol. 1,"Prestige – PRST 7419, PR 7419",US,"Vinyl, LP, Album, Stereo","Stereo pressing on Blue “trident” label with Silver text
Front cover reads “stereo” across top edge
(Recorded live! at Lennie's on the Turnpike)",Jazz,1966,Hard Bop,"Rated 4.13 of 16 votes (101 have, 35 want)",Near Mint (NM or M-),Sleeve: Near Mint (NM or M-),100.0%,nan,nan,$85.00
Clifford Brown And Max Roach – Study In Brown,"EmArcy – MG 36037, EmArcy – MG-36037",Canada,"Vinyl, LP, Album, Mono","Front jacket and labels: MG-36037
Spine and rear jacket: MG 36037",Jazz,1955,"Bop, Hard Bop","Rated 4.00 of 1 votes (2 have, 33 want)",Very Good (VG),Sleeve: Very Good (VG),100.0%,nan,nan,$85.00
The Gil Evans Orchestra* – Out Of The Cool,"Impulse! – A-4, Impulse! – AS-4",US,"Vinyl, LP, Album, Repress, Stereo","A product of AM-PAR Record Corp.(printed on rear cover)
A product of ABC-Paramount Records, Inc. on labels.

Printed in U.S.A.

Cat# variations on release:
- spine,front- & rear cover: Stereo A-4
- Center Label: AS-4 Stereo

Published by:
A1, B3: Gillian Music-BMI
A2: Roosevelt Music-BMI
B1: Harms, Inc.-ASCAP
B2: Russ-Hix Music-BMI",Jazz,1963,"Hard Bop, Contemporary Jazz","Rated 5.00 of 2 votes (48 have, 79 want)",Near Mint (NM or M-),Sleeve: Very Good Plus (VG+),100.0%,nan,nan,$89.00
John Coltrane And Paul Quinichette – Cattin' With Coltrane And Quinichette,Prestige – 7158,US,"Vinyl, LP, Album, Mono","Yellow / black label with NJ address and deep groove.

Originally released in 1959

Recorded at Rudy Van Gelder Studio, Hackensack, NJ, May 17, 1957 [jazzdisco.org]",Jazz,1959,Hard Bop,"Rated 4.29 of 21 votes (159 have, 224 want)",Good Plus (G+),Sleeve: Very Good (VG),99.4%,"Van Gelder Studio, Hackensack, New Jersey",nan,$85.00
The Horace Silver Quintet – Finger Poppin' With The Horace Silver Quintet,Blue Note – BST 4008,US,"Vinyl, LP, Album, Stereo","Blue Mitchell performs by courtesy of Riverside Records.

Recorded on January 31, 1959.

Deep groove, with ear and ""RVG STEREO"" in deadwax.

""47 West 63rd NYC"" printed on label.
""47 West 63rd St., New York 23"" printed on cover.

Cover has gold stereo sticker.",Jazz,May 1959,"Bop, Hard Bop","Rated 4.57 of 14 votes (100 have, 133 want)",Very Good Plus (VG+),Sleeve: Good (G),100.0%,"Van Gelder Studio, Hackensack, New Jersey",Plastylite,$85.00
Donald Byrd – Electric Byrd,Blue Note – BST 84349,US,"Vinyl, LP, Album","Recorded at Rudy Van Gelder
Recorded on May 15, 1970.
(C) MCMLXX • LIBERTY/U.A. INC. • LOS ANGELES, CALIFORNIA, 92008
PRINTED IN U.S.A.",Jazz,1970,"Hard Bop, Modal, Latin Jazz","Rated 4.65 of 95 votes (725 have, 878 want)",Very Good Plus (VG+),Sleeve: Very Good Plus (VG+),99.5%,"Van Gelder Studio, Englewood Cliffs, New Jersey",nan,$85.00
Hank Mobley – Workout,Blue Note – BST-84080,US,"Vinyl, LP, Stereo, Album, NY, no DG","First Stereo Release of Blue Note BLP 4080.
Recorded on March 26, 1961.
Based on NY USA label, P, no DG and weight this is a 1962-1965 pre Liberty pressing.
Detail on the runout:
- RVG STEREO is machine stamped
- P BNST-84080 A/B is etched",Jazz,1962,Hard Bop,"Rated 4.07 of 14 votes (113 have, 288 want)",Good Plus (G+),Sleeve: No Cover,99.3%,nan,nan,$84.99
"Freddie Redd Quartet With Jackie McLean – The Music From ""The Connection""",Blue Note – BST 84027,US,"Vinyl, LP, Album",47 West 63rd-NYC labels.,Jazz,1960,Hard Bop,"Rated 4.13 of 8 votes (53 have, 94 want)",Very Good (VG),Sleeve: Very Good (VG),92.9%,"Van Gelder Studio, Englewood Cliffs, New Jersey",nan,$88.00
Lee Morgan – Delightfulee,Blue Note – BST 84243,US,"Vinyl, LP, Album, Stereo","Original (1'st) stereo press with ""VAN GELDER"" stamped into the run out groove of both sides. Recorded -66 and released -67 (not to be mixed with Los Angeles press, release nr: r12347164 )

Label is blue and white, with ""Blue Note Records • A Division of Liberty Records, Inc."".

Back cover reads ""43 West 61st St., New York, N.Y. 10023"".

Tracks A3, B1 recorded April 8, 1966; all others recorded May 27, 1966

Publishers:
- A1, A2, B2, B3: Blue Horizon Music - BMI
- A3: Maclen Music, Inc. - BMI
- B1: Sunbeam Music Corp. - BMI",Jazz,1967,Hard Bop,"Rated 4.44 of 39 votes (274 have, 188 want)",Very Good Plus (VG+),Sleeve: Very Good Plus (VG+),100.0%,"Van Gelder Studio, Englewood Cliffs, New Jersey",nan,$85.00
Booker Ervin With Dexter Gordon – Setting The Pace,"Prestige – PR 7455, Prestige – PRST 7455",US,"Vinyl, LP, Album, Stereo","Recorded in Munchen, West Germany, October 27, 1965.

Navy blue trident label.",Jazz,1967,Hard Bop,"Rated 3.82 of 11 votes (114 have, 90 want)",Near Mint (NM or M-),Sleeve: Very Good Plus (VG+),100.0%,nan,Plastylite,$85.00
Miles Davis – Collectors' Items,"Prestige – PRLP 7044, Prestige – LP 7044, Prestige – 7044",US,"Vinyl, LP, Album, Mono","Second pressing with black/yellow 'fireworks' & Bergenfield, NJ, labels.

First catalogue number on labels, second on front & rear cover, third on spine.

Recorded at WOR Studios, NYC, January 30, 1953 (A1 to A4) and at Rudy Van Gelder Studio, Hackensack, NJ, March 16, 1956 (B1 to B3) [jazzdisco.org].",Jazz,1958,"Bop, Hard Bop","Rated 4.31 of 16 votes (153 have, 94 want)",Very Good (VG),Sleeve: Good Plus (G+),100.0%,WOR Studios,"Abbey Record Manufacturing Co., Inc.",$88.88
Thelonious Monk – Brilliant Corners,Riverside Records – RLP 12-226,US,"Vinyl, LP, Album, Repress, Mono","Recorded at Reeves Sound Studios, New York City; October 9 (A2, B1), October 15 (A1) and December 7 (B2, B3), 1956.

Small, 92 mm diameter, blue/silver labels with mic & reels design & deep groove.
""BILL GRAUER PRODUCTIONS"" on bottom of labels, no ""INC"" on labels.

Back cover advertises other releases up to Kenny Drew (RLP 12-224) and has no additional line of text across bottom (as seen on Brilliant Corners)",Jazz,1958,Hard Bop,"Rated 4.85 of 52 votes (350 have, 402 want)",Very Good (VG),Sleeve: Very Good (VG),98.0%,Reeves Sound Studios,nan,$85.50
The Horace Silver Quintet & Trio* – Blowin' The Blues Away,Blue Note – BLP 4017,US,"Vinyl, LP, Album, Mono, Microgroove","Recorded on August 29 (A1, B2) and 30 (A3, A4, B1) and September 13 (A2, B3), 1959.

Blue Mitchell performs by courtesy of Riverside Records.

RVG stamped and ""P"" etched for Plastylite, usually wrongly called ""ear"", in the run out grooves of both sides.

Deep grooved blue and white labels with ""Blue Note Records Inc • 47 West 63rd • NYC"" address, both sides.

Back cover reads ""47 West 63rd St., New York 23"".",Jazz,Oct 1959,Hard Bop,"Rated 4.62 of 78 votes (682 have, 361 want)",Very Good (VG),Sleeve: Very Good Plus (VG+),99.4%,"Van Gelder Studio, Englewood Cliffs, New Jersey",Plastylite,$89.99
The Randy Weston Trio + Four Trombones* – Destry Rides Again,United Artists Records – UAL 4045,US,"Vinyl, LP, Album, Promo, Mono",nan,"Jazz, Stage & Screen",1959,Hard Bop,"No Rating Yet (19 have, 20 want)",Near Mint (NM or M-),Sleeve: Very Good Plus (VG+),99.0%,nan,nan,$85.00
Jimmy Smith – House Party,Blue Note – BLP 4002,US,"Vinyl, LP, Album, Mono","Recorded at Manhattan Towers, NYC; August 25, 1957 (tracks B1 & B2) & February 25, 1958 (tracks A1 & A2).

« RVG » stamped on both sides",Jazz,1958,"Hard Bop, Bop","Rated 4.38 of 24 votes (268 have, 215 want)",Very Good (VG),Sleeve: Very Good (VG),99.3%,Manhattan Towers,nan,$89.89
Miles Davis – Miles Davis At Carnegie Hall,Columbia – CS 8612,US,"Vinyl, LP, Album, Stereo","The Legendary Performance Of May 19, 1961.

Electronically Re-Channeled For Stereo

Ⓒ Columbia Records 1962
Printed in U.S.A.

Front Cover gives the Catalogue number for the Stereo version - CS 8612 - and the Monoaural version - CL 1812. This is the Stereo version

Players are only credited as ""Featuring""

Label variations, this was released right on the transition from 6 eye to 2 eye label & as such, depending on the pressing plant label stock, it appeared originally with both 6 eye & 2 eye labels. The transition began in June 62. This LP was pressed & released in July 62. The 6 eyes are definitely from June-July 62 but the 2 eyes will be from June 62-July 63 when the 2 eye label changed again to include small black arrows at either end of the ""360 Sound Stereo"" lettering.",Jazz,1962,"Hard Bop, Modal","Rated 4.12 of 52 votes (724 have, 113 want)",Very Good Plus (VG+),Sleeve: Very Good Plus (VG+),100.0%,nan,nan,$87.99
Anthony Williams – Spring,Blue Note – BST 84216,US,"Vinyl, LP, Album, Reissue, Stereo",Late 60s 2nd pressing with 'Division of Liberty Records' on blue and white labels.,Jazz,1966,"Free Jazz, Post Bop, Hard Bop","Rated 4.25 of 4 votes (50 have, 123 want)",Very Good Plus (VG+),Sleeve: Very Good Plus (VG+),100.0%,nan,nan,$85.00
Donald Byrd – Fuego,"Blue Note – BLP 4026, Blue Note – 4026",US,"Vinyl, LP, Album, Mono","Recorded October 4, 1959.

Original mono pressing with 47 West 63rd • NYC labels, Plastylite P/""ear"", and RVG stamp in runouts.

Also released as stereo BST 84026.",Jazz,Jun 1960,Hard Bop,"Rated 4.70 of 40 votes (242 have, 397 want)",Good (G),Sleeve: Very Good Plus (VG+),99.4%,"Van Gelder Studio, Englewood Cliffs, New Jersey",Plastylite,$85.00
Clifford Brown And Max Roach – At Basin Street,EmArcy – MG 36070,US,"Vinyl, LP, Album, Mono, High Fidelity - Blue Labels","Recorded January and February 1956 at Capitol Studios, New York City.
Released on deep groove vinyl with blue labels and High Fidelity branding.
'Drummer' logo on blue label deep groove.",Jazz,1956,"Bop, Hard Bop","Rated 4.46 of 26 votes (323 have, 143 want)",Very Good Plus (VG+),Sleeve: Good Plus (G+),100.0%,nan,nan,$89.95
McCoy Tyner – The Real McCoy,Blue Note – BST 84264,US,"Vinyl, LP, Album, Stereo","Original release has blue & white ""A Division Of Liberty"" labels and VAN GELDER stamps.",Jazz,1967,Hard Bop,"Rated 4.59 of 46 votes (333 have, 538 want)",Very Good (VG),Sleeve: Good Plus (G+),99.8%,nan,nan,$84.94
Lee Morgan – Search For The New Land,Blue Note – BLP 4169,US,"Vinyl, LP, Album, Mono","Blue Note Records Inc. - New York USA address blue and white labels.

With ear or p symbol. VAN GELDER stamped in dead wax.

""27 Years Blue Note"" inner sleeve.

Recorded on February 15, 1964.",Jazz,1966,Hard Bop,"Rated 4.54 of 59 votes (360 have, 753 want)",Good (G),Sleeve: Good (G),98.1%,"Van Gelder Studio, Englewood Cliffs, New Jersey",Plastylite,$89.99
The Joe Newman Quartet* Featuring Shirley Scott – Soft Swingin' Jazz,Coral – CRL 57208,US,"Vinyl, LP, Album, Mono",Maroon label with silver print in circular pattern,Jazz,1958,"Swing, Hard Bop","Rated 4.25 of 4 votes (38 have, 19 want)",Near Mint (NM or M-),Sleeve: Very Good Plus (VG+),92.3%,nan,nan,$85.00
Gerry Mulligan Meets Stan Getz – Gerry Mulligan Meets Stan Getz,"Verve Records – MG V-8249, Verve Records – V-8249",US,"Vinyl, LP, Album, Mono",nan,Jazz,1961,"Bop, Hard Bop","Rated 4.16 of 25 votes (288 have, 79 want)",Very Good Plus (VG+),Sleeve: Near Mint (NM or M-),99.9%,nan,MGM Records Division,$84.99
Sun Ra And His Arkestra* – Sun Song,Delmark Records – DL-411,US,"Vinyl, LP, Album, Reissue, Mono","Recorded July 12, 1956 Universal Recording Studio, Chicago.
Originally issued by Transition Records #J-10.

new music series (on front) - MODERN JAZZ SERIES (on back).

No barcode on sleeve.

On front cover: Sun Ra
On back cover: Sun Ra And His Arkestra
On labels: Sun Ra And His Orchestra",Jazz,1967,Hard Bop,"Rated 4.62 of 21 votes (80 have, 271 want)",Very Good (VG),Sleeve: Very Good Plus (VG+),99.3%,nan,nan,$89.00
Grant Green – Talkin' About,Blue Note – BST 84183,US,"Vinyl, LP, Album, Stereo","Recorded on September 11, 1964.",Jazz,1965,"Soul-Jazz, Hard Bop","Rated 4.56 of 9 votes (87 have, 227 want)",Very Good (VG),Sleeve: Good Plus (G+),100.0%,"Van Gelder Studio, Englewood Cliffs, New Jersey",nan,$85.85
The Ray Draper Quintet Featuring John Coltrane – The Ray Draper Quintet Featuring John Coltrane,"New Jazz – NJLP 8228, Status Records (2) – 8228",US,"Vinyl, LP, Album, Mono","Purple ""New Jazz"" label with ""RVG"" Rudy Van Gelder mastering stamp in dead.

Cover front is ""New Jazz"" & spine of cover reads ""New Jazz 8228""
with ""Status"" sticker applied on front & has a ""Status"" back panel.

From the labels:
Ray Draper with John Coltrane
Label: NJLP 8228
High Fidelity
A Product Of Prestige Records Inc., 203 S. Washington Ave., Bergenfield. N.J.

Rear Cover:
Status 8228 (upper right hand corner)
For a free catalog send to STATUS RECORDS, 203 So. Washington Ave., Bergenfield, N.J.",Jazz,1958,Hard Bop,"Rated 5.00 of 1 votes (3 have, 20 want)",Very Good (VG),Sleeve: Very Good Plus (VG+),100.0%,nan,nan,$85.00
Miles Davis – Miles Davis And The Modern Jazz Giants,Prestige – PRLP 7150,US,"Vinyl, LP, Compilation, Mono","Recorded on December 24, 1954 and October 26, 1956 (B1). Released early 1958 [? - see edit notes], simulated stereo copies do exist.

Track B3 was previously released as a 10 inch, 16rpm disc.

Copies are (deep groove) pressed on heavy vinyl with yellow labels. The have company address of ""203 So. Washington Ave, Bergenfield, N.J."". Cover has laminated foil over cover artwork paper.",Jazz,1959,Hard Bop,"Rated 4.56 of 52 votes (497 have, 416 want)",Very Good (VG),Sleeve: Near Mint (NM or M-),100.0%,nan,nan,$85.00
Chet Baker – The Trumpet Artistry Of Chet Baker,Pacific Jazz – PJ-1206,US,"Vinyl, LP, Album, Mono",Original US pressing. Black label with silver print. Staggered upper- and lower-case lettering at top.,Jazz,1955,"Hard Bop, Modal","Rated 4.44 of 32 votes (250 have, 221 want)",Very Good Plus (VG+),Sleeve: Very Good (VG),99.5%,nan,nan,$85.00
Miles Davis – 'Round About Midnight,Columbia – CL 949,US,"Vinyl, LP, Album, Mono, Hollywood Press","Deep groove 6-eye label, both ""ROUND ABOUT MIDNIGHT"" and ""THE MILES DAVIS QUINTET"" in one line.",Jazz,1957,Hard Bop,"Rated 4.52 of 21 votes (186 have, 303 want)",Very Good (VG),Sleeve: Very Good (VG),99.5%,nan,"Columbia Records Pressing Plant, Hollywood",$89.95
Freddie Roach – Mo' Greens Please,Blue Note – BLP 4128,US,"Vinyl, LP, Album, Mono","Recorded on January 21, 1963 (tracks A2, A3, B1, B2, B3) and on March 11, 1963 (tracks A1, A4, A5, B4, B5).",Jazz,1963,"Hard Bop, Soul-Jazz","Rated 4.59 of 17 votes (142 have, 131 want)",Very Good (VG),Sleeve: Very Good Plus (VG+),100.0%,"Van Gelder Studio, Englewood Cliffs, New Jersey",nan,$85.00
Booker Little – Booker Little,Time Records (3) – S/2011,US,"Vinyl, LP, Album, Stereo","Recorded April 13, 15, 1960.

Original US Time stereo pressing, also released in mono 52011
Gatefold cover",Jazz,1960,Hard Bop,"Rated 4.33 of 9 votes (95 have, 115 want)",Very Good (VG),Sleeve: Very Good (VG),99.7%,nan,nan,$89.99
Various – The Jazz Life!,Candid – CJS 9019,US,"Vinyl, LP, Compilation, Stereo","Orange and yellow label, deep groove.

Text on rear: ""These recordings are available in this album only""

All the selections except the Lucky Thompson were recorded at Nola Penthouse Studios, New York.
Tracks A1 & B2 recorded November 11, 1960.
Track A2 recorded November 15, 1960.
Track A3 recorded January 13, 1961.
Track B3 recorded November 1, 1960.",Jazz,Oct 1961,"Hard Bop, Post Bop","Rated 5.00 of 1 votes (6 have, 6 want)",Near Mint (NM or M-),Sleeve: Very Good Plus (VG+),99.0%,Nola Recording Studios,nan,$88.01
