Artist_Album,Label,Country,Format,Notes,Genre,Release_Date,Style,Rate_Haves_Wants,Media_Condition,Sleeve_Condition,Seller_Rating,Recorded_at,Pressed_by,Price
"Gil Evans Orchestra* Featuring Julian ""Cannonball"" Adderly* – New Bottle Old Wine",World Pacific Records – WP-1246,US,"Vinyl, LP, Mono, Album","this release label is close to Gil Evans Orchestra* Featuring Cannonball Adderley - New Bottle Old Wine with ""ST-772 / High Fidelity Recording"", but with on top ""HIGH FIDELITY"" above ""World Pacific Records"" and with oval (not round) logo like on Gil Evans Orchestra* Featuring Cannonball Adderley - New Bottle Old Wine.

Julian ""Cannonball"" Adderly on back-cover and labels.",Jazz,1958,Hard Bop,"Rated 4.43 of 7 votes (36 have, 41 want)",Very Good Plus (VG+),Sleeve: Very Good (VG),97.5%,nan,nan,$35.00
Cannonball Adderley Sextet – Nippon Soul,Riverside Records – RM 477,US,"Vinyl, LP, Album, Mono","Recorded in concert (Sankei Hall, Tokyo, Japan); July 14-15, 1963.",Jazz,1963,"Hard Bop, Soul-Jazz","Rated 4.42 of 12 votes (155 have, 70 want)",Very Good Plus (VG+),Sleeve: Very Good (VG),100.0%,Sankei Hall,nan,$35.00
Milt Jackson Sextet – Invitation,Riverside Records – RM 446,US,"Vinyl, LP, Album, Mono","Recorded in NYC, August 30, October 31 and November 7, 1962
Deep groove",Jazz,Jun 1963,Hard Bop,"Rated 4.00 of 3 votes (93 have, 43 want)",Very Good Plus (VG+),Sleeve: Very Good Plus (VG+),98.7%,Plaza Sound Studios,nan,$35.00
The Dave Brubeck Quartet – Time Out,Columbia – CS 8192,US,"Vinyl, LP, Album, Repress, Stereo, 6-Eye Columbia Label","6-Eye Columbia Label, with CBS logo top centered, in use 1961-1962.
Cover-design elements (For determining issue version):
On front cover: Text says: ""Featuring Take Five, Blue Rondo A La Turk"", Cat# in oval circle, No text saying ""Columbia Guaranteed High Fidelity"" in upper right corner. That logo is found on the back of cover. Cover painting is the slightly cropped painting version, as opposed to the full version painting found on the 1st issue version.

2 variations of the 1st pressing can be found""
Time Out
Time Out",Jazz,1961,"Bop, Hard Bop","Rated 4.71 of 112 votes (1154 have, 429 want)",Very Good Plus (VG+),Sleeve: Good (G),100.0%,nan,nan,$35.00
Miles Davis – Miles Davis At Carnegie Hall,Columbia – CS 8612,US,"Vinyl, LP, Album, Stereo","Two-eye Columbia label with black ""360 Sound "" on the bottom of the label.
No Arrows

Label variation, this was released right on the transition from 6 eye to 2 eye label & as such, depending on the pressing plant label stock, it appeared with both 6 eye & 2 eye labels. The transition began in June 62. This LP was pressed & released in July 62. The 6 eyes are definitely from June-July 62 but the 2 eyes will be from June 62-July 63 when the 2 eye label changed again to include small black arrows at either end of the ""360 Sound Stereo"" lettering.",Jazz,1962,"Hard Bop, Modal","Rated 4.43 of 14 votes (169 have, 57 want)",Near Mint (NM or M-),Sleeve: Very Good Plus (VG+),99.7%,nan,nan,$35.00
The Jazz Crusaders* – Lighthouse '69,"World Pacific Jazz – ST-20165, Pacific Jazz – ST-20165",US,"Vinyl, LP, Album","Gatefold. Visual Sound Stereo.
Recorded Live at The Lighthouse, Hermosa Beach, USA.

Research Craft pressing denoted by 2.875"" ring press and ""Visual sound Stereo"" top center label
World Pacific Jazz logo on cover, Pacific Jazz label stock.",Jazz,1969,"Hard Bop, Jazz-Funk","Rated 4.43 of 7 votes (99 have, 32 want)",Near Mint (NM or M-),Sleeve: Very Good Plus (VG+),99.5%,"The Lighthouse, Hermosa Beach",Research Craft,$35.00
Jackie McLean – Strange Blues,"Prestige – PR 7500, Prestige – PRST 7500",US,"Vinyl, LP, Album, Remastered, Stereo","Recorded in Hackensack, NJ; February 15 (#A1 & B1) and July 12 (#A2, B2& B3), 1957.",Jazz,1967,Hard Bop,"Rated 4.38 of 8 votes (78 have, 55 want)",Near Mint (NM or M-),Sleeve: Very Good Plus (VG+),100.0%,nan,nan,$35.00
Billy Taylor – One For Fun,"Atlantic – 1329, Atlantic – SD 1329",US,"Vinyl, LP, Stereo","Recorded in NYC, June 24, 1959 [Info provided by jazzdisco.org].

Lime green Atlantic stereo labels

Nat Simon (B2) mis-credited as Nat Simons on back cover.",Jazz,1959,"Hard Bop, Cool Jazz","No Rating Yet (42 have, 25 want)",Near Mint (NM or M-),Sleeve: Very Good Plus (VG+),98.7%,nan,nan,$35.00
Milt Jackson – Bags & Flutes,Atlantic – 1294,US,"Vinyl, LP, Album, Mono","Recorded in NYC 05/21/57 (A1, A2), 06/10/57 (A3, A4, B1) + 06/17/57 (B2, B3).
Black label with Silver lettering
Laminated Cover
Original Atlantic Inner sleeve",Jazz,1959,Hard Bop,"Rated 4.14 of 7 votes (126 have, 45 want)",Near Mint (NM or M-),Sleeve: Near Mint (NM or M-),99.9%,nan,nan,$35.00
Booker Ervin – The In Between,Blue Note – BST 84283,US,"Vinyl, LP, Album, Stereo, Bestway Press","Recorded on January 12, 1968.

Blue and white label issue with ""Blue Note Records - A Division of Liberty Records, Inc.""
Pressed by Bestway with metal from All Disc (114 etches scratched out)
VAN GELDER stamped both sides runout",Jazz,1968,"Hard Bop, Post Bop, Modal","Rated 4.37 of 35 votes (343 have, 137 want)",Very Good Plus (VG+),Sleeve: Very Good (VG),100.0%,"Van Gelder Studio, Englewood Cliffs, New Jersey",Bestway Products Inc.,$35.00
Art Blakey Quintet – A Night At Birdland Volume 2,Blue Note – BST 81522,US,"Vinyl, LP, Compilation, Reissue, Stereo","front sleeve:
(C) LIBERTY RECORDS, INC - PRINTED IN THE USA
Stereo Electronically Rechanneled

labels: BLUE NOTE RECORDS - A DIVISION OF LIBERTY RECORDS, INC.",Jazz,1966,Hard Bop,"Rated 4.50 of 18 votes (136 have, 78 want)",Near Mint (NM or M-),Sleeve: Very Good Plus (VG+),99.7%,Birdland,nan,$35.00
Gene Ammons – The Twister,Prestige – 7176,US,"Vinyl, LP, Album, Reissue","Recorded in Hackensack, NJ; April 12, 1957.

Photo cover, yellow labels.",Jazz,1960,"Soul-Jazz, Hard Bop","Rated 5.00 of 1 votes (8 have, 26 want)",Very Good Plus (VG+),Sleeve: Very Good Plus (VG+),96.9%,"Van Gelder Studio, Hackensack, New Jersey","Abbey Record Manufacturing Co., Inc.",$35.00
Shirley Scott Trio – Great Scott!!,Impulse! – AS-67,US,"Vinyl, LP, Stereo","Tracks A1 to A5 - Recorded May 20, 1964.
Tracks B1 to B4 - Recorded May 14, 1964.

Publishers:
- A1, A5: Twin-Chris Music - ASCAP
- A2: United Artists Music Corp. - ASCAP
- A3: United Artists Music Co., Inc.
- A4: Noslen Music, Inc. - BMI
- B1: Advanced Music Corp. - ASCAP
- B2: Pamco Music, Inc. - BMI
- B3: Mills Music, Inc. - ASCAP
- B4: Stratford Music Corp. - ASCAP",Jazz,1964,"Soul-Jazz, Hard Bop","Rated 4.17 of 18 votes (253 have, 47 want)",Near Mint (NM or M-),Sleeve: Near Mint (NM or M-),93.0%,nan,nan,$35.00
Quincy Jones And His Orchestra – The Quintessence,Impulse! – A-11,US,"Vinyl, LP, Album, Mono","A1, A4, B3 recorded 22 December, 1961
A2, A3, B2 recorded 18 December, 1961
B1 and B4 recorded 29 November, 1961",Jazz,1962,"Hard Bop, Big Band","Rated 3.94 of 18 votes (153 have, 64 want)",Near Mint (NM or M-),Sleeve: Very Good Plus (VG+),100.0%,nan,nan,$35.00
The Horace Silver Quintet – Horace-Scope,Blue Note – BLP 4042,US,"Vinyl, LP, Album, Repress, Mono","Unsure of the exact release date of this version, but it definitely came out after the deep groove both sides edition. Likely made in 1961-1962.

Recorded on July 8 & 9, 1960.
Blue Mitchell performs by courtesy of Riverside Records.
All compositions Ecaroh Music - ASCAP

This version has:
- Blue Note Records INC - 47 West 63rd - NYC labels (with Inc and ®), deep groove on side A only
- RVG stamped.
- P, wrongly called ""ear"" for Plastylite plant.
- 43 West 61st Street, New York 23, N.Y. address on back-cover
- front laminated cover
- printed spine",Jazz,1961,Hard Bop,"Rated 4.33 of 6 votes (30 have, 58 want)",Very Good (VG),Sleeve: Good Plus (G+),99.5%,"Van Gelder Studio, Englewood Cliffs, New Jersey",Plastylite,$35.00
Shirley Scott Trio – Great Scott!!,Impulse! – AS-67,US,"Vinyl, LP, Stereo","Tracks A1 to A5 - Recorded May 20, 1964.
Tracks B1 to B4 - Recorded May 14, 1964.

Publishers:
- A1, A5: Twin-Chris Music - ASCAP
- A2: United Artists Music Corp. - ASCAP
- A3: United Artists Music Co., Inc.
- A4: Noslen Music, Inc. - BMI
- B1: Advanced Music Corp. - ASCAP
- B2: Pamco Music, Inc. - BMI
- B3: Mills Music, Inc. - ASCAP
- B4: Stratford Music Corp. - ASCAP",Jazz,1964,"Soul-Jazz, Hard Bop","Rated 4.17 of 18 votes (253 have, 47 want)",Very Good Plus (VG+),Sleeve: Very Good Plus (VG+),97.6%,nan,nan,$35.00
Various – Jazz Omnibus,Columbia – CL 1020,US,"Vinyl, LP, Mono, Album, Compilation","""A Cross-Section Of Jazz Today, In All Its Styles""
Columbia red/black 6-eye label",Jazz,1957,"Bop, Dixieland, Swing, Hard Bop, Cool Jazz","Rated 3.59 of 29 votes (606 have, 14 want)",Very Good Plus (VG+),Sleeve: Very Good (VG),99.5%,nan,nan,$35.00
John Coltrane – My Favorite Things,"Atlantic – 1361, Atlantic – SD-1361, Atlantic – SD 1361",US,"Vinyl, LP, Album, Reissue","First cat# on sleeve front and spine, 2nd on sleeve rear, 3rd on labels. Issued in a laminated front, heavyweight card sleeve. Gold coloured ""Stereo"" stamped over laminate on front sleeve top right, white on black ""Stereo"" printed on rear sleeve. This re-issue is likely to be dated somewhere between 1968 - 1973. (Based on airplay reports in Billboard, October 1969 seems likely.)
The labels are green on the top and red/orange on the bottom, with a white band through the center of the record. Above the center hole is the ""ATLANTIC"" logo in a yellow box, above the logo is a large ""A"" with a black fan next to it in a pink box. At the bottom of the labels and rear sleeve is the 1841 Broadway address.
LW etched at 90˚ in runouts = Longwear Plating
Publishers: Williamson (A1); Chappell (A2); Gershwin Pub. (B1); New World (B2).
Different sleeve/labels to (1965) John Coltrane - My Favorite Things, same labels but different sleeve to (1972) John Coltrane - My Favorite Things.",Jazz,1969,"Hard Bop, Modal","Rated 4.60 of 5 votes (100 have, 251 want)",Very Good Plus (VG+),Sleeve: Very Good Plus (VG+),100.0%,nan,nan,$35.00
Milt Jackson – Bags & Flutes,Atlantic – 1294,US,"Vinyl, LP, Album, Mono","Recorded in NYC 05/21/57 (A1, A2), 06/10/57 (A3, A4, B1) + 06/17/57 (B2, B3).
Black label with Silver lettering
Laminated Cover
Original Atlantic Inner sleeve",Jazz,1959,Hard Bop,"Rated 4.14 of 7 votes (126 have, 45 want)",Near Mint (NM or M-),Sleeve: Near Mint (NM or M-),100.0%,nan,nan,$35.00
Yusef Lateef – The Blue Yusef Lateef,Atlantic – SD 1508,US,"Vinyl, LP, Album, Repress, Stereo, RI","Circa 1968-1973 second pressing with green/white/red labels with 1841 Broadway address at bottom. RI matrix suffix on labels indicates a PRC Recording Company, Richmond, IN pressing.

© 1968 Atlantic Recording Corporation. Printed in U.S.A.",Jazz,1968,"Hard Bop, Free Jazz","Rated 4.21 of 14 votes (139 have, 426 want)",Very Good (VG),Sleeve: Very Good (VG),99.9%,nan,"PRC Recording Company, Richmond, IN",$35.00
Jack Diéval Et Le J.A.C.E. All-Stars – Jazz Aux Champs-Elysées,Polydor – 45 558,France,"Vinyl, LP, 10""","Recorded June 24, 1957 at the Pigalle Theatre, Paris (1-12);",Jazz,1957,Hard Bop,"Rated 5.00 of 1 votes (2 have, 12 want)",Near Mint (NM or M-),Sleeve: Very Good Plus (VG+),99.7%,nan,nan,$35.00
Art Blakey & The Jazz Messengers – Buhaina's Delight,Blue Note – BLP 4104,US,"Vinyl, LP, Album, Mono","Wayne Shorter performs by courtesy of Vee-Jay Records.
Curtis Fuller performs by courtesy of Ampar Records.

Recorded on November 28 & December 18, 1961.

VAN GELDER stamped and New York, NY label.

Note for collectors. The 1st original Mono issue has:
- blue/white Blue Note Records Inc - New York Usa labels, no deep groove.
- Van Gelder stamped in the dead wax, both sides,
- P symbol for Plastylite plant (wrongly also called ""ear"") inscribed in the dead wax, both sides,
- laminated jacket,
- 43 West 61st St., New York 23 address on back cover",Jazz,Jun 1963,Hard Bop,"Rated 4.47 of 30 votes (238 have, 274 want)",Fair (F),Sleeve: Good (G),100.0%,"Van Gelder Studio, Englewood Cliffs, New Jersey",Plastylite,$35.00
The Cannonball Adderley Quintet – Plus,Riverside Records – RLP 388,US,"Vinyl, LP, Album, Mono","Recorded in New York on May 11, 1961.

Bill Grauer Productions Inc. New York City.

Also available in Stereo: RLP 9388",Jazz,1961,Hard Bop,"Rated 4.04 of 26 votes (354 have, 76 want)",Near Mint (NM or M-),Sleeve: Very Good Plus (VG+),100.0%,Plaza Sound Studios,nan,$35.00
The Jazz Messengers* – Hard Bop,Columbia – CL 1040,US,"Vinyl, LP, Album, Promo, Mono, Microgroove","Recorded December 12 & 13, 1956 at Columbia 30th Street Studios, New York City

White label promo",Jazz,1957,Hard Bop,"Rated 5.00 of 1 votes (18 have, 58 want)",Very Good Plus (VG+),Sleeve: Very Good Plus (VG+),100.0%,Columbia 30th Street Studio,nan,$35.00
Art Farmer - Benny Golson – Meet The Jazztet,Argo (6) – LP 664,US,"Vinyl, LP, Album, Mono","1st US Mono Issue
Recorded February 6, 9, and 10, 1960 at Nola Studios, New York.
Cover photo taken at Nola Studios.",Jazz,1960,Hard Bop,"Rated 5.00 of 1 votes (7 have, 8 want)",Very Good Plus (VG+),Sleeve: Very Good (VG),100.0%,Nola Recording Studios,nan,$35.00
The Dave Brubeck Quartet – Time Further Out (Miro Reflections),Columbia – CS 8490,US,"Vinyl, LP, Album, Stereo","Earliest black & red ""6-eye"" labels, before the CBS-overprint. (No CBS on top double arrow.)

Label text are center justified.

Cover printed by Modern Album, Long Island, NY. The 3 printed on the lower right back corner signifies the factory for the printing.",Jazz,1961,Hard Bop,"Rated 4.60 of 5 votes (63 have, 43 want)",Very Good Plus (VG+),Sleeve: Very Good Plus (VG+),99.6%,nan,"Columbia Records Pressing Plant, Terre Haute",$35.00
Art Farmer – Evening In Casablanca,New Jazz – NJLP 8289,US,"Vinyl, LP, Album, Mono, Reissue",New Jazz reissue of PRLP 7017. Purple New Jazz label with silver print. Labels list wrong sides (liner note song listing and matrix information is correct). VAN GELDER in the matrix.,Jazz,1963,Hard Bop,"Rated 5.00 of 2 votes (41 have, 49 want)",Very Good (VG),Sleeve: Very Good Plus (VG+),99.6%,nan,nan,$35.00
Thelonious Monk – Solo Monk,Columbia – CS 9149,US,"Vinyl, LP, Album, Stereo, 360 Sound, 2-Eye Label, Non-Breakable",nan,Jazz,1965,"Hard Bop, Bop","Rated 4.45 of 44 votes (520 have, 291 want)",Very Good (VG),Sleeve: Very Good (VG),100.0%,nan,nan,$35.00
Miles Davis – Seven Steps To Heaven,Columbia – CS 8851,US,"Vinyl, LP, Album, Stereo","Tracks A1, A3, B2 recorded in Hollywood, Cal.
Tracks A2, B1, B3 recorded in New Y

Columbia - 2 Eye - ""Nonbreakable"" - ""Guaranteed High Fidelity"" label.",Jazz,1963,"Hard Bop, Modal","Rated 5.00 of 3 votes (35 have, 70 want)",Very Good Plus (VG+),Sleeve: Very Good (VG),100.0%,nan,nan,$35.00
Miles Davis And Milt Jackson – Quintet / Sextet,"Prestige – LP 7034, Prestige – PRLP 7034",US,"Vinyl, LP, Album, Reissue, Mono","Recorded on August 5, 1955.",Jazz,1964,"Bop, Hard Bop","Rated 3.91 of 11 votes (122 have, 81 want)",Very Good (VG),Sleeve: Very Good Plus (VG+),92.9%,"Van Gelder Studio, Hackensack, New Jersey",nan,$35.00
The Red Garland Trio – Manteca,"Prestige – 7139, Prestige – PRLP 7139",US,"Vinyl, LP, Album, Mono","PRESTIGE RECORDS INC., 203 SO. WASHINGTON AVE., BERGENFIELD, N.J. address on label and back cover",Jazz,1958,Hard Bop,"Rated 4.00 of 3 votes (23 have, 35 want)",Good (G),Sleeve: Very Good (VG),100.0%,nan,nan,$35.00
Stanley Turrentine – Easy Walker,Blue Note – BST 84268,US,"Vinyl, LP, Album, Stereo","Recorded on July 8, 1966.
Black and blue center labels with Blue Note logo in rectangle on left hand side.
Address on cover: Blue Note Records Inc., 1776 Broadway, New York 10019
Address on labels: Liberty UA. Inc., Los Angeles, California",Jazz,1970,"Hard Bop, Soul-Jazz","Rated 4.17 of 12 votes (132 have, 88 want)",Very Good Plus (VG+),Sleeve: Very Good Plus (VG+),98.6%,"Van Gelder Studio, Englewood Cliffs, New Jersey",nan,$35.00
Nat Adderley – The Scavenger,Milestone (4) – MSP 9016,US,"Vinyl, LP, Album, Stereo, Blue Label","True original first pressing with dark blue labels with silver print (pre-yellow/brown 1969-1970 era label).

Recorded at Plaza Sound Studios (New York City); January 18 and 19, 1968.

Stereo mastering at Madison Sound Studios.",Jazz,1968,Hard Bop,"Rated 4.00 of 3 votes (63 have, 60 want)",Very Good Plus (VG+),Sleeve: Very Good Plus (VG+),99.9%,Plaza Sound Studios,"Premier Albums, Inc.",$35.00
Cannonball Adderley Sextet – Jazz Workshop Revisited,Riverside Records – RM 444,US,"Vinyl, LP, Album, Mono, Keel Mfg. Corp. Pressing","*Recorded live in September, 1962, by Wally Heider, at The Jazz Workshop in San Francisco, CA.

*The Riverside mono label is their standard blue w/ silver lettering, 100mm (known as large), semi-deep groove, and has ""Bill Grauer Productions Inc"". along the bottom.

*Vinyl has serrated edge which signifies it was pressed at Keel Mfg Corp.

*The Riverside jacket has ""Inc"" w/ ""235 46th Street... "" on bottom, back.",Jazz,1963,"Hard Bop, Soul-Jazz, Modal","Rated 4.15 of 40 votes (435 have, 70 want)",Near Mint (NM or M-),Sleeve: Very Good Plus (VG+),100.0%,"The Jazz Workshop, San Francisco",Keel Mfg. Corp.,$35.00
The Horace Silver Quintet – Doin' The Thing - At The Village Gate,Blue Note – BLP 4076,US,"Vinyl, LP, Album, Repress, Mono","Recorded on May 19 & 20, 1961.

Blue Mitchell performs by courtesy of Riverside Records.

Early Mono repress has:
- blue/white Blue Note Records Inc - New York Usa labels
- no deep groove on either side
- RVG stamped in the dead wax, both sides
- ""P"" (otherwise wrongly called ""ear"") for Plastylite plant etched in the trail off, both sides,
- laminated jacket,
- back cover does not advertise The Horace Silver Quintet - The Tokyo Blues as other represses do (this one is earliest repress from 1962)
- 43 West 61st St., New York 23 address on back cover",Jazz,1962,Hard Bop,"Rated 4.50 of 8 votes (86 have, 39 want)",Very Good Plus (VG+),Sleeve: Very Good Plus (VG+),100.0%,Village Gate,Plastylite,$35.00
"The Miles Davis Sextet Featuring John Coltrane And ""Cannonball"" Adderley*, The Thelonious Monk Quartet And Pee Wee Russell – Miles & Monk At Newport",Columbia – CL 2178,US,"Vinyl, LP, Album, Mono","Miles Davis Sextet's set recorded live at Newport Jazz Festival in 1958. Thelonious Monk Quartet's set recorded live at Newport Jazz Festival in 1963.

Originally released 1963 on CS 8978.",Jazz,Jun 1964,"Hard Bop, Bop, Modal","Rated 4.23 of 30 votes (437 have, 82 want)",Very Good Plus (VG+),Sleeve: Near Mint (NM or M-),99.7%,Newport Jazz Festival,nan,$35.00
The Horace Silver Quintet – You Gotta Take A Little Love,Blue Note – BST 84309,US,"Vinyl, LP, Album, Stereo, Unipak","Recorded January 10 & 17, 1969.

Writing credits listed as ""H. Silver"" and ""B. Maupin"" on back cover and as ""Silver"" and ""Bennie Maupin"" on labels",Jazz,1969,"Hard Bop, Soul-Jazz","Rated 4.50 of 44 votes (441 have, 127 want)",Near Mint (NM or M-),Sleeve: Very Good Plus (VG+),100.0%,"Van Gelder Studio, Englewood Cliffs, New Jersey","All Disc Records, Inc.",$35.00
Benny Golson – Take a Number from 1 to 10,Argo (6) – LPS 681,US,"Vinyl, LP, Album, Stereo","Recorded Dec. 13 and 14, 1960, and April 11, 1961, at Nola Studios, New York City",Jazz,1961,Hard Bop,"No Rating Yet (8 have, 23 want)",Very Good Plus (VG+),Sleeve: Very Good Plus (VG+),100.0%,nan,nan,$35.00
Miles Davis – Bags Groove,"Top Rank International – RANK-5012, Prestige – PRLP-7109",Japan,"Vinyl, LP, Album, Blue Label","Recorded on June 29, 1954 (Side B) and December 24, 1954 (Side A).
Manufactured in Japan by Victor Record Company Ltd., by agreement with Cosdel Inc.

Laminated flip-back sleeve.",Jazz,1959,Hard Bop,"Rated 4.40 of 5 votes (39 have, 126 want)",Very Good (VG),Sleeve: Very Good Plus (VG+),100.0%,nan,nan,$35.00
The Joe Daley Trio – At Newport '63,RCA Victor – LPM-2763,US,"Vinyl, LP, Album, Mono",nan,Jazz,1963,"Hard Bop, Avant-garde Jazz","Rated 4.25 of 4 votes (36 have, 26 want)",Very Good Plus (VG+),Sleeve: Good Plus (G+),100.0%,nan,nan,$35.00
Wes Montgomery – Movin' Wes,"Verve Records – V6-8610, Verve Records – V6/8610",US,"Vinyl, LP, Album, Stereo, Gatefold","Label variation: Deep groove black and silver ""T"" labels with ""Wes Montgomery"" written on a single line, not split into 2 lines.

V6-8610 on front & rear cover, V6/8610 on the labels
Recorded at A&R Studios, New York City, November 11 & 16, 1963.",Jazz,1964,Hard Bop,"Rated 4.24 of 51 votes (565 have, 134 want)",Near Mint (NM or M-),Sleeve: Very Good Plus (VG+),99.7%,A&R Studios,nan,$35.00
Benny Bailey – Big Brass,Candid – CJM 8011,US,"Vinyl, LP, Album, Mono",Printed in USA,Jazz,1961,"Bop, Hard Bop","Rated 4.00 of 8 votes (59 have, 30 want)",Very Good (VG),Sleeve: Very Good (VG),99.6%,nan,nan,$35.00
"Mal Waldron – Sweet Love, Bitter",Impulse! – A-9142,US,"Vinyl, LP, Album, Mono, Promo","Original Soundtrack to Herbert Danska's movie.
Promo - white label black lettering.","Jazz, Stage & Screen",1967,"Hard Bop, Soundtrack","Rated 4.50 of 4 votes (25 have, 64 want)",Very Good Plus (VG+),Sleeve: Very Good (VG),100.0%,nan,nan,$35.00
Monk* – Monk.,Columbia – CS 9091,US,"Vinyl, LP, Album, Stereo","Red ""360 Sound"" labels with black lettering and arrows in the rim text.
NONBREAKABLE under CS 9091 on Labels (both sides)",Jazz,1965,Hard Bop,"Rated 4.33 of 85 votes (998 have, 286 want)",Very Good Plus (VG+),Sleeve: Very Good Plus (VG+),100.0%,nan,nan,$35.00
The Kenny Drew Trio – Pal Joey,Riverside Records – RLP 12-249,US,"Vinyl, LP, Album, Mono","Recorded in New York; October 15, 1957.

Deep groove, blue labels.",Jazz,1957,Hard Bop,"Rated 5.00 of 1 votes (47 have, 60 want)",Very Good Plus (VG+),Sleeve: Very Good (VG),99.4%,nan,nan,$35.00
Yusef Lateef – The Blue Yusef Lateef,Atlantic – SD 1508,US,"Vinyl, LP, Album, Repress, Stereo, PR - Presswell Pressing","Circa 1968-1973 second pressing with green/white/red labels with 1841 Broadway address at bottom.

""PR"" on labels and etched in runout denote Presswell, pressing.",Jazz,1968,"Hard Bop, Free Jazz","Rated 4.25 of 24 votes (261 have, 442 want)",Very Good Plus (VG+),Sleeve: Very Good Plus (VG+),99.6%,nan,Presswell,$35.00
The Mose Allison Trio – I Love The Life I Live,Columbia – CS 8365,US,"Vinyl, LP, Album, Stereo",nan,Jazz,1960,"Hard Bop, Bop","Rated 4.58 of 12 votes (101 have, 13 want)",Very Good Plus (VG+),Sleeve: Near Mint (NM or M-),99.6%,nan,nan,$35.00
Stan Getz And J.J. Johnson – At The Opera House,Verve Records – MG V-8265,US,"Vinyl, LP, Album, Mono","Deep groove black and silver ""T"" labels with bottom rim text starting ""Long Playing Microgroove..."" (used 1956-1960). This variation with 4 lines (not 3) for the title of record on the left side:

""Stan Getz
And J.J. Johnson
At The
Opera House""

Recorded in mono, October 7, 1957 at the Shrine Auditorium in Los Angeles.

The rhythm section on both sides of this LP consisted of Oscar Peterson, Ray Brown, Herb Ellis and Connie Kay.",Jazz,1957,"Bop, Hard Bop","Rated 4.08 of 40 votes (393 have, 84 want)",Near Mint (NM or M-),Sleeve: Very Good Plus (VG+),99.7%,Shrine Auditorium,nan,$35.00
Oliver Nelson Orchestra* – Afro/American Sketches,"Prestige – PR 7225, Prestige – PRLP 7225",US,"Vinyl, LP, Album, Mono","Yellow/Black Fireworks label, Black lettering, Bergenfield address, RVG stamped in the dead wax.

1st date: A1, B1
2nd date: A3, B3, B4
3rd date: A2, B2

Recorded: September 29, 1961 and November 10, 1961

solos [from liner notes]:
A1 - Dodgion - fl, Davis - b, Shaughnessy, Barretto - d
A3 - Newman, Brown, Nelson - as
B1 (full title: There's A Yearnin' Deep Inside Me) - Dodgion - fl
B2 - Nelson - ts
B3 - McCracken - cello",Jazz,1962,"Big Band, Hard Bop","Rated 4.57 of 7 votes (106 have, 69 want)",Near Mint (NM or M-),Sleeve: Very Good Plus (VG+),100.0%,"Van Gelder Studio, Englewood Cliffs, New Jersey","Abbey Record Manufacturing Co., Inc.",$35.00
Yusef Lateef – The Blue Yusef Lateef,Atlantic – SD 1508,US,"Vinyl, LP, Album, Repress, Stereo, MO",Circa 1968-1973 second pressing with green/white/red labels with 1841 Broadway address at bottom. MO matrix suffix on labels indicates a Monarch Record Mfg. Co. pressing.,Jazz,1968,"Hard Bop, Free Jazz","Rated 4.75 of 4 votes (27 have, 192 want)",Very Good Plus (VG+),Sleeve: Very Good Plus (VG+),100.0%,nan,Monarch Record Mfg. Co.,$35.00
Nat Adderley – The Scavenger,Milestone (4) – MSP 9016,US,"Vinyl, LP, Album, Stereo, Blue Label","True original first pressing with dark blue labels with silver print (pre-yellow/brown 1969-1970 era label).

Recorded at Plaza Sound Studios (New York City); January 18 and 19, 1968.

Stereo mastering at Madison Sound Studios.",Jazz,1968,Hard Bop,"Rated 4.00 of 3 votes (63 have, 60 want)",Very Good Plus (VG+),Sleeve: Very Good Plus (VG+),99.5%,Plaza Sound Studios,"Premier Albums, Inc.",$35.00
"Art Blakey Quintet – A Night At Birdland, Volume 2",Blue Note – BLP 1522,US,"Vinyl, LP, Compilation, Reissue, Mono","Recorded live on February 21, 1954.

This issue is for the blue white deep grooved labels on both sides with:
- ""Blue Note Records Inc - 47 West 63rd - NYC"" (NB: the 'Inc')
- RVG etched, ""P"" etched for Plastylite plant and 9M etched in the dead wax,

This kind of label has been used from the end of 1959 up to early 1962.",Jazz,1959,Hard Bop,"Rated 4.27 of 15 votes (106 have, 100 want)",Very Good (VG),Sleeve: Very Good Plus (VG+),100.0%,Birdland,Plastylite,$35.00
Roy Ayers – Virgo Vibes,Atlantic – SD 1488,US,"Vinyl, LP, Album, Stereo, CT - Terre Haute Press","CT = Columbia - Terra Haute, Indiana",Jazz,1967,"Soul-Jazz, Hard Bop","Rated 4.36 of 33 votes (322 have, 403 want)",Very Good Plus (VG+),Sleeve: Very Good Plus (VG+),100.0%,nan,"Columbia Records Pressing Plant, Terre Haute",$35.00
