Artist_Album,Label,Country,Format,Notes,Genre,Release_Date,Style,Rate_Haves_Wants,Media_Condition,Sleeve_Condition,Seller_Rating,Recorded_at,Pressed_by,Price
Nick Ayoub Quintet – The Montreal Scene,RCA Victor – PC-1042,Canada,"Vinyl, LP, Album, Mono","Title appears as ""The Jazz Scene: Montreal"" on labels
Dynagroove",Jazz,1964,"Hard Bop, Cool Jazz","Rated 4.25 of 4 votes (44 have, 157 want)",Near Mint (NM or M-),Sleeve: Near Mint (NM or M-),100.0%,nan,nan,$299.99
The Miles Davis Quintet – Workin' With The Miles Davis Quintet,Prestige – PRLP 7166,US,"Vinyl, LP, Album, Mono, Deep groove","Yellow & black fireworks labels with ""203 South Washington Ave. Bergenfield, N.J."" address printed at top and ""Long playing microgroove"" at bottom. ""RVG"" stamped into deadwax.

Recorded at Rudy Van Gelder Studio, Hackensack, New Jersey

Variant 2 runout does not have AB on side A",Jazz,Jan 1960,"Hard Bop, Bop","Rated 4.62 of 101 votes (813 have, 1036 want)",Very Good (VG),Sleeve: Good (G),100.0%,"Van Gelder Studio, Hackensack, New Jersey","Abbey Record Manufacturing Co., Inc.",$300.00
"Jackie McLean – Swing, Swang, Swingin'",Blue Note – BLP 4024,US,"Vinyl, LP, Album, Mono, 47W63","Recorded on October 20, 1959.

Blue and white labels with deep groove and 47 WEST 63rd - NYC address. RVG stamp and ""ear"" etched in the dead wax,
Also released as BST 84024.",Jazz,Mar 1960,Hard Bop,"Rated 4.78 of 23 votes (121 have, 265 want)",Very Good (VG),Sleeve: Good Plus (G+),99.5%,"Van Gelder Studio, Englewood Cliffs, New Jersey",Plastylite,$300.00
Sonny Rollins Quartet – Tenor Madness,Prestige – PRLP 7047,US,"Vinyl, LP, Album, Reissue, Mono","Recorded in Hackensack, NJ; May 24, 1956.

Deep groove both sides of the label.
Bergenfield, NJ address on the label.",Jazz,1958,"Bop, Hard Bop","Rated 4.80 of 10 votes (72 have, 113 want)",Very Good Plus (VG+),Sleeve: Very Good Plus (VG+),99.8%,"Van Gelder Studio, Hackensack, New Jersey","Abbey Record Manufacturing Co., Inc.",$275.00
Lou Donaldson – The Time Is Right,Blue Note – BLP 4025,US,"Vinyl, LP, Album, Mono","Recorded on October 31 and November 28, 1959.
Original mono pressing with 47 W 63rd • NYC address on labels, deep groove, RVG and Plastylite P/""ear"" stamps on both sides.
Back cover address reads: BLUE NOTE RECORDS INC., 43 West 61st St., New York 23.

Blue Mitchell performs by courtesy of Riverside Records.",Jazz,1960,"Hard Bop, Soul-Jazz","Rated 4.57 of 21 votes (124 have, 224 want)",Very Good (VG),Sleeve: Very Good (VG),97.4%,"Van Gelder Studio, Englewood Cliffs, New Jersey",Plastylite,$299.99
Blue Mitchell – Blue's Moods,Riverside Records – RLP 9336,US,"Vinyl, LP, Album, Stereo","Recorded at Plaza Sound Studios in New York City; August 24 and 25, 1960.",Jazz,1960,Hard Bop,"Rated 4.50 of 4 votes (27 have, 136 want)",Very Good Plus (VG+),Sleeve: Very Good (VG),100.0%,Plaza Sound Studios,nan,$275.00
Blue Mitchell – Blue's Moods,Riverside Records – RLP 9336,US,"Vinyl, LP, Album, Stereo","Recorded at Plaza Sound Studios in New York City; August 24 and 25, 1960.",Jazz,1960,Hard Bop,"Rated 4.50 of 4 votes (27 have, 136 want)",Very Good (VG),Sleeve: Good Plus (G+),100.0%,Plaza Sound Studios,nan,$299.99
Jackie McLean – A Fickle Sonance,Blue Note – BLP 4089,US,"Vinyl, LP, Album, Mono","Recorded on October 26, 1961. Released in 1962

Tracks' duration source Wikipedia: en.wikipedia.org/wiki/A_Fickle_Sonance",Jazz,1962,Hard Bop,"Rated 4.60 of 20 votes (99 have, 271 want)",Very Good (VG),Sleeve: Very Good (VG),99.1%,"Van Gelder Studio, Englewood Cliffs, New Jersey",Plastylite,$300.00
Sonny Rollins – The Sound Of Sonny,Riverside Records – RLP 12-241,US,"Vinyl, LP, Album, Mono, Microgroove","Recorded in New York; June 11, 12 and 19, 1957

Blue and silver, large-diameter labels with ""Bill Grauer Productions, Inc."" printed across bottom",Jazz,1957,Hard Bop,"Rated 4.63 of 8 votes (95 have, 111 want)",Very Good Plus (VG+),Sleeve: Very Good (VG),99.0%,nan,nan,$260.34
John Coltrane – A Love Supreme,Impulse! – A-77,US,"Vinyl, LP, Album, Mono, Gatefold","Recorded December 9th, 1964.

This is the variant with side indications on the labels. There is another variant
without side indications on the labels

""A Product of ABC-Paramount Records Inc."" printed at bottom of labels

The thick cardstock gatefold sleeve has a heavily laminated glossy finish but the inside
of the gatefold does not.",Jazz,1965,"Free Jazz, Hard Bop, Modal","Rated 4.68 of 205 votes (1398 have, 3685 want)",Very Good (VG),Sleeve: Very Good (VG),100.0%,nan,nan,$299.00
"Art Blakey Quintet – A Night At Birdland, Volume 2",Blue Note – BLP 1522,US,"Vinyl, LP, Compilation, Mono","Recorded live on February 21, 1954.

1st original mono issue has:
- deep grooved blue/white Blue Note Records labels with 767 Lexington Ave N.Y.C. addess
- flat edge vinyl with RVG etched and ""P"" (otherwise wrongly called ""ear"") for Plastylite etched in the trail off, both sides
- no address on back cover
- blank spine on cover",Jazz,Sep 1956,Hard Bop,"Rated 4.69 of 16 votes (122 have, 261 want)",Very Good (VG),Sleeve: Very Good (VG),97.4%,Birdland,Plastylite,$299.99
The Miles Davis Quintet – Workin' With The Miles Davis Quintet,Prestige – PRLP 7166,US,"Vinyl, LP, Album, Mono, Deep groove","Yellow & black fireworks labels with ""203 South Washington Ave. Bergenfield, N.J."" address printed at top and ""Long playing microgroove"" at bottom. ""RVG"" stamped into deadwax.

Recorded at Rudy Van Gelder Studio, Hackensack, New Jersey

Variant 2 runout does not have AB on side A",Jazz,Jan 1960,"Hard Bop, Bop","Rated 4.62 of 101 votes (813 have, 1036 want)",Very Good (VG),Sleeve: Very Good Plus (VG+),100.0%,"Van Gelder Studio, Hackensack, New Jersey","Abbey Record Manufacturing Co., Inc.",$271.66
"Freddie Hubbard – The Night Of The Cookers - Live At Club La Marchal, Volume 2",Blue Note – BLP 4208,US,"Vinyl, LP, Album, Mono","Recorded live on April 9, 1965.

1st original MONO issue has:
- blue/white Blue Note Records labels with NEW YORK USA,
- VAN GELDER stamped and ""P"" (wrongly called ""ear"") for Plastylite plant etched in the dead wax, both sides,
- non-laminated cover with 43 West 61st St., New York 23 address on back

Side 1 runout matrix has an ""X"" etched over the incorrect ""8"" and then followed by a correct ""7"".
Side 2 runout matrix has an ""X"" etched over the incorrect ""8"" and then followed by a correct ""7"" and then the correct ""B"" etched over the incorrect ""A"".",Jazz,1966,"Hard Bop, Post Bop","Rated 4.18 of 11 votes (68 have, 128 want)",Very Good Plus (VG+),Sleeve: Very Good Plus (VG+),100.0%,Club La Marchal,Plastylite,$300.00
Lou Donaldson – Blues Walk,Blue Note – BLP 1593,US,"Vinyl, LP, Album, Mono, Deep Groove","Recorded on July 28, 1958.

""Deep Groove"" pressing, identifiable by circular groove (app 1/8"" wide) pressed into the center label 1 1/4 inch from the center of the disc. See images.

Address printed on label: Blue Note Records • 47 West 63rd • NYC (no ""INC"" or ® on label)

Later pressings may be partially identified by variations of this address.",Jazz,1958,"Bop, Hard Bop","Rated 4.82 of 33 votes (221 have, 483 want)",Very Good (VG),Sleeve: Very Good (VG),100.0%,"Van Gelder Studio, Hackensack, New Jersey",Plastylite,$288.46
Art Blakey & The Jazz Messengers – At The Jazz Corner Of The World Vol. 1,Blue Note – BLP 4015,US,"Vinyl, LP, Album, Mono","Recorded live on April 15, 1959.
This is the first volume of two, the second is BLP 4016.
Labels have 47 West 63rd NYC address. Deep groove. No ""Inc"", no ®.

RVG stamp and Plastylite 'ear' in the deadwax., both sides.

Laminated cover.
Also released as BST 84015.",Jazz,1959,Hard Bop,"Rated 4.59 of 34 votes (273 have, 245 want)",Very Good Plus (VG+),Sleeve: Very Good Plus (VG+),100.0%,Birdland,Plastylite,$300.00
Charles Mingus – Mingus Ah Um,Columbia – CS 8171,US,"Vinyl, LP, Album, Stereo","First pressing from 1959.

Features Deep Groove label

Rear cover features a bold 3 in the bottom right corner of the jacket.

Deep groove ridge can be seen and felt running the perimeter of the red inner label and the black outer ring.

Recorded at 30th Street Studio, NYC.
May 5, 1959 (A1, B1-B4) / May 12, 1959 (A2-A5).

Identical cover to Mingus Ah Um except for 3 code.",Jazz,14 Sep 1959,"Hard Bop, Bop","Rated 4.78 of 9 votes (70 have, 345 want)",Near Mint (NM or M-),Sleeve: Very Good (VG),97.3%,Columbia 30th Street Studio,nan,$254.99
Miles Davis Sextet* – Someday My Prince Will Come,Columbia – CS 8456,US,"Vinyl, LP, Album, Stereo","Early pressing variant released on a '6-eye' label.

The text layout used on the labels is different on this version.
The title appears in three lines instead of two.

Has the number ""4"" printed in the lower right corner of the back sleeve.
This is a printing plant code. The exact identity of this plant is unknown.",Jazz,1961,Hard Bop,"Rated 4.42 of 57 votes (655 have, 268 want)",Near Mint (NM or M-),Sleeve: Very Good Plus (VG+),100.0%,nan,nan,$260.00
Tubby Hayes And The Jazz Couriers Featuring Ronnie Scott – The Jazz Couriers,Tempo Records (5) – TAP 15,UK,"Vinyl, LP, Album, Mono","As compiled in Just Jazz 3 (Jazz Discography 1958) by Frank Dutton and Eric Townley.

Recorded: London, August 8, 1957 (A1, A2, B3, B4)
Recorded: London, August 15, 1957 (A3 to B2)

Cover variation. 'The Jazz Couriers' on front, 'Tubby Hayes and the Jazz Couriers' on back.
also released with 'Tubby Hayes and the Jazz Couriers' on front.",Jazz,1958,Hard Bop,"Rated 4.33 of 6 votes (25 have, 136 want)",Good Plus (G+),Sleeve: Very Good Plus (VG+),100.0%,nan,nan,$289.95
The Jazz Messengers* – At The Cafe Bohemia Volume 1,Blue Note – BLP 1507,US,"Vinyl, LP, Album, Mono","Recorded live on November 23, 1955.

The 1st original mono issue has:
- deep grooved blue/white Blue Note Records labels with 767 Lexington Ave N.Y.C. addess,
- flat edge vinyl with RVG and ""P"" (otherwise wrongly called ""ear"") for Plastylite plant, both etched in the trail off,
- non laminated framed front cover,
- Blue Note Records, 767 Lexington Ave., New York 21 address on back cover,
- blank spine on cover.",Jazz,Jan 1956,Hard Bop,"Rated 4.52 of 46 votes (303 have, 435 want)",Very Good (VG),Sleeve: Good Plus (G+),100.0%,Café Bohemia,Plastylite,$299.99
Miles Davis All Stars – Out Of The Blue,Prestige – prEP 1361,US,"Vinyl, 7"", 45 RPM, EP","Originally recorded on October 5, 1951.",Jazz,1954,Hard Bop,"No Rating Yet (5 have, 24 want)",Very Good Plus (VG+),Sleeve: Generic,100.0%,nan,nan,$299.98
Jackie McLean – McLean's Scene,"New Jazz – 8212, New Jazz – NJLP 8212",US,"Vinyl, LP, Album, Mono","Tracks A1, A3, B1 recorded December 14, 1956; Tracks A2, B2, B3 February 15, 1957.
Recorded at Van Gelder Studios, Hackensack, NJ.

Catalogue # 8212 on cover,
NJLP 8212 on back.
NJLP 8212 A matrix label A Side,
NJLP 8212 B matrix label B Side.",Jazz,1958,Hard Bop,"Rated 4.67 of 15 votes (103 have, 200 want)",Very Good Plus (VG+),Sleeve: Very Good (VG),99.5%,"Van Gelder Studio, Hackensack, New Jersey",nan,$295.00
Cannonball Adderley – Somethin' Else,"Blue Note – BLP 1595, Blue Note – 1595",US,"Vinyl, LP, Album, Mono","This pressing has:
- W 63 street address and no ® and microgroove on the labels
- Deep groove on both sides.
- no Inc. in address on back cover.
-""P"", for Plastylite Recording plant etched.
- RVG stamped in the trail off, both sides.
- Address in back cover should be printed with Serif font as it is considered the first printing. (Fred Cohen's ""A guide for Identifying Original Pressings"" p105)

Miles Davis performs by courtesy of Columbia Records.
Hank Jones performs by courtesy of Capitol Records.
Recorded on March 9, 1958.",Jazz,May 1958,"Bop, Hard Bop","Rated 4.70 of 194 votes (1087 have, 1718 want)",Very Good (VG),Sleeve: Very Good (VG),99.5%,nan,Plastylite,$300.00
Lee Morgan – The Sidewinder,"Blue Note – BST 84157, Blue Note – 4157",US,"Vinyl, LP, Album, Stereo","Original stereo pressing (BST 84157) in original mono sleeve (4157) with ""STEREO"" sticker on front cover.
""Blue Note Records, Inc. • New York USA"" printed on labels and the Plastylite ""ear"" etching in the run out.

Barry Harris performs courtesy of Riverside Records.",Jazz,1964,Hard Bop,"Rated 4.70 of 10 votes (61 have, 292 want)",Very Good Plus (VG+),Sleeve: Very Good Plus (VG+),99.6%,nan,Plastylite,$299.00
Mal Waldron Quintet Featuring Gigi Gryce And Idrees Sulieman – Mal-1,Prestige – PRLP 7090,US,"Vinyl, LP, Album, Mono","Recorded in Hackensack, NJ; November 9, 1956.

First pressing: W. 50th Street, N.Y.C. version.",Jazz,May 1957,Hard Bop,"Rated 4.67 of 12 votes (53 have, 204 want)",Very Good (VG),Sleeve: Poor (P),99.3%,"Van Gelder Studio, Hackensack, New Jersey",nan,$279.99
The Horace Silver Quintet – Further Explorations,Blue Note – BLP 1589,US,"Vinyl, LP, Album, Mono","Recorded on January 13, 1958.

The 1st original MONO issue has:
- blue and white deep groove Blue Note Records - 47 West 63rd - NYC labels (no Inc., no ®)
- RVG stamped in the dead wax, both sides
- P, wrongly called ""ear"", for Plastylite plant etched in the dead wax, both sides
- no address on back-cover
- front laminated cover
- printed spine

A1 to B2 published by Ecaroh Music, ASCAP
B3 publsished by Mills Music, ASCAP",Jazz,Mar 1958,Hard Bop,"Rated 4.39 of 41 votes (253 have, 245 want)",Very Good Plus (VG+),Sleeve: Very Good Plus (VG+),100.0%,"Van Gelder Studio, Hackensack, New Jersey",Plastylite,$300.00
Curtis Fuller – New Trombone,"Prestige – 7107, Prestige – PRLP 7107",US,"Vinyl, LP, Album, Mono","Recorded May 11, 1957.

Deep Groove, 446 W. 50th ST., N.Y.C. Fireworks Label, RVG & Ear stamps",Jazz,1957,Hard Bop,"Rated 4.63 of 8 votes (36 have, 211 want)",Good Plus (G+),Sleeve: Generic,100.0%,"Van Gelder Studio, Hackensack, New Jersey",Plastylite,$300.00
Lee Morgan – The Sidewinder,"Blue Note – BLP 4157, Blue Note – 4157",US,"Vinyl, LP, Album, Mono, Deep groove","This edition has deep groove labels on both sides. New York USA labels. Van Gelder and ear mark in dead wax.

Recorded on December 21, 1963.

Barry Harris performs courtesy of Riverside Records.

1st Pressings have labels with “New York, USA” address, vangelder and ear (P for Plastylite pressing plant) in the matrix.",Jazz,Jul 1964,Hard Bop,"Rated 5.00 of 1 votes (6 have, 63 want)",Very Good (VG),Sleeve: Very Good (VG),100.0%,"Van Gelder Studio, Englewood Cliffs, New Jersey",Plastylite,$299.99
Carl Perkins (4) – Introducing...,"Dooto Records – DL-211, Dooto Records – AULS-211",US,"Vinyl, LP, Album","Recorded in Los Angeles, 1955. The label name was changed to Dooto from Dootone in January 1957 (to avoid a lawsuit from Duo-Tone Records).",Jazz,1957,"Bop, Hard Bop, Soul-Jazz","Rated 4.50 of 2 votes (16 have, 43 want)",Near Mint (NM or M-),Sleeve: Very Good (VG),95.2%,nan,nan,$300.00
Woods* / Byrd* – The Young Bloods,Prestige – LP 7080,US,"Vinyl, LP, Album, Mono","Recorded November 2, 1956.

Deep groove pressing. RVG in runout.
Prestige Records Inc. 446W. 50th ST., N.Y.C.",Jazz,1956,Hard Bop,"Rated 4.60 of 10 votes (50 have, 177 want)",Very Good (VG),Sleeve: Very Good (VG),100.0%,"Van Gelder Studio, Hackensack, New Jersey","Abbey Record Manufacturing Co., Inc.",$285.07
The Red Garland Trio – Groovy,Prestige – 7113,US,"Vinyl, LP, Album, Mono","Tracks B1 & B2 recorded December 14, 1956.
Track B3 recorded May 24, 1957.
Tracks A1 to A3 recorded August 9, 1957.",Jazz,1957,"Hard Bop, Modal","Rated 4.13 of 16 votes (119 have, 229 want)",Very Good (VG),Sleeve: Very Good (VG),97.2%,"Van Gelder Studio, Hackensack, New Jersey",nan,$300.00
The Miles Davis Quintet – Relaxin' With The Miles Davis Quintet,"Prestige – 7129, Prestige – PRLP 7129",US,"Vinyl, LP, Album, Mono, Abbey Press","Yellow deep groove Prestige fireworks label with ""Prestige Records, Inc., 203 South Washington, Ave., Bergenfield, N.J."" address and RVG stamps in both sides of deadwax along with the upwards arrow stamp that is associated with Abbey Manufacturing. This also has the dime-sized pressing indentation around the spindle hole on Side A definitely denoting Abbey Record Manufacturing. Has a small sideways ""c"" on side A runout stamped after RVG and a larger ""C"" stamped in the same place on side B. See the link with the submission notes for more info.

Thick cardboard cover with laminated front.

First catalog number on cover, second on label.",Jazz,1958,Hard Bop,"Rated 4.67 of 3 votes (16 have, 52 want)",Very Good Plus (VG+),Sleeve: Near Mint (NM or M-),100.0%,nan,"Abbey Record Manufacturing Co., Inc.",$275.00
Wynton Kelly – Kelly Blue,Riverside Records – RLP 12-298,US,"Vinyl, LP, Album, Mono",Blue 'mic and reel' labels with 'BILL GRAUER PRODUCTIONS' along the bottom (no 'INC.').,Jazz,1959,"Bop, Hard Bop","Rated 4.43 of 7 votes (118 have, 202 want)",Very Good Plus (VG+),Sleeve: Very Good Plus (VG+),99.9%,Reeves Sound Studios,nan,$298.99
The Miles Davis Quintet – Miles Smiles,Columbia – CL 2601,US,"Vinyl, LP, Album, Mono","1st U.S. Pressing

The following is printed in the inner label of the LP:

<-""360 SOUND"" MONO ""360 SOUND""->
(in white lettering, located at the bottom of the inner label on the record)",Jazz,Jan 1967,"Hard Bop, Post Bop, Modal","Rated 4.77 of 31 votes (394 have, 273 want)",Near Mint (NM or M-),Sleeve: Very Good Plus (VG+),99.0%,nan,"Columbia Records Pressing Plant, Pitman",$269.99
''Baby Face'' Willette* – Face To Face,Blue Note – BLP 4068,US,"Vinyl, LP, Album, Mono","Recorded on January 30, 1961.

Tracks' duration source Wikipedia: https://en.wikipedia.org/wiki/Face_to_Face_(Baby_Face_Willette_album)",Jazz,1961,"Hard Bop, Soul-Jazz","Rated 4.53 of 19 votes (105 have, 241 want)",Very Good Plus (VG+),Sleeve: Very Good Plus (VG+),99.7%,"Van Gelder Studio, Englewood Cliffs, New Jersey",nan,$299.99
John Jenkins (2) – Jazz Eyes,"Regent – MG 6056, Regent – RMG 6056",US,"Vinyl, LP, Album","Recorded September 10, 1957.
Front cover & label credits Art Taylor, not Arthur Taylor as on the rear cover.
Green Regent label with ""RMG 6056"" as catalog number.
Runoff grooves has ""RVG"", ""RMG 6056-A"" and ""RMG 6056-B"" and X20 engraved. Also the horizontal ""A"".",Jazz,1957,"Hard Bop, Bop","Rated 3.75 of 4 votes (39 have, 107 want)",Very Good Plus (VG+),Sleeve: Very Good Plus (VG+),99.7%,"Van Gelder Studio, Hackensack, New Jersey",nan,$300.00
Art Taylor – Taylor's Wailers,Prestige – 7117,US,"Vinyl, LP, Album, Mono","A1, A3 to B3: Recorded February 25, 1957
A2: Recorded March 22, 1957

Yellow and black label with 446 W. 50th St., N. Y. C. address.",Jazz,1957,Hard Bop,"Rated 4.40 of 15 votes (68 have, 195 want)",Very Good (VG),Sleeve: Good Plus (G+),100.0%,"Van Gelder Studio, Hackensack, New Jersey",nan,$300.00
Gene Ammons – Boss Tenor,Prestige – PRST 7180,US,"Vinyl, LP, Album, Stereo","Recorded at the Van Gelder Studio, Englewood Cliffs, NJ; June 16, 1960.
Black/silver label pressing. ""RVG STEREO"" stamped into deadwax.
Also issued in mono (PRLP 7180).",Jazz,1960,"Hard Bop, Soul-Jazz","Rated 4.63 of 8 votes (76 have, 115 want)",Near Mint (NM or M-),Sleeve: Near Mint (NM or M-),99.8%,"Van Gelder Studio, Englewood Cliffs, New Jersey","Abbey Record Manufacturing Co., Inc.",$300.00
Sonny Red With Grant Green And Barry Harris (2) – The Mode,Jazzland – JLP 59,US,"Vinyl, LP, Album, Mono","Recorded at Plaza Sound Studios, New York City on May 29 (A2, A4, B2, B3) and December 14 (A1, A3, B1), 1961.

Orange labels.",Jazz,1962,Hard Bop,"Rated 3.60 of 10 votes (46 have, 168 want)",Very Good Plus (VG+),Sleeve: Good Plus (G+),99.0%,Plaza Sound Studios,nan,$299.99
"Thad Jones - Frank Wess - Teddy Charles - Mal Waldron - Doug Watkins - Elvin Jones, The Prestige All Stars – Olio","Prestige – 7084, Prestige – LP 7084, Prestige – PRLP 7084",US,"Vinyl, LP, Album, Mono","Recorded February, 16, 1957. Same group of musicians as the Prestige All Stars.
Printed in U.S.A.

Prestige Records Inc. N.Y.C., 446 West 50th Street, New York 19, N.Y.

1st cat# on front sleeve, 2nd cat# on rear; 3rd cat# on center labels",Jazz,1957,Hard Bop,"Rated 4.50 of 14 votes (58 have, 236 want)",Very Good Plus (VG+),Sleeve: Good Plus (G+),99.5%,"Van Gelder Studio, Hackensack, New Jersey",nan,$300.00
Tommy Turrentine – Tommy Turrentine,Time Records (3) – T/70008,US,"Vinyl, LP, Album, Mono",nan,Jazz,Mar 1960,Hard Bop,"Rated 3.67 of 9 votes (54 have, 79 want)",Very Good Plus (VG+),Sleeve: Very Good Plus (VG+),100.0%,nan,nan,$300.00
Bill Evans / Roy Haynes / Eric Dolphy / Oliver Nelson / Paul Chambers (3) / Freddie Hubbard – The Blues And The Abstract Truth,"Impulse! – A-5-S, Impulse! – STEREO A-5",US,"Vinyl, LP, Album, Stereo","This is the first stereo pressing of this album. It has an ""abstract"" cover, as opposed to later pressings with a photo of Oliver Nelson. This cover was quickly withdrawn. Also unlike later pressings, the cover and label credit the album to all six musicians and not just to Nelson.

True first pressings have orange and black labels. The print at the bottom, in white, reads ""A Product of Am-Par Record Corp. Printed In U.S.A.""

""RVG STEREO"" is stamped in the dead wax.

Cat. no. on cover is STEREO A-5. Cat. no. on label is A-5-S.

Recorded 23 February, 1961.",Jazz,1961,"Hard Bop, Modal","Rated 4.56 of 27 votes (149 have, 771 want)",Very Good (VG),Sleeve: Very Good (VG),99.5%,nan,nan,$300.00
Miles Davis – Blue Moods,Debut Records – DEB-120,US,"Vinyl, LP, Album","Recorded July 9, 1955",Jazz,1955,Hard Bop,"Rated 4.24 of 25 votes (147 have, 574 want)",Very Good Plus (VG+),Sleeve: Good Plus (G+),100.0%,nan,nan,$299.99
Sonny Rollins – Volume 2,Blue Note – BLP 1558,US,"Vinyl, LP, Album, Mono, 47 West","Jay Jay Johnson performs by courtesy of Columbia Recordss. Thelonious Monk performs by courtesy of Riverside Records.
Recorded on April 14, 1957.

This release is for 2nd pressing, with 47W 63rd NYC label:

For collectors, it's key to know that 2nd pressings of this release must have:

01. 47 west 63rd NYC on label
02. No ® under the E of Note on label
03. RVG initials stamped in dead wax of side 1 + 9M and RVG hand etched in dead wax of side 2
04. 'P' a.k.a. Plastylite ""ear"" in dead wax of both sides
05. Deep Groove on both sides
06. Beaded rim, not flat
07. New York 23 address on back cover, no ""inc""
08. Blank spine
09. Laminated cover (source: ""Blue Note Records, A Guide to Identifying Original Pressings"" - written by Frederic Cohen).

The images added to this submission demonstrate this 2nd pressing.

----

First pressing (with NY 23 label) can be found here: 1st Pressing",Jazz,Sep 1957,Hard Bop,"Rated 4.71 of 35 votes (244 have, 369 want)",Very Good (VG),Sleeve: Very Good (VG),98.9%,"Van Gelder Studio, Hackensack, New Jersey",Plastylite,$275.00
Miles Davis All Stars – Walkin',Prestige – PRLP 7076,US,"Vinyl, LP, Album, Compilation, Mono","First label with 446 W. 50th St. N.Y.C. address on both sides label. Cover address is 447 west 50th Street, New York 19, N.Y.
Side A previously released as LP182 ""All Star Sextet""(10'- 1954)
Side B previously released as LP185 ""Miles Davis Quintet""(10'-1954)",Jazz,1957,Hard Bop,"Rated 4.50 of 30 votes (311 have, 340 want)",Near Mint (NM or M-),Sleeve: Very Good Plus (VG+),100.0%,nan,"Abbey Record Manufacturing Co., Inc.",$300.00
"Art Blakey Quintet – A Night At Birdland, Volume 1",Blue Note – BLP 5037,US,"Vinyl, LP, 10"", Album","Recorded live on February 21, 1954.",Jazz,1954,Hard Bop,"Rated 4.50 of 12 votes (67 have, 141 want)",Very Good (VG),Sleeve: Very Good (VG),100.0%,Birdland,nan,$272.25
John Coltrane – My Favorite Things,Atlantic – 1361,US,"Vinyl, LP, Album, Stereo","Recorded at Atlantic Studios, New York, NY
Track A1 on October 21, 1960
Track B1 on October 24, 1960
Tracks A2 & B2 on October 26, 1960
Green / blue labels.

1962-1966 reissue

Publishers:
A1: Williamsson, ASCAP
A2: Chappell, ASCAP
B1: Gershwin Pub., ASCAP
B2: New World, ASCAP

Printed in U.S.A.",Jazz,1962,"Hard Bop, Modal","Rated 4.83 of 6 votes (68 have, 318 want)",Near Mint (NM or M-),Sleeve: Near Mint (NM or M-),98.1%,Atlantic Studios,nan,$300.00
The Horace Silver Quintet & Trio* – Blowin' The Blues Away,Blue Note – BLP 4017,US,"Vinyl, LP, Album, Reissue, Mono, Microgroove","Recorded on August 29 (A1, B2) and 30 (A3, A4, B1) and September 13 (A2, B3), 1959

On one side label is 47 W. 63rd NYC address and on the other side it is New York USA. Deep groove on one side.

RVG and Plastylite ear are in the run out grooves of both sides.

Back cover reads ""43 West 61st St., New York 23"".",Jazz,1963,Hard Bop,"Rated 4.67 of 6 votes (54 have, 78 want)",Very Good Plus (VG+),Sleeve: Very Good Plus (VG+),100.0%,"Van Gelder Studio, Englewood Cliffs, New Jersey",Plastylite,$299.99
Donald Byrd – Royal Flush,Blue Note – BLP 4101,US,"Vinyl, LP, Album, Mono","Recorded on September 21, 1961.",Jazz,1961,"Hard Bop, Soul-Jazz, Post Bop","Rated 4.68 of 22 votes (151 have, 357 want)",Very Good (VG),Sleeve: Good Plus (G+),100.0%,"Van Gelder Studio, Englewood Cliffs, New Jersey",nan,$280.00
