Artist_Album,Label,Country,Format,Notes,Genre,Release_Date,Style,Rate_Haves_Wants,Media_Condition,Sleeve_Condition,Seller_Rating,Recorded_at,Pressed_by,Price
Curtis Fuller With Red Garland – Curtis Fuller With Red Garland,"New Jazz – NJ 8277, New Jazz – NJLP 8277",US,"Vinyl, LP, Album, Mono","Recorded May 14, 1957.",Jazz,1962,Hard Bop,"Rated 4.40 of 5 votes (68 have, 111 want)",Very Good Plus (VG+),Sleeve: Good (G),99.0%,"Van Gelder Studio, Hackensack, New Jersey",nan,$127.51
Cannonball Adderley – Somethin' Else,"Blue Note – BLP 1595, Blue Note – 1595",US,"Vinyl, LP, Album, Mono","This pressing has:
- W 63 street address and no ® and microgroove on the labels
- Deep groove on both sides.
- no Inc. in address on back cover.
-""P"", for Plastylite Recording plant etched.
- RVG stamped in the trail off, both sides.
- Address in back cover should be printed with Serif font as it is considered the first printing. (Fred Cohen's ""A guide for Identifying Original Pressings"" p105)

Miles Davis performs by courtesy of Columbia Records.
Hank Jones performs by courtesy of Capitol Records.
Recorded on March 9, 1958.",Jazz,May 1958,"Bop, Hard Bop","Rated 4.70 of 194 votes (1087 have, 1718 want)",Good Plus (G+),Sleeve: Very Good (VG),100.0%,nan,Plastylite,$125.00
Mal Waldron With John Coltrane / Jackie McLean / Paul Quinichette / Frank Wess – The Dealers,"Status Records (2) – 8316, Status Records (2) – ST 8316",US,"Vinyl, LP, Album, Mono","Orange Status label with black print. NJLP-8316 hand-etched and Van Gelder stamp in runout.

Side A recorded April 19, 1957 (the same session that yielded PRLP 7111 - Mal-2).
Side B recorded September 20, 1957 (alternate takes from the same session as PRLP 7131 - Wheelin' And Dealin' ).",Jazz,1965,Hard Bop,"Rated 4.80 of 10 votes (85 have, 261 want)",Very Good Plus (VG+),Sleeve: Very Good Plus (VG+),99.6%,nan,nan,$125.00
Freddie Hubbard – The Night Of The Cookers - Live At Club La Marchal - Volume 2,Blue Note – BST 84208,US,"Vinyl, LP, Album, Stereo","1st original STEREO issue has:
- blue/white Blue Note Records labels with NEW YORK USA,
- VAN GELDER stamped and ""P"" (wrongly called ""ear"") for Plastylite plant etched in the dead wax, both sides,
- non-laminated cover with 43 West 61st St., New York 23 address on back",Jazz,1966,"Hard Bop, Post Bop","Rated 4.36 of 11 votes (84 have, 88 want)",Near Mint (NM or M-),Sleeve: Near Mint (NM or M-),99.7%,Club La Marchal,Plastylite,$120.00
The Horace Silver Quintet – Doin' The Thing - At The Village Gate,Blue Note – BLP 4076,US,"Vinyl, LP, Album, Mono","Recorded on May 19 & 20, 1961.

Blue Mitchell performs by courtesy of Riverside Records.

Alfred Lion of Blue Note extends special thanks to Art D'Lagoff whose genial cooperation made this recording session possible.

1st original Mono issue has:
- blue/white Blue Note Records Inc - New York Usa labels, deep groove on 1 side only,
- RVG stamped in the dead wax, both sides,
- ""P"" (otherwise wrongly called ""ear"") for Plastylite plant etched in the trail off, both sides,
- laminated jacket,
- 43 West 61st St., New York 23 address on back cover",Jazz,Aug 1961,Hard Bop,"Rated 4.28 of 53 votes (598 have, 245 want)",Very Good Plus (VG+),Sleeve: Very Good Plus (VG+),99.5%,Village Gate,Plastylite,$125.00
Oliver Nelson – The Blues And The Abstract Truth,Impulse! – A-5,US,"Vinyl, LP, Album, Reissue, Mono","Recorded 23 February, 1961
This variant has the revised cover, credits ""ABC-Paramount"" on labels and has A-5 catalog number on labels without -A / -B suffixes.",Jazz,1962,"Hard Bop, Modal","Rated 4.69 of 42 votes (284 have, 479 want)",Very Good Plus (VG+),Sleeve: Very Good Plus (VG+),99.5%,nan,nan,$120.00
Carl Perkins (4) – Introducing...,Dootone Records – DL-211,US,"Vinyl, LP, Album, Red",First pressings on Dootone Records were available in black vinyl and red vinyl (this entry).,Jazz,1956,"Bop, Hard Bop, Soul-Jazz","Rated 4.00 of 2 votes (15 have, 90 want)",Good (G),Sleeve: Good (G),100.0%,nan,nan,$120.00
John Coltrane – Blue Train,"Blue Note – BST 81577, Blue Note – BLP 1577, Blue Note – BLP-1577, Blue Note – 81577",US,"Vinyl, LP, Album, Reissue, Stereo","Similar to John Coltrane - Blue Train, but without RVG STEREO in the Matix / Runout.",Jazz,1967,Hard Bop,"Rated 4.56 of 9 votes (87 have, 267 want)",Very Good Plus (VG+),Sleeve: Near Mint (NM or M-),100.0%,"Van Gelder Studio, Hackensack, New Jersey",nan,$120.00
The Horace Silver Quintet – The Tokyo Blues,Blue Note – BLP 4110,US,"Vinyl, LP, Album, Mono","Recorded on July 13 (A2, B1) and July 14 (A1, B2, B3), 1962.

Blue Mitchell performs by courtesy of Riverside Records.

1st original issue has
- blue & white labels with New York USA and deep groove only on the A side or no deep groove, depending on philosophy.
- ""VAN GELDER"" stamped and ""EAR"" symbol into deadwax both sides.

From the back cover: This album is dedicated to all of our many fans in Japan and to all of the Japanese people who were so very kind to us while we were making our concert tour there. It is our wish to return again some day soon. While in Japan, I noticed that the Japanese people were very fond of Latin music, which I also am very fond of. In writing some of these compositions I have attempted to combine Japanese feeling in the melodies with Latin feeling in the rhythms. I hope you enjoy them. [Signed] Horace Silver.",Jazz,Sep 1962,Hard Bop,"Rated 4.62 of 60 votes (477 have, 331 want)",Very Good Plus (VG+),Sleeve: Near Mint (NM or M-),99.8%,"Van Gelder Studio, Englewood Cliffs, New Jersey",Plastylite,$111.84
Kenny Burrell – Introducing Kenny Burrell,Blue Note – BST 81523,US,"Vinyl, LP, Album, Repress, Stereo","Blue Note - A Product of Liberty Records, Inc.
Electronically Re-Recorded To Simulate Stereo

Recorded in 1956.","Jazz, Blues",1967,"Hard Bop, Post Bop","Rated 4.56 of 16 votes (135 have, 171 want)",Very Good Plus (VG+),Sleeve: Near Mint (NM or M-),100.0%,nan,nan,$120.00
Miles Davis All Stars – Vol. 1,"Prestige – LP 196, Prestige – PRLP 196",US,"Vinyl, LP, 10""","50s pressing with ""deep groove"" yellow labels. 446 W. 50th St., New York address on cover and labels.

2nd pressing w/ y/b fireworks label and NYC address. 1st pressing has maroon labels and NYC address.

Recorded at Rudy Van Gelder Studio, Hackensack, NJ, December 24, 1954 [jazzdisco.org].",Jazz,1955,"Bop, Hard Bop","Rated 4.50 of 4 votes (31 have, 78 want)",Very Good Plus (VG+),Sleeve: Very Good (VG),100.0%,"Van Gelder Studio, Hackensack, New Jersey",nan,$120.00
Sonny Rollins – Way Out West,Contemporary Records – M3530,US,"Vinyl, LP, Mono, Reissue","Deep grooved Yellow label with Black text

Front cover reads “M 3530”
Label reads “C 3530”

Black border around text on back cover

Recorded at Contemporary's studio in Los Angeles March 7, 1957. Liner notes dated June 6, 1957.",Jazz,1959,Hard Bop,"Rated 4.82 of 11 votes (76 have, 172 want)",Good Plus (G+),Sleeve: Fair (F),99.3%,Contemporary's Studio,nan,$119.99
"Jackie McLean – 4, 5 & 6",New Jazz – NJ 8279,US,"Vinyl, LP, Album, Reissue",nan,Jazz,1962,Hard Bop,"Rated 4.20 of 5 votes (70 have, 79 want)",Very Good Plus (VG+),Sleeve: Very Good Plus (VG+),99.6%,nan,nan,$111.99
Jackie McLean – Let Freedom Ring,Blue Note – BST 84106,US,"Vinyl, LP, Album, Repress, Stereo","Classic blue / white Blue Note labels with ""A Division of Liberty Records, Inc."".

VAN GELDER mastering stamper in the runout of both sides.

Back cover has ""Blue Note Records Inc., 43 West 61st St., New York 23"" at the bottom and ""Blue Note ST-84106"" upper right. Spine has Blue Note Stereo 84106.",Jazz,1967,Hard Bop,"Rated 5.00 of 4 votes (88 have, 152 want)",Near Mint (NM or M-),Sleeve: Very Good Plus (VG+),99.8%,"Van Gelder Studio, Englewood Cliffs, New Jersey",nan,$119.99
The Horace Silver Quintet – Song For My Father = Cantiga Para Meu Pai,"Blue Note – 84185, Blue Note – BST 84185",US,"Vinyl, LP, Album, Reissue, Stereo, NY USA Label","Label: STEREO Blue/white Blue Note Records Inc • New York USA
No deep groove
No ""P""
43 West 61st St., New York 23 address on back cover

This version can be identified by the runout grooves, which lack the Plastylite 'ear' symbol and indicates it was likely released in 1966.",Jazz,1966,"Hard Bop, Latin Jazz","Rated 5.00 of 1 votes (30 have, 164 want)",Very Good Plus (VG+),Sleeve: Very Good Plus (VG+),99.9%,nan,nan,$119.99
Charles Mingus – Mingus At Monterey,"Jazz Workshop – JWS 001, Jazz Workshop – JWS 002",US,"2 × Vinyl, LP, Album","Recorded September 20, 1964, at the Monterey Jazz Festival, Monterey, California.
Original private pressing available through mail order only from Mingus himself.

Issued in a gatefold cover.

other matrix numbers:
Record 1
1A : RR4M-5086-2
2A : RR4M-5087-2
Record 2
2B : RR4M-5088-2
1B : RR4M-5089-2",Jazz,1966,"Hard Bop, Post Bop","Rated 4.64 of 11 votes (81 have, 87 want)",Very Good Plus (VG+),Sleeve: Very Good (VG),95.2%,Monterey Jazz Festival,nan,$118.00
John Coltrane – A Love Supreme,"Impulse! – SMAS-90215, Impulse! – 90215",US,"Vinyl, LP, Album, Stereo, Club Edition","Recorded December 9th, 1964. Distributed by ABC-Paramount Records, Inc.

Capitol Record Club edition with original orange and black Impulse! labels.

No catalog number on jacket cover, only ""Stereo"". The catalog number on the inside of gatefold reads ""90215"", while the vinyl labels read ""SMAS-90215.""

Manufactured by Capitol Records, Inc., U.S.A.",Jazz,1965,"Free Jazz, Hard Bop, Modal","Rated 4.82 of 39 votes (228 have, 1061 want)",Very Good (VG),Sleeve: Good Plus (G+),100.0%,nan,"Capitol Records Pressing Plant, Scranton",$120.00
John Coltrane – Giant Steps,Atlantic – 1311,US,"Vinyl, LP, Album, Repress, Mono, Laminated Cover","Deep groove, bullseye label, second issue.
Released in a heavy cardboard jacket with a laminated cover.

""Full Dynamics – Frequency Spectrum""",Jazz,1960,Hard Bop,"Rated 4.80 of 25 votes (200 have, 740 want)",Good Plus (G+),Sleeve: Very Good (VG),99.9%,Atlantic Studios,nan,$117.59
The Miles Davis Quintet – Relaxin' With The Miles Davis Quintet,"Prestige – 7129, Prestige – PRLP 7129",US,"Vinyl, LP, Album, Mono","Bergenfield, NJ address on labels",Jazz,1958,Hard Bop,"Rated 4.72 of 72 votes (530 have, 434 want)",Very Good (VG),Sleeve: Very Good Plus (VG+),99.4%,nan,nan,$119.00
Wynton Kelly – Wynton Kelly!,"Vee Jay Records – LP-3022, Vee Jay Records – VJLP-3022",US,"Vinyl, LP, Album, Mono","Cover/rear jacket and spine: LP-3022
Labels: VJLP-3022

Recorded July 20 & 21, 1961.",Jazz,1961,Hard Bop,"Rated 4.25 of 8 votes (136 have, 81 want)",Near Mint (NM or M-),Sleeve: Very Good Plus (VG+),99.6%,Bell Sound Studios,"RCA Records Pressing Plant, Indianapolis",$119.99
Sonny Rollins Quartet – Tenor Madness,Prestige – PRLP 7047,US,"Vinyl, LP, Album, Reissue, Mono","Recorded in Hackensack, NJ; May 24, 1956.

Deep groove both sides of the label.
Bergenfield, NJ address on the label.",Jazz,1958,"Bop, Hard Bop","Rated 4.80 of 10 votes (72 have, 113 want)",Very Good (VG),Sleeve: Good Plus (G+),100.0%,"Van Gelder Studio, Hackensack, New Jersey","Abbey Record Manufacturing Co., Inc.",$120.00
Bennie Green – Hornful Of Soul,Parlophone – PMC 1180,UK,"Vinyl, LP, Album, Mono","Original UK issue, Mono. Green Parlophone label and flip-back cover.",Jazz,1961,Hard Bop,"Rated 4.00 of 1 votes (8 have, 23 want)",Very Good Plus (VG+),Sleeve: Very Good Plus (VG+),100.0%,nan,nan,$115.00
The Horace Silver Quintet – Doin' The Thing - At The Village Gate,Blue Note – BLP 4076,US,"Vinyl, LP, Album, Mono","Recorded on May 19 & 20, 1961.

Blue Mitchell performs by courtesy of Riverside Records.

Alfred Lion of Blue Note extends special thanks to Art D'Lagoff whose genial cooperation made this recording session possible.

1st original Mono issue has:
- blue/white Blue Note Records Inc - New York Usa labels, deep groove on 1 side only,
- RVG stamped in the dead wax, both sides,
- ""P"" (otherwise wrongly called ""ear"") for Plastylite plant etched in the trail off, both sides,
- laminated jacket,
- 43 West 61st St., New York 23 address on back cover",Jazz,Aug 1961,Hard Bop,"Rated 4.28 of 53 votes (598 have, 245 want)",Very Good Plus (VG+),Sleeve: Very Good Plus (VG+),97.6%,Village Gate,Plastylite,$120.00
Miles Davis – Collectors' Items,"Prestige – PRLP 7044, Prestige – LP 7044, Prestige – 7044",US,"Vinyl, LP, Album, Mono","Second pressing with black/yellow 'fireworks' & Bergenfield, NJ, labels.

First catalogue number on labels, second on front & rear cover, third on spine.

Recorded at WOR Studios, NYC, January 30, 1953 (A1 to A4) and at Rudy Van Gelder Studio, Hackensack, NJ, March 16, 1956 (B1 to B3) [jazzdisco.org].",Jazz,1958,"Bop, Hard Bop","Rated 4.31 of 16 votes (153 have, 94 want)",Very Good Plus (VG+),Sleeve: Good Plus (G+),100.0%,WOR Studios,"Abbey Record Manufacturing Co., Inc.",$120.00
John Coltrane And Paul Quinichette – Cattin' With Coltrane And Quinichette,Prestige – 7158,US,"Vinyl, LP, Album, Mono","Yellow / black label with NJ address and deep groove.

Originally released in 1959

Recorded at Rudy Van Gelder Studio, Hackensack, NJ, May 17, 1957 [jazzdisco.org]",Jazz,1959,Hard Bop,"Rated 4.29 of 21 votes (159 have, 224 want)",Very Good (VG),Sleeve: Very Good Plus (VG+),99.6%,"Van Gelder Studio, Hackensack, New Jersey",nan,$115.00
Sonny Rollins – Volume 2,Blue Note – BLP 1558,US,"Vinyl, LP, Album, Repress, Mono","This repress was likely released in 1962/3 - transition labels

Side 1 label: No Deep Groove - NEW YORK USA
side 2 label: Deep Groove - 47 WEST 63rd - NYC
® under the E of Note on both sides

RVG and Plastylite 'P' in runout and also what looks like 9M scratched in on Side 1

Blue Note Records Inc., on the bottom rear of cover
Recorded on April 14, 1957.",Jazz,1962,Hard Bop,"Rated 3.80 of 5 votes (35 have, 94 want)",Very Good Plus (VG+),Sleeve: Very Good (VG),98.8%,"Van Gelder Studio, Hackensack, New Jersey",Plastylite,$120.00
Miles Davis – Ascenseur Pour L'Échafaud,Fontana – 660 213 TR,Germany,"Vinyl, LP, 10"", Album, Mono","""Lift To The Gallows"" subtitled on cover
""Fahrstuhl zum Schafott"" subtitled on labels

Artist on labels: Das Miles-Davis-Quintett

Printed in Holland (on cover)","Jazz, Stage & Screen",1958,"Hard Bop, Soundtrack, Modal","Rated 4.91 of 11 votes (55 have, 355 want)",Very Good (VG),Sleeve: Very Good (VG),99.2%,nan,Philips Phonografische Industrie,$111.15
Hank Mobley Quintet* – Mobley's 2nd Message,Prestige – PRLP 7082,US,"Vinyl, LP, Album, Mono","Recorded July 27, 1956.

Prestige Records Inc. - 446 W. 50th St., N.Y.C.",Jazz,1957,Hard Bop,"Rated 4.50 of 8 votes (53 have, 165 want)",Good (G),Sleeve: No Cover,100.0%,"Van Gelder Studio, Hackensack, New Jersey",nan,$120.00
The Miles Davis Quintet – 'Round About Midnight,"Columbia – YS 302, CBS – YS-302",Japan,"Vinyl, LP, Album",nan,Jazz,1964,Hard Bop,"Rated 5.00 of 1 votes (7 have, 199 want)",Near Mint (NM or M-),nan,50.0%,nan,nan,$120.00
Donald Byrd – Royal Flush,Blue Note – BLP 4101,US,"Vinyl, LP, Album, Mono","Recorded on September 21, 1961.",Jazz,1961,"Hard Bop, Soul-Jazz, Post Bop","Rated 4.68 of 22 votes (151 have, 357 want)",Good Plus (G+),Sleeve: Very Good (VG),100.0%,"Van Gelder Studio, Englewood Cliffs, New Jersey",nan,$115.38
Bobby Hutcherson – Components,Blue Note – BLP 4213,US,"Vinyl, LP, Album, Mono","Recorded on June 10, 1965.

""VAN GELDER"" is stamped into the run out groove of both sides.

Label is blue and white, with ""Blue Note Records Inc • New York USA"".

Back cover reads ""43 West 61st St., New York 23"".",Jazz,1966,"Post Bop, Avant-garde Jazz, Hard Bop","Rated 4.70 of 23 votes (160 have, 497 want)",Good Plus (G+),Sleeve: Near Mint (NM or M-),99.9%,"Van Gelder Studio, Englewood Cliffs, New Jersey",nan,$113.29
The Miles Davis Quintet – Cookin' With The Miles Davis Quintet,"Prestige – 7094, Prestige – PRLP 7094",US,"Vinyl, LP, Album, Mono, Secondary Pressing Ring","Prestige fireworks labels and deep groove pressing with secondary dime-sized pressing indentation around side B spindle hole and ""446 West 50th Street, New York 19, N.Y."" address.

Laminated front cover and ""PRESTIGE RECORDS, INC. 447 West 50th Street, New York 19, N.Y."" address on back cover.

AB etches for Abbey Record Mfg. press (also identifiable by secondary pressing ring on side B), and RVG stamps in runouts.

Recorded on October 26, 1956.",Jazz,Jul 1957,Hard Bop,"No Rating Yet (3 have, 47 want)",Very Good (VG),Sleeve: Very Good Plus (VG+),100.0%,nan,"Abbey Record Manufacturing Co., Inc.",$120.00
The Horace Silver Quintet & Trio* – Blowin' The Blues Away,Blue Note – BLP 4017,US,"Vinyl, LP, Album, Mono, Microgroove","Recorded on August 29 (A1, B2) and 30 (A3, A4, B1) and September 13 (A2, B3), 1959.

Blue Mitchell performs by courtesy of Riverside Records.

RVG stamped and ""P"" etched for Plastylite, usually wrongly called ""ear"", in the run out grooves of both sides.

Deep grooved blue and white labels with ""Blue Note Records Inc • 47 West 63rd • NYC"" address, both sides.

Back cover reads ""47 West 63rd St., New York 23"".",Jazz,Oct 1959,Hard Bop,"Rated 4.62 of 78 votes (682 have, 361 want)",Very Good (VG),Sleeve: Very Good Plus (VG+),99.9%,"Van Gelder Studio, Englewood Cliffs, New Jersey",Plastylite,$119.00
The Miles Davis Quintet – Cookin' With The Miles Davis Quintet,"Prestige – PRLP 7094, Prestige – Prestige 7094",US,"Vinyl, LP, Album, Mono, Repress","Labels: PRLP 7094
Spine and front/rear jacket: Prestige 7094

Recorded on October 26, 1956.

Second press address for this release.
Labels read:
Prestige Records, Inc.,
203 South Washington Ave, Bergenfield NJ",Jazz,1958,Hard Bop,"Rated 4.82 of 34 votes (315 have, 259 want)",Very Good (VG),Sleeve: Very Good (VG),99.7%,nan,"Abbey Record Manufacturing Co., Inc.",$120.00
Miles Davis – Jazz Track,Columbia – CL 1268,US,"Vinyl, LP, Promo, Mono, Terre Haute","Promo with ""Red & White 6 Eye"" label. ""Demonstration Not For Sale""

NOTE: track B2 is called ""Put Your Little Foot Right Out"" on this only.

The Jazz Track LP compilation is made up of two unrelated studio sessions.
The A Side Recorded on Dec 4, 1957, is devoted to ten songs composed by Miles Davis for the soundtrack to the French film ""L'Ascenseur Pour l'Echafaud"".
The B Side represents only a portion of the May 26, 1958, studio session that has since been reissued in full on CD.",Jazz,Nov 1959,Hard Bop,"Rated 4.67 of 9 votes (80 have, 83 want)",Very Good Plus (VG+),Sleeve: Near Mint (NM or M-),97.6%,nan,"Columbia Records Pressing Plant, Terre Haute",$120.00
Miles Davis All Stars – Walkin',"Prestige – 7076, Prestige – PRLP 7076",US,"Vinyl, LP, Album, Repress, Mono","Yellow deep groove Prestige fireworks label with ""203 South Washington Ave. Bergenfield, N.J."" address on the labels, second pressing. Small secondary pressing ring around side B spindle hole attributed to Abbey Record Manufacturing.

Laminated front cover. Back cover has ""PRESTIGE RECORDS, INC., 447 West 50th Street, New York 19, N.Y."" address along bottom.",Jazz,1959,Hard Bop,"Rated 4.39 of 38 votes (347 have, 188 want)",Very Good Plus (VG+),Sleeve: Very Good Plus (VG+),97.8%,nan,"Abbey Record Manufacturing Co., Inc.",$119.00
"Sonny Rollins – Original Music From The Score ""Alfie""",Impulse! – A-9111,US,"Vinyl, LP, Album, Mono, Gatefold","Recorded January 26, 1966.

Original mono US release.

No pressing plant is indicated in the runouts.",Jazz,1966,"Hard Bop, Post Bop","Rated 4.64 of 36 votes (301 have, 254 want)",Near Mint (NM or M-),Sleeve: Very Good Plus (VG+),99.9%,nan,nan,$111.11
The Cannonball Adderley Quintet Featuring Nat Adderley – The Cannonball Adderley Quintet In San Francisco,"Riverside Records – RLP 311, Riverside Records – RLP 12-311",US,"Vinyl, LP, Album, Mono","Recorded live at The Jazz Workshop, San Francisco; October 18 and 20, 1959.",Jazz,1960,Hard Bop,"Rated 4.13 of 47 votes (430 have, 108 want)",Very Good Plus (VG+),Sleeve: Very Good Plus (VG+),99.6%,"The Jazz Workshop, San Francisco",nan,$120.00
Jay Jay Johnson* – The Eminent Jay Jay Johnson Volume 1,"Blue Note – BLP 1505, Blue Note – 1505",US,"Vinyl, LP, Compilation, Repress, Mono","Side 1: WOR Studios, NYC, June 22, 1953.

Side 2: Rudy Van Gelder Studio, Hackensack, NJ, September 24, 1954.

Liberty Records repressing",Jazz,1967,"Bop, Hard Bop","Rated 3.50 of 4 votes (34 have, 44 want)",Very Good (VG),Sleeve: Very Good Plus (VG+),100.0%,WOR Studios,nan,$119.00
The Horace Silver Quintet Plus J.J. Johnson – The Cape Verdean Blues,Blue Note – BLP 4220,US,"Vinyl, LP, Album, Mono","J.J. Johnson performs by courtesy of RCA-Victor Records.

Label information:
33 1/3 Microgroove Long Playing
Blue Note Records Inc - New York USA

Sleeve Information:
For Complete Catalog Write To Blue Note Records Inc., 43 West 61st St., New York 23

Matrix/Runout Information:
Ear symbol on both sides",Jazz,Dec 1965,"Hard Bop, Post Bop, Latin Jazz","Rated 4.50 of 50 votes (348 have, 321 want)",Very Good (VG),Sleeve: Very Good (VG),100.0%,"Van Gelder Studio, Englewood Cliffs, New Jersey",Plastylite,$120.00
Booker Ervin – The Freedom Book,Prestige – PR 7295,US,"Vinyl, LP, Album, Mono","Recorded at Van Gelder Studio, Englewood Cliffs, NJ; December 3, 1963.",Jazz,1964,Hard Bop,"Rated 4.46 of 13 votes (50 have, 178 want)",Very Good (VG),Sleeve: Very Good (VG),99.6%,nan,nan,$119.00
Max Roach – Drums Unlimited,Atlantic – SD 1467,US,"Vinyl, LP, Album, Stereo","Gatefold jacket.
Recorded October 14, 1965 and April 25, 1966.",Jazz,1966,Hard Bop,"Rated 4.25 of 48 votes (466 have, 300 want)",Very Good Plus (VG+),Sleeve: Near Mint (NM or M-),99.3%,nan,nan,$117.00
John Coltrane – My Favorite Things,Atlantic – 1361,US,"Vinyl, LP, Album, Mono, Laminated Cover, Scranton Press","1961 US Atlantic Records 1st label variation edition. Released with a laminated cover in a heavy cardboard jacket, with a small ring impression on red, purple and white colored fan logo on the center record labels.

The outline of an ""anvil-lathe"" stamped within the matrices indicates this is a Capitol Records Pressing Plant, Scranton pressing.

Recorded at Atlantic Studios, New York, NY
Track A1 on October 21, 1960
Track B1 on October 24, 1960
Tracks A2 & B2 on October 26, 1960

Publishers:
A1: Williamsson, ASCAP
A2: Chappell, ASCAP
B1: Gershwin Pub., ASCAP
B2: New World, ASCAP",Jazz,1961,"Hard Bop, Modal","Rated 4.41 of 27 votes (361 have, 639 want)",Very Good (VG),Sleeve: Very Good (VG),97.6%,Atlantic Studios,"Capitol Records Pressing Plant, Scranton",$120.00
Sonny Rollins – Tour De Force,Prestige – PRLP-7126,US,"Vinyl, LP, Album","Recorded in Hackensack, NJ; December 7, 1956.",Jazz,1958,"Bop, Hard Bop","Rated 4.53 of 15 votes (88 have, 155 want)",Good Plus (G+),Sleeve: Very Good Plus (VG+),100.0%,"Van Gelder Studio, Hackensack, New Jersey",nan,$120.00
Miles Davis Sextet* – Someday My Prince Will Come,Columbia – CS 8456,US,"Vinyl, LP, Album, Stereo","Early pressing variant released on a '6-eye' label.

The text layout used on the labels is different on this version.
The title appears in three lines instead of two.

Has the number ""4"" printed in the lower right corner of the back sleeve.
This is a printing plant code. The exact identity of this plant is unknown.",Jazz,1961,Hard Bop,"Rated 4.42 of 57 votes (655 have, 268 want)",Very Good Plus (VG+),Sleeve: Very Good Plus (VG+),99.9%,nan,nan,$120.00
Lee Morgan – The Sidewinder,"Blue Note – BST 84157, Blue Note – ST-84157, Blue Note – 84157",US,"Vinyl, LP, Album, Stereo","First US Stereo release with ""Blue Note Records, Inc. • New York USA"" printed on labels and the Plastylite ""ear"" etching in the runout. No deep groove on either label.

First catalog number on center labels, second on back sleeve, third on front sleeve.

Barry Harris performs courtesy of Riverside Records.",Jazz,1964,Hard Bop,"Rated 4.72 of 109 votes (965 have, 810 want)",Very Good Plus (VG+),Sleeve: Very Good Plus (VG+),99.4%,nan,Plastylite,$115.00
"Jimmy Smith – A Date With Jimmy Smith, Vol. 1","Blue Note – 1547, Blue Note – BLP 1547",US,"Vinyl, LP, Album, Mono, W63/NY Transition","This edition has New York USA label side 1, 47 West 63rd label side 2. Both labels are deep groove, RVG etched, and ear mark. Cover says Blue Note Records Inc., 43 West 61st St., New York 23. I am unsure of the release date, but this was definitely made between 1962-1965.",Jazz,1962,Hard Bop,"Rated 5.00 of 1 votes (0 have, 3 want)",Very Good Plus (VG+),Sleeve: Near Mint (NM or M-),98.2%,nan,Plastylite,$120.00
Miles Davis – Milestones,Columbia – CL 1193,US,"Vinyl, LP, Album, Mono","""Nonbreakable"" 6-eye label variant. This version does not credit Gillespie under Two Bass Hit.",Jazz,1958,Hard Bop,"Rated 4.73 of 11 votes (134 have, 233 want)",Very Good Plus (VG+),Sleeve: Very Good (VG),100.0%,Columbia 30th Street Studio,"Columbia Records Pressing Plant, Bridgeport",$120.00
Yusef Lateef – This Is Yusef Lateef,Riverside Records – R 3011,US,"Vinyl, LP, Album, Promo, Reissue, Remastered, Mono",nan,Jazz,1968,Hard Bop,"No Rating Yet (5 have, 30 want)",Near Mint (NM or M-),Sleeve: Very Good Plus (VG+),98.8%,nan,nan,$115.00
Jimmy Smith – The Sounds Of Jimmy Smith,Blue Note – BLP 1556,US,"Vinyl, LP, Album, Reissue","Recorded on February 11-13, 1957 at Manhattan Towers, New York City.

W 61st Street, microgroove",Jazz,1963,"Hard Bop, Soul-Jazz","No Rating Yet (32 have, 41 want)",Very Good Plus (VG+),Sleeve: Very Good Plus (VG+),100.0%,nan,nan,$120.00
The Jamaican Jazz Crusaders – A Live Interview And Set With The Jamaican Jazz Crusaders,JMA Records – JLP 11-101,US,"Vinyl, LP",nan,"Jazz, Non-Music",1969,"Interview, Hard Bop","Rated 4.25 of 8 votes (48 have, 82 want)",Very Good Plus (VG+),Sleeve: Very Good Plus (VG+),99.8%,nan,nan,$119.99
